Title,Edit_Date,Origal_Date,Link,Content
‘It Ends With Us’ was already problematic. Blake Lively’s press tour made it worse.,Not Avaiable For MSNBC,"Aug. 27, 2024, 3:32 PM PDT",https://www.msnbc.com/opinion/msnbc-opinion/colleen-hoover-blake-lively-it-ends-with-us-booktok-rcna168452,"When Colleen Hoover self-published her first young adult novel, “Slammed,” in early 2012, she was living in a single-wide trailer with her husband and three sons. She made $30 in royalties and was thrilled: It was enough to pay the water bill. Hoover didn’t have a publisher, an agent or a sweeping media tour. She didn’t have rave reviews from book critics at The New York Times or The Atlantic (and she still doesn’t). But less than a year later, “Slammed” made it to the New York Times bestseller list. Since then, Hoover has published 26 novels, outselling James Patterson and John Grisham combined. Hoover’s success is partially due to a literary industry now dominated by women — women readers, women publishers and women authors. According to a 2023 study from the National Bureau of Economic Research, women publish more than half of all novels today, and they sell more books than the average male author. This is a relatively new phenomenon, of course. In conjunction with access to the birth control pill, safe abortion and higher education, women’s book publishing exploded in the 1970s. The rest of Hoover’s success is due to passionately loyal fans who evangelize for her on book-centric corners of the internet, including BookTok and Bookstagram. In 2022, well over a million viewers watched TikTok user Eloise Hampson’s tearful time-lapsed videos chronicling her emotional reactions to reading “It Ends With Us” — clutching the purple-and-white cover of the novel. Posts on CoHo, Hoover’s internet nickname and corresponding hashtag, will often involve tears. CoHo continually holds a spot as BookTok’s top read. It’s a chicken-and-egg question: BookTokers know CoHo content will generate likes, views and maybe even a viral payday. Whether or not they actually like her books comes secondary. “It Ends With Us,” Hoover’s top-selling and most literary novel, centers on a florist named Lily Bloom who finds herself at the center of a complicated love triangle between her protective first love and her abusive husband. It starts like a classic romance novel — chance encounter, slow-burn flirtation, passionate sex scene — and shifts to a serious look at abuse. “It Ends With Us” grapples with domestic violence with an intimate partner, generational cycles of abuse, identity, family and love. But many people reading this will know that already. The movie adaption, starring Blake Lively and Justin Baldoni, premiered in early August and quickly exposed a dilemma. As massive as Hoover’s online cult following has become, BookTok culture and fandom did not translate well to a mainstream audience. The book’s Hollywood treatment began with side-eye from Hoover’s BookTok legion for casting choices — particularly for Lively. The media tour was marred by controversy: Questions swirled over a possible cast dispute between Lively and Baldoni, and Lively was lambasted for the way she answered media questions regarding the sensitive topics the movie addresses, namely domestic violence. One particularly damning TikTok on the movie’s promotional page shows Lively, in full glam makeup and wearing a Dauphinette skirt set and chainmail top, cheerfully advising fans to “grab your friends, wear your florals and head out to see it.” Hoover is perched beside Lively in a purple floral Tommy Hilfiger dress appearing to endorse Lively’s tone-deaf messaging. Other choices have irked Hoover’s fan base. Last year, in the lead-up to the film, Hoover announced the release of a coloring book based on the character of Lily Bloom. After immense backlash, Hoover, and her publisher, Atria Books, canceled the publication. The movie drove new potential readers, who aren’t swayed by the powers of BookTok, to pick up their own copy of “It Ends With Us.” The result was an onslaught of fresh criticism for the novel. Readers slammed it as anti-feminist, misogynistic and glamorizing domestic violence. Particularly detrimental is the way the novel romanticizes the cliché dangerous-but-charismatic leading man and its blatant disregard of red flags that, off the page, often mean the difference between life and death for people in abusive relationships. Hoover’s books, for all of their wide-reaching success, are largely critically panned. Hoover’s writing style is juvenile and unpolished, and her dialogue is neither realistic nor particularly creative. But what Hoover does masterfully deliver again and again is emotional intensity, satisfying climactic moments — and lots of sex. Hoover’s writing reads like fan fiction. Although the genre existed well before the advent of the internet, its popularity exploded on chatrooms, message boards and literary subculture websites in the early aughts. Fanfic, a genre unto itself, is generally defined as amateur writers exploring different stories from the original source material (see: every iteration of ""Harry Potter"" romance imaginable on reading platform Wattpad), but now, fanfic as an adjective is synonymous with easy to read, hyperemotional, shallow and crass. There is a long history of disregarding literature written by women for women as vapid and inherently nonliterary. Last season on the ""Velshi Banned Book Club"" podcast, I wrote and produced an episode dedicated to defending so-called chick lit. If a woman enjoys a book, that is justification enough. “It Ends With Us” certainly exists in that space, and the literary merit of the book comes well below the book’s cultural relevancy. Hoover’s books aren’t popular because the writing is so good or the characters are so interesting or the dialogue is so engaging; they’re popular because of internet inertia. The rise of women readership, the normalization of fanfic and the command of BookTok has made for the perfect wet and dark environment for CoHo to thrive. Culturally, for a certain, growing demographic of women, Hoover has become a touchstone, a shared part of society, that is all but required for internet fluency and in-the-know conversation. Hoover proves, with her books and soon-to-be fleet of movie adaptions, that virality, buzz and internet adoration doesn’t equal quality (or taste). Hoover’s problematic writing and behavior still bear a cultural impact. Will this ultimately negatively affect Hoover’s overall success or following? When it comes to BookTok, online lit culture and book sales, definitely not."
Obama’s social media warning had Musk’s and Zuckerberg’s names written all over it,Not Avaiable For MSNBC,"Aug. 27, 2024, 3:25 PM PDT",https://www.msnbc.com/the-reidout/reidout-blog/obama-dnc-social-media-musk-zuckerberg-actblue-rcna168512,"Happy Tuesday. Here’s your Tuesday Tech Drop, a grouping of top stories from the past week found at the intersection of politics and the all-inclusive world of technology. Former President Barack Obama’s cutting, suggestive joke about Donald Trump’s obsession with … crowd … size seems to have been the most widely shared clip from his rousing speech last week at the Democratic National Convention. I certainly found it funny. But I don’t think that should overshadow his critical comments about social media and the provocateurs in the political sphere — like Trump — who use such platforms to sow division and enrich themselves. Hearing that, it was hard for me not to also think of Big Tech powerbrokers like Elon Musk and Mark Zuckerberg; people who’ve either deliberately used their platforms to benefit Trump or whose platforms have been used by bad actors to try to help him. And knowing the role that social media played in Obama’s political rise, I always find it interesting to hear him speaking critically of the types of platforms he once used to reach the masses. Here’s the line: Trump’s tour of the bro-ey podcast circuit continued over the past week, as his campaign tries to woo (chronically online) young men. Over at The Atlantic, Helen Lewis wrote about one of his more recent stops, an interview with comedic influencer Theo Von. Read more at The Atlantic. Fundraising platform ActBlue has provided a boon for Democrats ever since President Joe Biden suspended his re-election campaign and Vice President Kamala Harris entered the race. And Republicans seem to want to slow that momentum with investigations stemming from baseless allegations of impropriety. Fast Company published a breakdown of the ways that conservatives at the state and federal level are launching investigations into ActBlue. Read more at Fast Company. The founder of the Telegram messaging platform, which is known for being a hub for right-wing misinformation and pro-Russian propaganda, was arrested in France on Saturday over an investigation into alleged criminal activity said to have been conducted on the app. Pavel Durov, who launched Telegram in 2013, was being held in custody as of Tuesday afternoon but had not been charged with a crime. In a statement Sunday, Telegram said it’s “absurd to claim that a platform or its owner are responsible for abuse of that platform.” Read more at The New York Times. Actor Jenna Ortega, who stars in the upcoming film “Beetlejuice Beetlejuice” and the Netflix series “Wednesday,” revealed that she deleted her then-Twitter account after seeing explicit AI-generated images of herself as a child. Read more at NBC News. The World Bank suspended its advertising on X after CBS News discovered that the organization was being promoted alongside a racist post from an account known to spread neo-Nazi content. Read more at CBS News. Wired has a report on efforts made by pro-Trump figures in Silicon Valley to minimize or sanitize Trump’s infamous claim that there were “very fine people on both sides” of the deadly Unite the Right rally held by white supremacists in Charlottesville, Virginia, in 2017. Read more at Wired."
Jack Smith files new indictment in Trump election subversion case,Not Avaiable For MSNBC,"Aug. 27, 2024, 1:29 PM PDT / Updated Aug. 27, 2024, 3:07 PM PDT",https://www.msnbc.com/deadline-white-house/deadline-legal-blog/trump-jack-smith-superceding-indictment-jan-6-election-case-rcna168502,"Special counsel Jack Smith filed a new indictment against Donald Trump in the federal Jan. 6-related prosecution on Tuesday. The superseding indictment presents the same four charges, albeit in a shorter indictment, against the former president. Smith explained in an accompanying filing that the superseding indictment was presented to a new grand jury that hadn’t previously heard evidence in the case and that it “reflects the Government’s efforts to respect and implement the Supreme Court’s holdings and remand instructions in Trump v. United States,” referring to the July 1 immunity ruling. In that ruling, the Republican-appointed majority said that Trump is absolutely immune for “core” constitutional acts, presumptively immune for all official acts but not immune for unofficial ones. The Supreme Court sent the case back to the trial court to determine what in the indictment survives the immunity ruling, a process that still needs to get underway. The latest indictment attempts to get ahead of that process by slimming down details from the initial indictment last year that the government thinks could have been objectionable under the immunity ruling. For example, in describing the alleged conspiracy to overturn the 2020 election, the superseding indictment emphasizes that Trump’s alleged co-conspirators weren’t government officials at the time and were acting in their private capacity. That emphasis wasn’t included in the initial indictment. Likewise, the special counsel's office removed from its list of unindicted co-conspirators an unnamed Justice Department official — believed to be Jeffrey Clark — whom the initial indictment said “worked on civil matters and who, with the Defendant, attempted to use the Justice Department to open sham election crime investigations and influence state legislatures with knowingly false claims of election fraud.” A joint status report detailing how the parties want to proceed is due Friday to the trial judge, U.S. District Judge Tanya Chutkan; Chutkan gave the Friday deadline before the superseding indictment was issued. Chutkan had extended the deadline after Smith asked for more time to formulate the government's position — time the Justice Department apparently spent getting this superseding indictment. While the new indictment may put the government in a better position to survive the immunity test, the Supreme Court will likely have the last word on the degree to which this superseding indictment can go forward to trial. That final determination won’t likely occur before November, and if Trump wins the presidency, he will be empowered to get rid of the case completely. Subscribe to the Deadline: Legal Newsletter for updates and expert analysis on the top legal stories. The newsletter will return to its regular weekly schedule when the Supreme Court’s next term kicks off in October."
"In a critical year, we can't sleep on the GOP's state-level chaos",Not Avaiable For MSNBC,"Aug. 27, 2024, 3:05 PM PDT",https://www.msnbc.com/rachel-maddow-show/maddowblog/republican-party-chaos-swing-state-election-rcna168488,"This is an adapted excerpt from the Aug. 26 episode of ""The Rachel Maddow Show."" In a presidential election year, all eyes, understandably, are often on the two major-party presidential campaigns. But in an election year like this, with just two months to go until the big day, may I also suggest that you do not sleep on what is happening in the states — because sometimes what’s happening in the states seems like it can’t possibly actually be happening.  Take what happened this past weekend in Michigan. On Saturday, former Michigan Republican Party chair Kristina Karamo was escorted out of the state GOP convention by police. As The Detroit News reports: Karamo was elected in 2023 and removed in January of this year. However, she refused to go. In February, a court ruled that she had been removed in accordance with party bylaws, but, as of this summer, she was still trying to get courts to reinstate her as Michigan party chairman. Did I mention that this is one of the most important states in the country for the presidential race?  We pay so much attention to how the two parties’ presidential campaigns compete against each other in various swing state polls, but it’s also worth noticing when things are absolutely bananas with one of the parties in those states. Not long after the Michigan Republican Party went to war with itself, a version of the same thing happened in Florida. Right after Michigan threw out their state Republican Party chair, Florida fired theirs too — following news reports that he was being investigated by police for allegations of rape. Police also said they were investigating Christian Ziegler for video voyeurism charges for allegedly illegally recording a sexual encounter without consent. They later cleared Ziegler of charges in both investigations. Then, right on the heels of that, Republicans in Arizona lost their state party chair after GOP Senate candidate Kari Lake released secretly recorded tapes of Jeff DeWit in which she said he was trying to bribe her. She also reportedly threatened to release more tapes of him. Then the national Republican Party lost its chair. Ronna McDaniel was pushed out — or resigned — apparently to make room for Donald Trump’s daughter-in-law. Lara Trump’s experience for the job included ... being a singer. Additionally, she’s married to one of Trump’s sons — the blonde one. So that seems like a totally legit, noncontroversial, meritocratic choice for the leadership of the national Republican Party. This has all happened this year, in 2024: Michigan, Florida, Arizona and the national Republican Party all lost their leadership under embarrassing, if not terrible, circumstances, all in an election year.  Now it’s happened again, this time in Colorado. On Saturday, Colorado Republican Party members met to vote out the state chairman, Dave Williams, who they said was destroying the party. Williams is now refusing to recognize the validity of the vote to remove him — because of course. He called the meeting on Saturday “illegitimate.” As of Sunday, the day after they voted to fire him, Williams at least still had custody of the Colorado Republican Party letterhead, on which he released a statement that said his firing was a sham and he was still in charge. So you have one person who says she’s still the chair of the Republican Party in Michigan, who was escorted out of the state convention by cops this weekend, while fists flew. And you have another person, who says he’s still the chair of the Republican Party in Colorado, even after he was voted out by other Republicans.  Doesn’t it seem like a great idea to put these folks in charge of the whole country? Join Rachel Maddow and many others on Saturday, Sept. 7, in Brooklyn, New York, for “MSNBC Live: Democracy 2024,” a first-of-its-kind live event. You’ll get to see your favorite hosts in person and hear thought-provoking conversations about what matters most in the final weeks of an unprecedented election cycle. Buy tickets here."
Jack Smith hits back at Judge Cannon's nonsensical ruling,Not Avaiable For MSNBC,"Aug. 27, 2024, 3:01 PM PDT",https://www.msnbc.com/top-stories/latest/jack-smith-judge-aileen-cannon-classifed-documents-donald-trump-rcna168473,"This is an adapted excerpt from the Aug. 26 episode of ""The Last Word with Lawrence O'Donnell."" On Monday, federal prosecutors filed a brief urging an appeals court to reverse Judge Aileen Cannon’s dismissal of the classified documents case against Donald Trump. Last month, Cannon, a Trump appointee, tossed out the case and ruled that special counsel Jack Smith was unlawfully appointed and funded.  Now, some things in the law are open to debate and reasonable disagreement and others are not. Every method of interpretation of the law — whether it’s text, history or precedent — is devastating to Cannon’s decision. Smith could go into the 11th U.S. Circuit Court of Appeals blindfolded with his hands tied behind his back and he would still win this every day of every week. Smith acknowledged as much in Monday’s brief, using words like nonsensical, misguided, strained and erroneous to describe Cannon’s ruling. I’d pay good money to read the first draft of that brief because he probably used some words that weren’t quite so restrained.  The truth is, a first-year law student could dismantle Cannon’s opinion — frankly, even a pre-law student. You don’t have to go to law school to see the clear faults in her argument.  Just for starters, and this is a point Smith emphasized in his brief, in 1974 the Supreme Court issued a landmark ruling in the Watergate case. In that ruling, the judges took the very laws that Attorney General Merrick Garland cited for the appointment of Smith and agreed it gave the AG power to appoint a special counsel.  Cannon has argued the Supreme Court’s review of special counsel authority in that case was merely “dicta,” or a passing remark in the ruling that wasn’t necessary to the holding of the case. To put it mildly, that conclusion is nuts.  Cannon claims the special counsel was appointed illegally and therefore Smith has no authority to issue an indictment. Well, the same thing was true in the Richard Nixon case. Nixon argued the special prosecutor subpoena should be quashed — that it was outside the bounds of the law. But the Supreme Court disagreed, ruling that there are specific statutes that authorize the appointment of the special counsel, so the subpoena could not be quashed.  That’s just one of the many faults in Cannon’s ruling. With Smith’s brief now filed, I expect the 11th Circuit to reject her nonsensical opinion and get this case back on track. "
"Tuesday’s Mini-Report, 8.27.24",Not Avaiable For MSNBC,"Aug. 27, 2024, 2:30 PM PDT",https://www.msnbc.com/rachel-maddow-show/maddowblog/tuesdays-mini-report-82724-rcna168511,"Today’s edition of quick hits. * A superseding indictment: “Former President Donald Trump has once again been indicted for his efforts to overturn his 2020 presidential election loss, an effort which culminated in the Jan. 6 attack on the U.S. Capitol. A federal grand jury returned a superseding indictment that charges the former president with the same four counts he faced in the original indictment returned last August: conspiracy to defraud the United States; conspiracy to obstruct an official proceeding; obstruction of and attempt to obstruct an official proceeding; and conspiracy against rights.” * Consumer confidence: American consumers felt more confident in August as their outlook for the future improved. The Conference Board, a business research group, said Tuesday that its consumer confidence index rose to 103.3 in August from 101.9 in July. The index measures both Americans’ assessment of current economic conditions and their outlook for the next six months.” * Difficult diplomacy: “President Joe Biden’s top Middle East adviser on Tuesday held talks in Doha with senior Qatari leaders on the efforts to complete a cease-fire and hostage deal between Israel and Hamas as well as Qatar’s prime minister meeting this week with Iran’s president, according to a U.S. official.” * In related news: “Israeli forces rescued an Arab citizen of Israel during an operation in southern Gaza, the Israeli military said on Tuesday, more than 10 months after he was abducted alongside about 250 others during the Hamas-led attacks on Oct. 7.” * The latest Jan. 6 sentence: “The very first rioter to breach the U.S. Capitol during the Jan. 6 attack was sentenced to more than four years in federal prison on Tuesday after telling a judge that he still believes Donald Trump’s lies about the 2020 election ‘to this day.’” * Zelensky’s plan: “Ukrainian President Volodymyr Zelensky said Tuesday that this month’s lightning-fast incursion into Russia — where almost 600 Russian soldiers have been captured so far — is part of a larger plan to end the war in his country.” * Once this case was assigned to a Trump-appointed judge in Texas, the lawyers probably should’ve just started preparing the appeal: “A federal judge in the Eastern District of Texas on Monday temporarily blocked a Biden administration program that allowed undocumented immigrants married to U.S. citizens to apply for green cards without leaving the U.S.” * All is not well in Florida: “For years, L.G.B.T.Q. people planning a trip to Florida could turn to the official website for Visit Florida, the state’s tourism marketing organization, for resources on where to go, what to eat and where to stay. ... But sometime in the past few months, Visit Florida — a private-public, nonprofit partnership created by the Florida Legislature in 1996 — quietly took down pages with information for L.G.B.T.Q. travelers.” See you tomorrow."
Trump allies indicted in Arizona fake electors scheme get a 2026 trial date,Not Avaiable For MSNBC,"Aug. 27, 2024, 1:56 PM PDT",https://www.msnbc.com/top-stories/latest/arizona-fake-electors-2020-election-trump-allies-rcna168466,"A judge in Arizona has set a Jan. 5, 2026, trial date for allies of Donald Trump who have been charged for their roles as fake electors in a scheme to overturn the 2020 election results. At a hearing Monday, Arizona Superior Court Judge Bruce Cohen scheduled the criminal trial to begin just one day shy of the fifth anniversary of the Capitol riots, though he called the 2026 date a “moving target.” Arizona Attorney General Kris Mayes, a Democrat, in April announced the indictment of 18 Trump allies over their efforts to subvert the election results in the former president's favor. One of the defendants pleaded guilty this month, and another, lawyer Jenna Ellis, has agreed to cooperate with prosecutors in exchange for the dismissal of the charges. The remaining 16 defendants who face criminal charges include Trump's former personal lawyer Rudy Giuliani; Trump's former White House chief of staff Mark Meadows; Trump's former legal adviser John Eastman; and Christina Bobb, a lawyer who is currently spearheading the Republican National Committee's ""election integrity"" efforts. All of them have pleaded not guilty. The Arizona case is so far the only state-level criminal prosecution related to efforts to steal the 2020 election that has set a trial date. Trump is identified as a co-conspirator in the Arizona case, but he has not been indicted. Defendants on Monday also tried to argue for dismissal of the charges by claiming that they infringed on their First Amendment rights, a defense that cites the state's anti-SLAPP law. Cohen has indicated that he is open to the defense, Politico reported. As my colleague Steve Benen pointed out, the GOP has consistently rewarded alleged fake electors in several states, elevating them to prominent positions within the party. Some have been renominated as Republican presidential electors in the November election, and others — including several Arizona defendants — were picked as delegates at the Republican National Convention in Milwaukee in July."
