Title,Edit_Date,Origal_Date,Link,Content
What’s behind the incredible turnaround of the U.S. women’s soccer team,Not Avaiable For MSNBC,"Aug. 10, 2024, 3:00 AM PDT / Updated Aug. 10, 2024, 10:06 AM PDT",https://www.msnbc.com/opinion/msnbc-opinion/us-womens-soccer-brazil-olympics-soccer-final-rcna165777,"UPDATE (August 10, 2024, 1:06 p.m. ET): On Saturday, the U.S. women’s national soccer team defeated Brazil 1-0 to win the Olympic gold medal. This is Team USA’s fifth gold in the Summer Games and its first since 2012. Questions frequently surround the U.S. women’s soccer team after any disappointing result, but those questions have rarely been louder than after the 2023 FIFA Women’s World Cup last summer. The U.S. stumbled out in the round of 16, its worst finish ever at a major international tournament. Key stalwarts like Megan Rapinoe and Julie Ertz retired. Fans and critics alike wrung their hands about an uncertain future. As the gold medal match in the 2024 Olympics kicks off Saturday, the future now feels much more certain. After a 12-year absence from the Olympic finals, the U.S. will square off against Brazil in Paris. The team has been reborn under new head coach Emma Hayes, and a young roster has made the squad its own. How has one year made such a difference? The credit starts with Hayes, who came to the U.S. job with years of experience winning trophies at her former team, Chelsea FC. The hiring wasn’t entirely without risk: Hayes had never managed an international team, and her commitments with Chelsea meant she only had a few matches with the U.S. before the Olympics started. But the gamble paid off. Hayes built a reputation for making players feel as confident as possible about what they did on the field. And the quotes coming from the U.S. camp suggest Hayes has given them more belief than they have had in quite some time. “We’re a different team since she’s come in,” said star striker Sophia Smith after the U.S. beat Germany in extra time in the semifinal. “We just needed someone to come in and believe in us. … Emma’s doing exactly that.” Is the team winning because of confidence, or is it confident because it’s winning? Plenty of confident teams lose all the time, after all. What is clear is that Hayes is connecting with the players as individuals. Many coaches wouldn’t quietly surprise their players with a visit from a nail technician for manicures during the competition. The gold medal game will only be Hayes’ 10th game in charge, an unprecedented lack of time for a U.S. head coach at a major tournament. Things aren’t perfect yet, but the work she has done has already exceeded expectations. Hayes’ preference for youth over veteran presence has paid off as well, particularly with a reborn attack. Before the tournament, striker Alex Morgan, who has scored more than 120 goals for the U.S., was surprisingly excluded from the Olympic roster. But the forward line of Smith (23), Mallory Swanson (26), and Trinity Rodman (22) — the self-declared “Triple Espresso” — has scored or assisted 10 of the United States’ tournament-leading 11 goals. Swanson, returning after a yearlong injury layoff, fits Smith’s and Rodman’s playing styles like a glove. Their fluid movement and innate chemistry have made the U.S. more dynamic than it was a year ago. Admittedly, the U.S. has only scored two goals across the quarterfinal and semifinal. But it has been battling heat and fatigue, thanks to playing five games in 13 days, two of which went to extra time. The team will be at its most rested entering Saturday’s final. If the Olympics have seen the U.S. attack in third gear, imagine what the team will be like when it’s able to hit the turbo button. While the forwards may draw attention with their goals, it’s Smith’s good friend Naomi Girma’s defending that has made the U.S. so dominant in France this summer. Few defenders can cover as much ground as Girma does. Those who do usually get beaten by opposing attackers and leave their goalkeeper dangerously exposed. That never happens to Girma. Her positional discipline frequently cuts off dangerous attacks before they can even develop. When players do challenge her, she is never wrong-footed. When they run past her, she effortlessly catches up and wins the ball without fouling the opposition. “She’s the best defender I’ve ever seen,” Hayes said after the semifinal. “Ever.” The U.S. has conceded two goals all tournament and is the only team competing for a medal that hasn’t conceded in the knockout stage. Girma is a massive reason why. Just 24 years old, she’s probably the best defender in the world right now. What will happen on Saturday? There’s plenty of history between these two sides, including the gold medal games in both 2004 and 2008. The U.S. won both. More recently, the team also defeated Brazil 1-0 in the CONCACAF W Gold Cup final in March. Marta, arguably the greatest women’s soccer player of all time, will play her final game in a Brazil jersey and will have much of the crowd behind her team in Paris as Brazil tries to win its first-ever major title. With the Americans in the middle of a roster and coaching transition over the last year, nobody would have been surprised if they weren’t competing for a gold medal. But they are here, and they have reasserted their place among the absolute elite in international women’s soccer."
Chris LaCivita sunk John Kerry's presidential campaign. Now he's trying to 'Swift-boat' Tim Walz.,Not Avaiable For MSNBC,"Aug. 10, 2024, 6:51 AM PDT",https://www.msnbc.com/top-stories/latest/chris-lacivita-donald-trump-swift-boat-tim-walz-rcna166020,"This is an adapted excerpt from the Aug. 8 episode of “All In with Chris Hayes.” Last month, Donald Trump looked ready to cruise back to the Oval Office. And now, Republicans can’t get people to stop calling them weird. Trump is melting down at Mar-a-Lago as he watches his poll lead evaporate against Vice President Kamala Harris.  At a time like this, a lot of campaign gurus might throw their old playbook out the window. But not Chris LaCivita — senior adviser to the campaign, known by insiders as one of Trump's top guys and the former president’s co–campaign manager.  For two decades, LaCivita has connected big Republican donors with candidates in trouble and helped them win with cutting personal attacks against their opponents. It’s a weird career niche that started with one dark money campaign. Back in 2004, a Super PAC by the name of “Swift Boat Veterans for Truth” helped sink John Kerry’s presidential bid with a series of ads attacking the Democratic candidate’s military record.  And those ads were the work of LaCivita.  LaCivita’s attacks on Democratic candidates have, at times, even made his Republican clients uncomfortable. Early in his career, reporters described him as a “Republican hit-man,” using words like “hyperactive,” “manic” and “renegade.” And now, it appears LaCivita is running the old playbook, orchestrating the right-wing attacks on the 24-year military career of Harris’ running mate, Gov. Tim Walls of Minnesota. I've already debunked those attacks. They are gross. So far, outside of the angry right-wing social media hellscape, they aren’t really landing the way the attacks on Kerry did. But there's more: The guy who made those attacks against Kerry possible 20 years ago was a donor named Harlan Crow. Yes, that Harlan Crow: the billionaire who has lavished gifts on Supreme Court Justice Clarence Thomas for decades. Crow ultimately gave LaCivita’s “Swift-boat” group tens of thousands of dollars. What’s to stop him from doing that again?  It’s also worth mentioning that LaCivita isn’t just a Trump campaign aide. This year he also became the de facto COO of the Republican National Committee, which gives him control over its campaign spending. It's said everything old is new again ... that includes in politics. Join Chris Hayes, Rachel Maddow and many others on Saturday, Sept. 7, in Brooklyn, New York, for “MSNBC Live: Democracy 2024,” a first-of-its-kind live event. You’ll get to see your favorite hosts in person and hear thought-provoking conversations about what matters most in the final weeks of an unprecedented election cycle. Buy tickets here."
JD Vance is a bad nerd,Not Avaiable For MSNBC,"Aug. 10, 2024, 3:00 AM PDT",https://www.msnbc.com/opinion/msnbc-opinion/jd-vance-nerd-magic-gathering-rcna165881,"Since former President Donald Trump tapped him to be his running mate, Sen. JD Vance, R-Ohio, has become the poster child for the Democrats’ new favorite word — “weird” — as his stiff demeanor and atrocious policy beliefs have been placed center stage. It’s in this harsh spotlight another of Vance’s traits has come to the forefront: He’s a big ol’ nerd. There have been pieces written about his devotion to the classic fantasy series “The Lord of the Rings” and the way it’s shaped his worldview. More recently, he and his wife, Usha Vance, gave interviews talking about his time playing “Magic: The Gathering,” a card game that draws heavily on fantasy tropes. I want to underscore that these two descriptors — “weird” and “nerd” — are not synonymous. As a card-carrying nerd myself, I would have to say that Vance’s love of stereotypically geeky interests has nothing to do with his creepy tendencies. If anything, he has shown himself to be the worst kind of nerd, one who reinforces the toxic masculinity that was at one point inseparable from overarching geekdom. It is to Vance’s discredit that he will likely be unable to see how deeply his rejection of all things “woke” isolates him from a community that has come to embrace the “good weird” that doesn’t fit into his homogenized vision of America. Let’s start with Vance’s ties to M:TG (not the GOP congresswoman from Georgia). Earlier this week, an interview with Usha Vance aired on “Fox & Friends,” aimed at helping to soften her husband’s image and defend his now infamous “childless cat ladies” comments. “He has all sorts of dorky interests that anyone of our age could relate to,” she told Fox News host Ainsley Earhardt. Those interests, Earhardt told her co-hosts, include playing the collectable trading card game. Vance denied that it was a current interest when Semafor asked him about it Wednesday, calling it a “phase.” More interesting, though, was the reason he said he ditched the game: He may have meant it as a laugh line, but it speaks to something very real about how gatekeeping has worked in nerd spaces. It’s true that back when Vance would have been playing, as depicted briefly in the movie adaptation of his book “Hillbilly Elegy,” the game was not exactly popular among young women. Even as of 2015, only an estimated 38% of the game’s players were female, according to one of Magic’s designers. But arguably much of that was due to the self-reinforcing habits of male players who would scoff at any girl who could possibly try to compete against them. How many of the 15-year-old girls whom Vance wrote off as having no interest would have been interested in learning how to play alongside him? It’s only relatively recently that the game’s owner, Wizards of the Coast, itself a subsidiary of Hasbro, has realized how much of the population was being excluded from playing (and buying cards) thanks to the perceived gender norms around the game. Since then, it has moved to eliminate the sexist art that was the norm for the cards’ illustrations and tried to make the game feel more inclusive overall. It’s a shift that of course drew some backlash from the JD Vances of the world. Beyond this specific issue, I’d argue that Vance is bad at being a nerd, given how deeply he has clearly missed the point of “The Lord of the Rings.” J.R.R. Tolkien’s seminal work was born in part out of his view of the horrors of World War I. It stresses the need for fellowship among different groups against the forces of evil and a rejection of the desire for ultimate power. As The New York Times’ David French and Jamelle Bouie have separately noted, there’s little evidence that those messages sunk in with Vance. Vance shares that obliviousness with his benefactor, billionaire Peter Thiel, who made his fortune as an early investor in PayPal. After all, Thiel named his giant data analytics company Palantir after the all-seeing orbs that the villains use to spy on the heroes in “The Lord of the Rings.” As a reference, that’s a deep enough cut to really show off one’s geek credentials while displaying exactly zero comprehension about why Thiel’s pursuit of military contracts would be something that the story’s protagonists would frown upon. We can see this determination to miss the values for the merchandise among many branches of nerd culture. Recently, a post on Reddit’s r/Conservative message board detailed how a group of “Star Trek” fans were appalled to hear politics brought up at a Las Vegas convention. It’s truly a mystery as to how these supposed fans missed the very transparent left-wing tilt throughout the “Trek” franchise, which is set in a post-capitalist utopia where diversity is the greatest of strengths. Along with this purposeful blindness comes the lack of recognition from Vance and those like him that the nerds have won. Geek culture has become a pop culture Goliath. The most popular franchises in the world have realized that it matters that everyone gets to see themselves in the stories being told. For Vance and others, it’s not their interests in comic books or sci-fi that sets them apart now. What’s weird is their refusal to share that win with anyone who doesn’t fit the outdated stereotype of who and what a nerd is. Considering who Vance has become, it’s easy to clock the kind of nerd he once was. Over the last eight years, he’s transformed himself from someone who correctly saw Trump as a threat to the country into Trump’s potential vice president. Much like with Magic, he has opted to drop his morals like a bad habit, showing that he’s more than willing to shift and change himself to try to fit in with his chosen in-group. In doing so, he’s shown himself to be the kind of nerd who has chosen to punch down out of fear of being punched himself."
Elon Musk sues his critics into silence. So much for ‘free speech.’,Not Avaiable For MSNBC,"Aug. 10, 2024, 3:00 AM PDT",https://www.msnbc.com/opinion/msnbc-opinion/elon-musk-x-advertisers-lawsuit-social-media-rcna165605,"Elon Musk, self-proclaimed “free speech absolutist,” is demanding the government infringe on free speech rights. Again. Despite his posturing as a defender of free expression, Musk is one of the nation’s most vexatious litigants against anybody who exercises their First Amendment rights in a way he doesn’t like. His latest target is GARM, the Global Alliance for Responsible Media, an industry association of advertisers on online platforms of which X, formerly known as Twitter, is still a member. The lawsuit also targets several of GARM’s members for the supposed crime of declining to purchase ads on Musk’s website. X’s CEO, Linda Yaccarino, posted a video on Tuesday explaining that the suit is part of the company’s noble pursuit of preserving “the global town square … the one place that you can express yourself freely and openly.” Yaccarino wore a pendant around her neck that read “FREE SPEECH.” On Thursday, GARM, citing its inability to handle legal fees that would likely run into the seven figures, simply shut its doors, ending all operations. Musk’s censorial bullying worked — abusing the legal system to shut down his critics. Musk’s argument against GARM fits a long-running pattern for him: attacks on free speech wrapped in the rhetoric of defending free speech. Major corporations generally do not want to pay for ads running next to posts praising Adolf Hitler, among other noxious content that has flourished on X under Musk’s ownership. It’s hardly an unreasonable position, and GARM worked to promulgate shared standards companies can adopt for this type of brand safety. This, Musk alleges, amounted to a violation of antitrust laws. Deciding where to purchase ads is an exercise of core free speech and free association rights for any individual or organization. Boycotting X because it’s overrun with hate speech is no different from a conservative advocacy group declining to pay for ads on a progressive podcast. It’s also a case of business judgment for for-profit corporations. PetSmart might well choose to buy magazine ads in Cat Fancy rather than Cigar Aficionado, for example. It’s the latest in a long line of Musk lawsuits seeking to silence his critics, a tactic known as a strategic lawsuit against public participation, or SLAPP. He’s also sued Media Matters for documenting how X fails to keep ads from large corporations away from extremist content. In the same vein, he’s gone after the Center for Countering Digital Hate. He also endorsed the patently absurd criminal investigations into Media Matters launched by the Republican attorneys general of Texas and Missouri, already enjoined by a federal court as the obvious First Amendment violations they are. Sometimes Musk’s interest in promoting censorship extends beyond his own critics, such as when he agreed to pay the legal fees of a Canadian anti-vaxxer who had sued a wide range of people for being mean to her. For many years, actual free speech advocates have been pushing for anti-SLAPP laws, which make it easier to promptly dismiss and receive legal fees for litigation targeting constitutionally protected speech. Texas and California among other states have adopted these robust protections. Unfortunately, there is no national anti-SLAPP law for lawsuits based on federal law claims, such as Musk’s antitrust theory. Federal circuit courts are also divided on whether state anti-SLAPP laws can apply even to state law claims, such as defamation, being heard in federal court under interstate diversity jurisdiction. In the meantime, Musk’s anti-speech lawfare has its intended effect even when it could never plausibly reach a final decision in his favor. In addition to shutting down GARM, Media Matters recently laid off several employees, too, with many observers pointing to Musk’s litigation as a likely contributor. This is the defining feature of SLAPP strategy: process as punishment, ruining targets with the expense of fighting a case even when it lacks any legal merit. The tactic can be particularly effective aimed at nonprofits and individuals, whose relatively modest budgets simply cannot handle a protracted court battle with one of the world’s richest men. Beyond simply being a rich and powerful bully who can waste his own money on vexatious, performative litigation, Musk’s theory of “free speech” is a censorship wolf in sheep’s clothing. He and those he agrees with should be free to speak their minds, the thinking goes, but nobody else should be allowed to criticize or disassociate from them in response. If it falls under nebulous labels like “cancel culture” or the “woke mind virus,” your speech is actually bad for speech and so shouldn’t be allowed. It’s unabashedly statist in its eagerness to use and abuse government power to police the discourse. Musk is free to run his own website however he wants, as he should be. But his claims to be a champion of free speech are a hypocritical farce. In reality, he is one of the biggest enemies of the First Amendment, and should be recognized as such."
Joe Rogan broke MAGA world’s heart with his RFK Jr. support,Not Avaiable For MSNBC,"Aug. 9, 2024, 4:12 PM PDT",https://www.msnbc.com/the-reidout/reidout-blog/trump-joe-rogan-rfk-jr-maga-rcna166033,"Joe Rogan’s praise of independent presidential candidate Robert F Kennedy Jr. had Trump supporters up in arms on Thursday. Rogan’s far-right-friendly podcast, his peddling of outlandish conspiracy theories, and his alignment with the Ultimate Fighting Championship (an unmistakably pro-Trump organization) appear to have led some Trump supporters to believe Rogan would ultimately throw his support fully behind former President Donald Trump.  But when video surfaced of Rogan gushing over Kennedy and calling him “the only [candidate] that makes sense to me,"" popular voices among the MAGA faithful were quite unhappy.  The petulant kvetching from several prominent figures in the MAGA movement channeled the widespread rage at Rogan for what apparently felt like a betrayal.  Check out some examples of the morose MAGA reactions from far-right influencer Philip Buchanan (also known as Catturd), as well as right-wing conspiracy theorists Jack Posobiec and Mike Cernovich.  Facing backlash, Rogan sent out a tweet on Friday praising Trump and claiming his remarks about Kennedy being the only candidate that makes sense weren't really an endorsement. That doesn't seem to have satisfied Trump, who targeted Rogan on his social media platform. “It will be interesting to see how loudly Joe Rogan gets BOOED the next time he enters the UFC ring,” Trump posted from his Truth Social account.  Many conservatives were all-in on the idea of Kennedy’s campaign when he was running as a Democrat, because Kennedy's campaign was initially perceived as capable of helping Trump win by peeling off voters from what was then the Biden-Harris campaign. Kennedy, who was reportedly convinced to run for president by Trump adviser Steve Bannon, and whose campaign is largely being funded by uber-rich Trump-supporter Timothy Mellon, was effectively running an ostensibly liberal campaign with MAGA DNA. But ever since Kennedy decided to run as an independent instead — and as data show he’s likely to pull more voters from Trump than from Vice President Kamala Harris in the upcoming election — Republicans, including Donald Trump himself, have turned their ire on Kennedy and any MAGA-friendly figures who might back him."
Trump’s hopes in Arizona could be dimming. Here’s why.,Not Avaiable For MSNBC,"Aug. 9, 2024, 3:50 PM PDT",https://www.msnbc.com/the-reidout/reidout-blog/trump-arizona-2024-election-harris-rcna166027,"Momentum appears to be swinging in favor of Kamala Harris’ campaign in the Grand Canyon State. Although I’m not one who places a whole lot of stake in poll numbers, some of the recent numbers in Arizona have been favorable to the Democratic nominee. But there are other signs that Donald Trump’s electoral prospects could be dimming in the desert. One piece of evidence is the budding Republican support for Harris. John Giles, the Republican mayor of Mesa, recently endorsed the Harris campaign and agreed to co-chair an advisory committee for the national “Republicans for Harris” effort. Giles’ endorsement underscores two things in particular. First, it speaks to Arizona’s trend toward Democrats over the past decade. For instance, Mesa has gone from one of the most conservative cities in the country to one with more liberal leanings. And the endorsement also shows that a strain of anti-Trump conservatism remains in Arizona, where Trump’s attacks on the late Sen. John McCain have undermined his standing with some Republicans in the state. Senate candidate Kari Lake, another high-profile Republican on the Arizona ballot this fall, has garnered intraparty backlash herself for her attacks on McCain and fellow Republicans. Many in Lake’s own party are backing her Democratic opponent, Ruben Gallego. In fact, she might even be a drag on Trump’s election chances. And on top of that, on Friday, the Harris campaign received a historic endorsement from the League of United Latin American Citizens, the nation’s oldest and largest advocacy group for Latinos. That could prove very helpful in Arizona, where Latinos make up about a third of the population. Recent data on Latino voters indicates that Harris is attracting and energizing these voters in Arizona — where Latinos were vital in helping Joe Biden flip the state in 2020 — and other battleground states. Trump’s campaign and its surrogates have sought to make gains with Latino voters — albeit in some rather dubious ways. But if Harris is able to maintain the Latino support Biden received in 2020, or even expand it, that could prove calamitous for Trump’s electoral hopes in Arizona. Beyond that, Arizona residents will be voting on a ballot initiative that would enshrine abortion rights into the state constitution. With voters in other states siding with abortion-rights supporters on similar measures in recent years, this could create yet another hurdle for Trump in Arizona. None of this means Trump can’t win the Grand Canyon State. But he certainly hasn’t made it easy on himself."
Donald Trump’s Mar-a-Lago news conference simply wasn’t normal,Not Avaiable For MSNBC,,https://www.msnbc.com/opinion/msnbc-opinion/trump-news-conference-lies-unfit-rcna165885,               
