Title,Edit_Date,Origal_Date,Link,Content
Trump says civilian Medal of Freedom is 'much better' than Medal of Honor,Not Avaiable For MSNBC,"Aug. 16, 2024, 9:53 AM PDT",https://www.msnbc.com/top-stories/latest/trump-service-members-military-medal-of-honor-rcna166891,"Donald Trump appeared to denigrate service members who were injured or killed in the line of duty once again, as he likened a civilian award to a “better” version of the Medal of Honor at a campaign event on Thursday. At an event on antisemitism at his Bedminster golf club, the former president and presidential candidate was introduced by Miriam Adelson, a powerful financial force in Republican politics and the widow of the late GOP megadonor Sheldon Adelson. As he took the mic, the former president spoke highly of the couple and recalled awarding her the Presidential Medal of Freedom in 2018, an act that sparked criticism at the time that Trump was rewarding a donor for their financial support. “That’s the highest award you can get as a civilian. It’s the equivalent of the Congressional Medal of Honor, but civilian version,” Trump said, referring to the Medal of Honor, a military award. “It’s actually much better because everyone [who] gets the Congressional Medal of Honor, they’re soldiers. They’re either in very bad shape because they’ve been hit so many times by bullets, or they’re dead,” Trump said. “She gets it, and she’s a healthy, beautiful woman. And they’re rated equal, but she got the Presidential Medal of Freedom, and she got it for — and that’s through committees and everything else.” The GOP presidential nominee's off-the-cuff comments on Thursday follow a pattern of insulting veterans and service members, even as he claims to be a fierce supporter of the military. He has called military leaders “some of the dumbest people I’ve ever met in my life” and minimized potentially traumatic brain injuries among service members. In 2015, he infamously attacked Sen. John McCain for being detained in a North Vietnamese prison, saying he liked ""people who weren’t captured."" He also picked a personal fight with family members of a U.S. soldier who died while serving in Iraq. Trump has also long disputed a report from The Atlantic that he called service members who died in wars “losers” and “suckers,” though his former White House chief of staff John Kelly has confirmed some aspects of it."
Trump's immunity remark could be vindicated by the Supreme Court,Not Avaiable For MSNBC,"Aug. 16, 2024, 8:31 AM PDT",https://www.msnbc.com/deadline-white-house/deadline-legal-blog/trump-immunity-new-york-sentencing-supreme-court-rcna166886,"Donald Trump kept the fact-checkers busy with his latest public remarks on Thursday. But one of his statements, regarding the Supreme Court’s immunity ruling, is worth scrutinizing. Indeed, the statement may turn out to have some truth to it — not due to Trump’s honesty, but rather due to the vague and sweeping nature of the ruling itself. Standing outside of his New Jersey golf club, the GOP presidential nominee said, “As you know, the Supreme Court ruled recently on immunity, and I’m immune from all of the stuff that they charged me with.” Yes, the Supreme Court ruled on presidential immunity recently (July 1, to be exact). So far, so good. But that he’s “immune from all of the stuff that they charged me with” is not what the court said in the federal election interference appeal. Chief Justice John Roberts’ majority opinion said that there’s no immunity for unofficial acts, that there’s at least presumptive immunity for official acts, and that there’s absolute immunity for exercising the president’s “core constitutional powers.”   What does all that mean in practice? No one knows precisely, perhaps not even the Republican-appointed majority that laid out that new standard. The high court sent the case back to the trial court to figure it out “in the first instance.” So the extent that Trump’s immunity extends to the acts for which he's being prosecuted is yet to be determined. And whatever U.S. District Judge Tanya Chutkan decides in the first instance could wind up being vetted by the justices again before that trial can go forward. Of course, if Trump wins the election in November, then this may become legally moot, should he order the DOJ to withdraw his two federal criminal cases. (Special counsel Jack Smith is separately appealing U.S. District Judge Aileen Cannon’s dismissal of the federal classified documents case.) Both the timing and convoluted substance of the Supreme Court ruling, then, could amount to an effective grant of immunity to Trump if he’s able to crush his case before the Roberts Court even articulates more clearly the scope of that immunity. In fact, the ruling’s full effect isn’t even known in his New York criminal fraud case, where he wasn’t charged with official acts and was found guilty before the immunity ruling came out. The issue there stems from another odd feature of Roberts’ ruling, which curbs the use of official acts as evidence to prove guilt of unofficial acts — a point Trump’s lawyers have cited in an attempt to overturn his guilty verdicts prior to sentencing. Judge Juan Merchan in New York is set to rule on Trump’s immunity claim on Sept. 16 and sentence him on Sept. 18 if the immunity issue doesn’t stand in the way. But if Merchan rejects the immunity claim, Trump’s lawyers have signaled their intention to appeal immediately before any sentencing can happen — perhaps all the way to the Supreme Court. In all of Trump’s criminal cases, then, the extent of his immunity is a fact that only a Supreme Court majority can know.   Subscribe to the Deadline: Legal Newsletter for updates and expert analysis on the top legal stories. The newsletter will return to its regular weekly schedule when the Supreme Court’s next term kicks off in October."
The 7 things Democrats need to do ASAP if they win in November,Not Avaiable For MSNBC,"Aug. 16, 2024, 8:00 AM PDT",https://www.msnbc.com/opinion/msnbc-opinion/democrat-to-do-if-win-november-election-rcna166613,"We've all been there. The electrical outlet in the kitchen that no longer works, the squeaky floorboard, the oily spot on the wall in the basement. You put them on the to-do list and then ... never get around to them. Democrats in Congress have a similar list, but the consequences of their inaction could be much more dramatic: legislative stalemates, democratic backsliding and even economic collapse. It's been clear for a few years that American democracy is in need of repair. While it's tempting to dream about dramatic changes to the Constitution, such as eliminating the Electoral College or reforming the Supreme Court, the reality is that many of the most-needed changes are relatively small and straightforward. In fact, like a homeowner who's avoiding fixing the hallway light as they dream about adding a deck, the fact that these repairs are so mundane is a bit of an obstacle. No one runs for office on updating a dusty old statute. It's much more exciting to propose a constitutional amendment, even if that idea is going nowhere. But checking off some items on this to-do list would help prevent a future catastrophe. Here are seven simple things that Democrats should do: End the filibuster. If Democrats maintain control of the Senate, the first thing they need to do is end the absurd 60-vote threshold to pass laws. They already did away with the filibuster for confirming most federal judges in 2013, and Republicans followed suit in 2017 for Supreme Court justices. It doesn't make sense that passing a law would take more votes than giving someone a lifetime appointment to a job that they can then use to undermine those laws. End the debt ceiling. Even if Democrats win big in November, the odds are high that Republicans will win back a congressional chamber in two years. We've all seen what happens next: Republicans refuse to vote for a routine raising of the debt ceiling, leading to a needless legislative standoff that threatens the world economy. It's long past time to scrap this arbitrary limit, which has just encouraged hostage-taking and pointless brinkmanship. Automatically raise the minimum wage. The federal minimum wage is set by Congress, which only gets around to increasing it every few years. Lawmakers last raised it in 2009, which means it's actually been decreasing in value as inflation has eaten away at it, especially since the pandemic. Social Security benefits are automatically increased each year based on the cost of living. The minimum wage should be as well. Repeal the Comstock Act. This 1873 anti-obscenity law hasn’t been enforced in decades, but recently some conservative activists have sought to revive it to restrict access to abortion medication or even emergency contraception. While this idea hasn’t been tested in courts and certainly won’t be attempted by a Democratic White House, lawmakers should repeal this antiquated law and take that option off the table for good. Limit temporary Cabinet appointments. As president, Donald Trump took advantage of the process for naming acting Cabinet secretaries to circumvent Congress' constitutional role to ""advise and consent"" on appointments. Some of these appointees would not have been confirmed if they had been put up for a vote. Others clearly viewed the temporary appointment as an audition, making them much less likely to stand up to the president. Congress should reform the Vacancies Act. Protect civil servants. Trump also sought new ways to fire people in his administration, signing an executive order in 2020 that would have allowed him to dismiss tens of thousands of federal workers and replace them with loyalists. (One former Republican staffer memorably called those potential replacements “an army of suck-ups."") President Joe Biden repealed that order and sought to add new protections for civil servants, but Congress should pass a law definitively putting this idea to rest. Limit national emergencies. The law allowing presidents to declare national emergencies is in need of updating. Already poorly drafted, it has been reinterpreted and limited by court rulings that allow emergencies to be endlessly renewed. (One issued during the Iranian hostage crisis in 1979 is still in place.) Lawmakers from both parties are interested in giving Congress more power to end a national emergency. The list doesn't end here, of course. Congress will also need to consider more serious reforms, including updating voting rights laws, continuing to fight climate change and codifying abortion rights, to mention a few big-ticket items. Those efforts will require serious debate about the best approach and will likely take time and political will to muscle them through. The to-do list, meantime, is much simpler. If Congress makes most of these fixes, voters will hardly notice them. There will be no ribbon-cutting ceremony for updating an old law and no celebratory campaign ads for preventing a future catastrophe. But that can also be a reason for doing them since voters are also unlikely to get upset about them. And one day, when the storm clouds start gathering, they'll be thankful that they got around to fixing that hole in the roof."
Kamala Harris isn’t just listening to workers. She’s sounding like them.,Not Avaiable For MSNBC,"Aug. 16, 2024, 7:50 AM PDT",https://www.msnbc.com/opinion/msnbc-opinion/harris-walz-campaign-workers-movements-rcna166623,"With its rallies that pack arenas, Vice President Kamala Harris’ presidential campaign has harnessed an energy that many have compared to Barack Obama’s 2008 campaign. Polls in battleground states indicate that the dynamics of the presidential race have fundamentally shifted, but skeptics question if the good vibes can last once the vice president starts to detail policy. Is this burst of excitement, they ask, just the momentary enthusiasm of voters surprised by an unexpected transition? When we pay attention to what Harris and Walz have already said, though, it’s clear they have tapped the energy of worker-driven movements that want to create an economy that works for all of us. The good vibes and the economic vision of this campaign are, in fact, deeply connected. A case in point: The concluding line in Harris’ stump speech last week was echoed by cheering crowds in arenas across the nation. “When we fight, we win!” For those of us who have been supporting low-wage worker movements over the past decade, the slogan is familiar. It’s been a standard rallying cry since McDonald’s workers first organized the Fight for 15 in 2013. Since then, it has been used by service worker unions who have organized everyone from Waffle House servers to Dollar General clerks, Amazon warehouse workers, and graduate student workers on university campuses. “When we fight, we win!” as a slogan gives voice to the frustrations of the 135 million poor and low-income Americans who know that, even when they work two and three low-wage jobs, it’s impossible to get ahead. Not in an economy that has tilted to more explicitly favor billionaires over the past half-century. But “When we fight, we win!” also expresses the agency of working people who’ve stood up to their bosses and their anti-union culture in so-called “right to work” states like North Carolina to assert their power and win better wages and working conditions. Here in North Carolina, where Harris is expected to roll out her economic agenda today, we mobilized the same agency through “Moral Mondays,” which, like the McDonald’s workers’ fight, also began in 2013. When we hear Harris say, “We’re not going back!” we hear an echo of our movement’s cry: “Forward together, not one step back!” Based in Durham, the Union of Southern Service Workers has worked in recent years to unite a coalition of low-wage workers who have often been pitted against one another along racial and ideological lines. Black, white and brown workers have challenged the politics of division while also refusing the typical framing of left versus right and liberal versus conservative. There’s nothing “far left” or radical, they insist, about the people deemed “essential” during the pandemic insisting that they should earn enough from a week’s work to take care of themselves and their families. Despite the Senate’s refusal to raise the minimum wage during the Biden administration, the direct action of low-wage worker unions has helped lift 13 million Americans out of low-wage jobs over just the past two years. Service worker unions have harnessed the anger and disappointment that drive so many low-income Americans away from politics, but these workers aren’t just driven by feelings. As they have organized, they have also made proposals about practical changes that could make a difference in their lives. Harris and Walz have already demonstrated that they are listening to organized labor. In Detroit, they met with the United Auto Workers at their union hall and thanked their president, Shawn Fain, who had been on television the weekend before lobbying Harris to choose Walz as her running mate. The UAW understood him to be the most pro-union among her finalists. In Las Vegas, Harris promised to champion a proposed tax exemption for tips alongside her fight to raise the federal minimum wage. On Tuesday, Walz spoke to the American Federation of State, County and Municipal Employees (AFSCME) and pledged that a Harris-Walz administration would expand the pro-worker policies he has enacted in Minnesota to every state. Republican candidate Donald Trump, who tries to frame his divisive populism as “pro-worker,” claimed Harris stole the “no tax for tips” idea from him. But the concept, which has been developed as a policy proposal by Nevada’s two Democratic senators, originated with the Culinary Workers Union 226. Other tipped workers have advocated for One Fair Wage and won campaigns at the state level to eliminate subminimum wages for tipped workers. The details of policy matter, for sure, but this much is clear: The Harris-Walz campaign is listening to workers as it crafts its economic agenda. And it is already speaking the language of workers movements. In our work to organize poor and low-income Americans through the Poor People’s Campaign, we’ve seen how politicians who embrace the language of fusion movements for economic justice have the power to both tap into the moral concerns that drive millions of Americans and multiply the energy of grassroots organizing. In our new book “White Poverty,” we use data from the past three decades of U.S. elections to argue that infrequent, eligible low-income voters represent the largest potential swing vote in 2024. As we witness the groundswell of enthusiasm for the Harris-Walz ticket, we see more than good vibes. This is a campaign that has already tapped into the hopes of working people who, for decades, haven’t had a fair shot and is promising an agenda that could inspire them to show up for races down the ticket. We look forward to hearing the details, but we can already celebrate what low-income people across the nation see: A worker’s vision for the economy is already at the heart of this campaign."
Trump likes to act tough. Harris is proving her strength.,Not Avaiable For MSNBC,"Aug. 16, 2024, 3:00 AM PDT",https://www.msnbc.com/opinion/msnbc-opinion/trump-harris-tough-guy-act-crime-immigration-rcna166804,"Donald Trump is obsessed with toughness. He praises foreign despots for being strong, calls for police to be rough with suspects and uses blue-collar workers as props at his rallies. But Trump’s tough-guy persona is an act, and Democratic nominee Kamala Harris is calling him out on it. Her campaign and its allies are leaning into Harris’ background as a prosecutor, her advocacy in the Senate and her time as vice president to tout her strength. And they’re contrasting this with Trump’s empty rhetoric and record of failure to show that she’s actually the stronger, tougher candidate. Nowhere is this fight more clear than on immigration. During a rambling and glitch-delayed conversation with billionaire Elon Musk this week, Trump leaned into his usual attacks, falsely accusing Harris of serving as President Joe Biden’s “border czar.” For starters, that was never her title — and I should know, since I was working for her at the time. I served as Harris’ chief spokesperson when the president asked her to lead diplomatic efforts to tackle the “root causes” of migration. The vice president led these talks with our partners in Mexico and Central America, focusing on new strategies to expand economic opportunities in El Salvador, Guatemala and Honduras. So, who is stronger: the candidate who complains about border crossings before, during and after his presidency or the one who looks to figure out why they’re happening and work with foreign leaders to address the issue? But her record goes even further back. In a Harris-Walz campaign ad titled “Tougher,” a narrator lists her record as a border-state prosecutor. Harris held drug cartels accountable and jailed transnational gang members. The campaign ad also highlights her support for a bipartisan deal deemed the “toughest border control bill in decades.” The ad ends by declaring: “Fixing the border is tough. So is Kamala Harris.” Voters should know the truth: Trump’s weaknesses as a leader are part of the reason why Harris can play offense here. Trump sank a conservative-led border deal in hopes it would help him during the presidential election. He prioritizes fearmongering over welcoming tough solutions to fix our nation’s broken immigration system. Another major issue for the “toughness” question is crime, and again, Harris comes out on top. As the vice president has been saying on the campaign trail: As a former prosecutor, she knows Trump’s type. Her campaign has used that experience to frame her as tough on crime and highlight Trump’s own criminal record. In May, a New York jury found Trump guilty of an elaborate scheme to hide information from voters ahead of the 2016 election. By contrast, Harris is a seasoned prosecutor who convinced juries to convict fraudsters. While Trump works to distort Harris’ record on crime, his supporters embrace his criminality. At his rallies, the MAGA faithful hold up signs with his mug shot with the words “Never Surrender.” Trump also vows to pardon criminals who stormed the U.S. Capitol on Jan. 6, 2021. The so-called party of law and order wants these violent criminals to run free. Which of these two candidates is tough on crime? Candidates also prove their strength by how they choose to campaign. Sometimes it is about what you show voters, not what you tell them. Trump is holding fewer events this campaign, spending his time on late-night social media attacks and whining about how unfair everything is. Harris is vigorously barnstorming swing states and focusing on voters’ concerns. During her short time at the top of the Democratic ticket, Harris has managed to define herself before Trump and other Republicans have landed on an effective countermessage. This battle to control the narrative is playing out before one of Harris’ biggest opportunities to sell herself to the American people: next week’s Democratic National Convention in Chicago. Democrats can use this moment in the spotlight to drill down on the stark differences between a Harris presidency and a second Trump term. It is also an opportunity to elevate Harris’ proven track record and counter Trump’s playbook of lies and half-truths. The next 80 days won’t be easy. But I’ve seen the vice president in action, and I believe she’s tough enough to handle them. She is meeting the moment and prepared for the task at hand. After all, running for president is tough — and so is Kamala Harris. For more thought-provoking insights from Symone Sanders-Townsend, Michael Steele and Alicia Menendez, watch “The Weekend” every Saturday and Sunday at 8 a.m. ET on MSNBC."
