Title,Edit_Date,Origal_Date,Link,Content
Why Trump’s ‘incident’ at Arlington National Cemetery matters,Not Avaiable For MSNBC,"Aug. 28, 2024, 6:41 AM PDT",https://www.msnbc.com/rachel-maddow-show/maddowblog/trumps-incident-arlington-national-cemetery-matters-rcna168577,"In modern American politics, the vast majority of officials in both parties have taken care to treat the military, service members and veterans with respect. Donald Trump, for reasons that defy comprehension, has chosen a radically different path. Over the last decade or so, the Republican has reportedly denigrated those who serve in the military and condemned fallen American heroes as “suckers.” (He denies doing so.) Trump has also complained bitterly about American military leaders, reportedly disparaged wounded veterans, blamed military leaders for failed missions he approved, downplayed the importance of traumatic brain injuries suffered by soldiers, feuded with Gold Star families, downplayed the significance of the Medal of Honor, and famously declared in reference to American prisoners of war, “I like people that weren’t captured, okay?” But a different aspect of his disrespect for those who wear the uniform was on display this week. Despite his record, the former president, seeing a possible campaign opportunity, appeared eager on Monday to exploit the third anniversary of a terrorist attack in Afghanistan that killed 13 U.S. service members and more than 150 Afghans. This included attending a wreath-laying ceremony at the Tomb of the Unknown Soldier at Arlington National Cemetery, quickly followed by a thumbs-up photo-op at a gravestone in Section 60 of the cemetery, where many service members killed in Afghanistan and Iraq are buried. If we were to stop the story here, it would already be the basis for a legitimate controversy. Indeed, Esquire published a memorable headline alongside a Charles P. Pierce column this week: “How The Hell Was Trump Allowed To Use Arlington National Cemetery As A Campaign Prop?” But that was before the story managed to get even worse. NBC News reported: The details of what transpired are still coming together. NPR reported, for example, that a source familiar said two members of Trump’s campaign staff “had a verbal and physical altercation” with an official at Arlington National Cemetery, but that hasn't been independently confirmed by MSNBC or NBC News. Other relevant details, however, are clear. “Federal law prohibits political campaign or election-related activities within Army National Military Cemeteries, to include photographers, content creators or any other persons attending for purposes, or in direct support of a partisan political candidate’s campaign,” the statement added. “Arlington National Cemetery reinforced and widely shared this law and its prohibitions with all participants.” I’m mindful of the fact that multiple reports emphasized that Trump was at the cemetery at the invitation of some family members who lost loved ones in Afghanistan three years ago. That’s apparently true. But while those family members deserve respect and sympathy, politicians still aren’t supposed to exploit Arlington to advance their personal ambitions. For its part, Trump communications director Steven Cheung denied any wrongdoing and accused an Arlington National Cemetery official of “suffering from a mental health episode” during the incident. Cheung didn’t deny that the former president was accompanied by a photographer at Section 60, but he insisted the photographer was allowed to be there. Trump co-campaign manager Chris LaCivita added that the cemetery official was “despicable.” I don’t imagine we’ve heard the last of this story, but as it progresses, it’s hard not to wonder what the political world’s reaction might be if a Democratic candidate were caught up in a similar controversy. How many GOP officeholders would call for him or her to quit the race?"
Jack Smith’s targeted indictment faces a bigger test than immunity,Not Avaiable For MSNBC,"Aug. 28, 2024, 6:29 AM PDT",https://www.msnbc.com/deadline-white-house/deadline-legal-blog/jack-smith-trump-superseding-indictment-supreme-court-immunity-rcna168567,"We may never learn if special counsel Jack Smith’s new indictment passes the Supreme Court’s immunity test. If Donald Trump wins a second term in November, he’ll be empowered to end the prosecution that accuses him of breaking the law in trying to overthrow the last election. The superseding indictment filed Tuesday more closely conforms to the Republican-appointed majority’s broad grant of presidential immunity last month, which didn’t exist when the special counsel initially brought the case last year. But while the new indictment puts Smith in a better position to take Trump to trial, the biggest obstacle the government faces isn’t a legal one but the political question of whether Trump will take office again, which would put him in position to thwart the case. But even if Trump loses, the Supreme Court could still decide that Smith’s new indictment doesn’t meet its recently created test. The next major step is for U.S. District Judge Tanya Chutkan to apply the vague immunity test to the new indictment. It’s unclear what precise form that analysis will take — including whether there will be a hearing in addition to written arguments, or what such a hearing would entail. Before the superseding indictment issued Tuesday, Chutkan had set a Friday deadline to hear from the parties about how they want to proceed, and she had set a Sept. 5 status conference to discuss the case. A court filing from Smith accompanying the new indictment said that “the Government will confer with the defense and make a joint proposal, to the extent possible, regarding pretrial litigation in the status report due Friday.” Like any defendant, Trump needs to be arraigned on the superseding indictment, though whenever that happens, he would not necessarily have to appear in court for it. (He has, of course, pleaded not guilty, which is why the case is still proceeding.)  But even if Chutkan rules on the immunity test’s application to Trump’s new indictment before November — a complex task, to be sure — the Supreme Court can still have the last word on whether it thinks the trial judge correctly applied its vague test. The justices weren’t in a rush to decide the initial immunity appeal; don’t expect them to speed up any review as the election nears.  The new indictment can’t overshadow the reality that a Trump victory in November could moot the issue, legally. If elected, Trump could try a legally untested self-pardon or just order his newly installed attorney general to dismantle the case. The Justice Department also has a policy against prosecuting sitting presidents. (Presidents can’t pardon or dismiss state cases, however.) It’s an open question whether the Supreme Court would agree that Smith’s more-targeted indictment passes its immunity precedent, as well as the high court’s other recent Jan. 6 decision, Fischer v. United States, which narrowed obstruction charges against Jan. 6 defendants. Trump still faces the same four charges in the new indictment, including two obstruction-related counts. In a footnote in the immunity ruling, which came out after Fischer, Chief Justice John Roberts’ opinion said, referring to the relevant obstruction statute: “If necessary, the District Court should determine in the first instance whether the Section 1512(c)(2) charges may proceed in light of our decision in Fischer.”  But we’ll only learn the answer to that question if Trump loses.  Subscribe to the Deadline: Legal Newsletter for updates and expert analysis on the top legal stories. The newsletter will return to its regular weekly schedule when the Supreme Court’s next term kicks off in October."
"Trump claims he’s agreed to debate Harris, but there’s a catch",Not Avaiable For MSNBC,"Aug. 28, 2024, 5:41 AM PDT",https://www.msnbc.com/rachel-maddow-show/maddowblog/donald-trump-agreed-debate-kamala-harris-election-campaign-2024-rcna168568,"Following a mind-numbing process, featuring multiple reversals, Donald Trump issued an unexpected announcement by way of his social media platform: The on-again, off-again ABC News debate against Vice President Kamala Harris is back on again. “I have reached an agreement with the Radical Left Democrats for a Debate with Comrade Kamala Harris,” the Republican wrote in his predictably juvenile and whiny style. “It will be Broadcast Live on ABC FAKE NEWS, by far the nastiest and most unfair newscaster in the business, on Tuesday, September 10th, in Philadelphia, Pennsylvania.” In the same online missive, the former president claimed that “the Rules will be the same as the last CNN Debate” — I’ll never know why he capitalizes random words — suggesting the candidates’ microphones will be muted except when they’re answering questions, just as the Republican's team had hoped. So, all’s well that ends well? Not exactly. As is too often the case, when it comes to his own candidacy, Trump is an unreliable narrator. The New York Times reported: A Harris campaign official also confirmed with NBC News that negotiations are still underway over microphone rules. In other words, the GOP nominee told the public that the debate over the debates had been resolved, which came as something of a surprise to members of Team Harris, who knew better. For those who might benefit from a refresher, Trump initially agreed to a debate schedule three months ago, which included a Sept. 10 event on ABC News. That, of course, was when the former president assumed his opponent would be President Joe Biden. After the Democratic incumbent passed the torch to Harris, Trump abandoned his “anywhere, anyplace” chest-thumping and took a variety of clumsy steps to back out of his earlier debate commitments. In fact, three weeks ago, Team Trump made what appeared to be a categorical announcement: The GOP candidate would not participate in ABC News’ Sept. 10 presidential debate. Seven days after backing out of the debate, however, Trump reversed course and re-accepted the invitation. Around the same time, the former president held a Mar-a-Lago press conference in which he also announced the dates of other upcoming debates that hadn’t been negotiated and therefore might not occur. Two days later, on Aug. 11, Trump published a middle-of-the-night missive to his social media platform, further alerting the public to a made-up debate schedule, pointing to events that no one had agreed to. Earlier this week, the former president took all of this in an even weirder direction, signaling his newfound reluctance to participate in the Sept. 10 debate. As members of his campaign team worked behind the scenes to keep microphones muted during the event, the Republican candidate himself said he didn’t much care either way, necessarily undermining his own team in public. He added that he believed ABC News should be “shut out” of the process. Two days later, Trump agreed to the terms of the ABC News event — but he did so in a way that wasn’t altogether true. All of which is to say, the first Harris-Trump debate could be two weeks away, or it might not happen at all. The GOP nominee told the public that the underlying disputes had been resolved, but he apparently made that up, and negotiations over the relevant details are still ongoing. I’m reluctant to guess whether the event will actually happen, though one thing seems obvious: The former president was desperate to share a stage with Biden, and he appears genuinely afraid of Harris. This post updates our related earlier coverage."
Kamala Harris is right to not make her race and gender a rallying cry,Not Avaiable For MSNBC,"Aug. 28, 2024, 3:00 AM PDT",https://www.msnbc.com/opinion/msnbc-opinion/kamala-harris-policy-identity-trump-attacks-rcna168255,"Vice President Kamala Harris has embraced a variety of vibes during her still nascent 2024 campaign, but one area where she restrains herself is discussing her race and gender. She doesn’t mention it much on the campaign trail. During her nomination speech at the Democratic National Convention, she declined to call attention to those identities outside the typical introduction politicians give when describing where they come from. In recent campaign ads, Harris is described as the middle-class “daughter of a working mom.” The class description renders her ordinary, and there is no attempt to pique interest over the historic implications of her candidacy as a woman of color. Harris’ reluctance to draw extra attention to her womanhood or her Black and South Asian ancestry has stood in stark contrast to Hillary Clinton’s 2016 presidential campaign. At the Democratic National Convention that year, a video screen displayed a montage of all past presidents, and then Clinton emerged to the sound of shattering glass. “I can’t believe we have just put the biggest crack in that glass ceiling yet!” she said in the video, prompting the crowd to erupt into roars. During her nomination acceptance speech, she wore a white pantsuit in a nod to the suffragettes, and she trumpeted how her nomination marked a “milestone” for women. Clinton’s most memorable campaign slogan, “I’m With Her,” highlighted her gender — and nothing else. Harris’ choice to go a different path is wise — and she should stay the course. The uniqueness of her identity as a presidential candidate is self-evident, and she should continue to let Republicans, who’ve come up with a preposterous new birther theory, hang themselves with their own rope with their bigoted fixation on her gender and racial background. But beyond tactical questions, Harris’ lack of interest in drawing attention to the “historic” nature of her candidacy is substantively appropriate, too. Harris’ victory wouldn’t in and of itself usher in widespread change for people from marginalized backgrounds. Only policies can do that. This isn’t an argument that Harris should conceal or whitewash her identity. Harris, the daughter of an Indian mother and a Jamaican father, should feel free to discuss and cherish any aspect of her background, just as any citizen in our multicultural democracy should feel free to. And if the context calls for it, it makes sense for her to elucidate how her identity helps explain her ideological outlook. Harris did this artfully in her DNC speech by recounting how her mother, a “5-foot-tall brown woman with an accent,” was sometimes mistreated but “never lost her cool” and taught Harris to “never complain about injustice but do something about it.” Her recollection of another lesson from her mother hints at her own “show, don’t tell” attitude toward discussing her identity: “‘Never let anyone tell you who you are. You show them who you are.’”      "
Trump’s golf club honoring the villains of Jan. 6 is on brand — but no less disgusting,Not Avaiable For MSNBC,"Aug. 28, 2024, 3:00 AM PDT",https://www.msnbc.com/opinion/msnbc-opinion/j6-awards-gala-trump-golf-club-rcna168530,"Next week, the private golf club that former President Donald Trump owns in club in Bedminster, New Jersey, is scheduled to host a “J6 Awards Gala” to celebrate not the people who defended the U.S. Capitol on Jan. 6, 2021, but the people who attacked it. Trump isn’t expected to attend, according to reports, even though the Stand in the Gap Foundation, the organization that’s behind the event, boasts that it’s invited him to speak. But Trump doesn’t have to speak for us to link him to this event. It’s being held at a property he owns, and he has been very vocal in his support of the people who brutally attacked police officers in an assault on the Capitol. Last year, he spoke at a fundraiser held at the same golf course in support of the insurrectionists, and he’s hailed the attackers as “patriots” and vowed to pardon them, including those “who assaulted officers.” And even if he isn’t there Sept. 5,  the event’s website promises speaking appearances from Trump allies Rudy Giuliani and former adviser Peter Navarro, who served three months in jail for refusing to comply with the House Jan. 6 committee’s investigation. According to the event’s website, “the J6 Awards Gala … will honor and celebrate the twenty defendants who contributed to the powerful ‘Justice For All’ song” and celebrate “all J6 defendants who have shown incredible courage and sacrifice.” A presidential candidate letting his property be used to host an event where a mob attack on police officers will be celebrated as heroic is blood-boiling. As for the “Justice for All” song, which Trump has his supporters stand for at his rallies, we know the identities of many of the singers from a May 2023 Washington Post report: Texan Ryan Nichols, according to the Department of Justice, drove to the Capitol based on the “belief that the 2020 presidential election was fraudulent.” Nichols, who pleaded guilty to two felonies, including assaulting law enforcement officers, was wearing body armor as he “delivered two streams” of pepper spray “hitting multiple law enforcement officers.” Nichols also urged his fellow attackers to enter the Capitol with him, and yelled, “If you have a weapon, you need to get your weapon!” He was sentenced to five years in prison. Before he traveled from Texas to the Capitol, Shane Jenkins, another Texan, posted, “I have some sog tomahawks and tactical blades can I take those?” on social media. He was convicted at trial of eight felony charges and sentenced to seven years. Prosecutors say he pulled a “Sog” brand metal tomahawk axe out of his bag during the siege and used it to break windows. He then “riled up the crowd, telling other rioters, “Bro, we’re going in that f--- building one way or another” and “We paid for it; it’s our f--- building.” Prosecutors say he “hurled nine different objects at the officers” protecting Congress that day. Officer Brian Sicknick was one of the people pepper-sprayed by Julian Khater, another one of the singers of the “Justice for All” song. Khater pleaded guilty to “assaulting law enforcement officers with pepper spray, causing bodily injury to the officers.” Sicknick died the next day. Sarah McAbee, the organizer of this J6 awards gala, is married to Ronald Colton McAbee, a former Tennessee sheriff’s deputy who was sentenced to nearly six years in prison for assaulting police officers with “reinforced knuckle gloves.” Even more despicably, McAbee held down a police officer who’d been “knocked to the ground, kicked and stripped of his baton by other rioters,” enabling the crowd to viciously beat him. Not only are these the people Trump has promised to pardon and the people whose rendition of the national anthem he thinks deserves applause, they’re the people who’ll be celebrated and valorized at Trump National Golf Club. The Jan. 6 attack — as U.S. Attorney for the District of Columbia Matthew Graves said when he testified before Congress in January — was “likely the largest single-day, mass assault of law enforcement officers in our nation’s history.” Graves made it clear that many more than the 140 officers originally reported suffered physical injuries that day — which, as he added, does not even include the scores more who suffered mental trauma. And we’ve horrifically seen several officers die of suicide in connection with what they endured on Jan 6. What Trump is doing and has done is not “treason,” at least not according to the letter of the law. But he has repeatedly provided “aid and comfort” to those who waged the first violent attack on our Capitol since the war of 1812, when the British set it on fire. Trump doesn’t belong back in the White House; he belongs in a prison cell just like the people who will be celebrated next week at the awful Jan 6 gala at his country club. "
The prosecutor populism of Kamala Harris,Not Avaiable For MSNBC,"Aug. 27, 2024, 4:41 PM PDT",https://www.msnbc.com/opinion/msnbc-opinion/kamala-harris-campaign-proposals-prosecutor-rcna168232,"Vice President Kamala Harris is leaning on her decades as a local and state prosecutor to signal her toughness in the presidential race. But that professional experience also shapes her approach to tackling the country's problems. Consider inflation, which has been one of the Biden administration's thorniest political problems. In a speech this month, Harris proposed going after grocery chains that she claimed are using inflation as a pretext to price-gouge consumers. In one line in the speech, she outlined an approach that you might call prosecutorial populism: target the rule-breakers. “Most businesses are creating jobs, contributing to our economy and playing by the rules, but some are not, and that’s just not right, and we need to take action when that is the case,” she said. You can see echoes of this approach in Harris' Democratic National Convention acceptance speech and other policy announcements: In each case, Harris clearly identified villains and proposed, essentially, prosecuting the cases against them. The benefits of this approach are that it's easy to explain to voters and it forces the political opposition to defend some pretty indefensible behavior. There's a reason defense attorneys have such bad reputations, after all. The populist approach would be to go after the large conglomerates in unflinching language — “every billionaire is a policy failure,” for example — but this prosecutor’s populism is narrower. The large companies breaking the rules are the target, and the solution is to go after them and leave the rest alone. There are limits to this approach. Sometimes a problem doesn't have a clear villain. Sometimes focusing on the people explicitly breaking the rules overlooks the broader problem that the rules created in the first place. Sure, scammy for-profit colleges are bad, but they aren’t the major reason student debt has become such a crippling problem. The prosecutor's mindset can also lead to a focus on easy wins. Being a prosecutor is an inherently political job, but it has much different set of incentives from other positions such as governor or senator. At the local and state levels, prosecutors are typically elected, and many look at their win-loss ratios in court as the best way to persuade voters to re-elect them. That can make them risk-averse, looking for cases with overwhelming evidence or seeking plea deals to avoid the uncertainty of going to trial. That could be a problem for Harris in the White House, where presidents often have to make snap decisions with incomplete information, such as when Barack Obama approved the late-night mission to kill Osama bin Laden. America has had presidents who were prosecutors before. Both James K. Polk and William McKinley got their starts as local prosecutors, and Bill Clinton was Arkansas attorney general before serving as governor. But Harris' experience is much deeper: She was a deputy district attorney, district attorney and California attorney general for 27 years, while she has been a senator and vice president for only seven years. Other presidents have been shaped by their past careers. Ronald Reagan approached the presidency like another acting gig and viewed political problems through the lens of Hollywood screenplays. Obama sometimes sounded like he was still a constitutional law professor, debating with himself whether the president has the power to mint a trillion-dollar coin. And former President Donald Trump still thinks like a real estate developer, promising to build walls and airports and statuary gardens. Harris has leaned heavily on her past as a prosecutor, promising to make the case against Trump, using “for the people” as her campaign slogan and talking about her handling of difficult cases to signal toughness to voters. It has also been used against her, as when some on the left criticized her ill-fated 2020 presidential campaign with the meme ""Kamala is a cop."" But based on her policy announcements so far, it's clear that being a prosecutor is more than just a credential for Harris. It's also a mindset that she'll carry with her into the White House."
