Title,Edit_Date,Origal_Date,Link,Content
Why arresting Matthew Perry's alleged drug suppliers won't solve anything,Not Avaiable For MSNBC,"Aug. 17, 2024, 3:00 AM PDT",https://www.msnbc.com/opinion/msnbc-opinion/matthew-perry-drug-charges-ketamine-death-rcna166959,"If you’ve ever seen a newborn bird or mouse, their skin is so thin it’s translucent. It’s difficult to imagine the vulnerability of such a creature, so new to the world. They need constant protection. Any exposure might kill them. When the drugs are gone, addicts have no skin. We are that vulnerable. Our eyes stay shut tight, as even the sunlight hurts. If Matthew Perry was like me, and I think he was, he couldn’t survive the world without help. He was just as vulnerable. As I read the contents of his toxicology report, I thought, He just hurt too much. We don’t feel vulnerable to drugs, but to feeling. We can’t stand it after being numb so long. On Thursday, news broke that five people, including Perry’s assistant and doctors, were charged with providing him the ketamine that led to his accidental overdose in 2023. “They knew what they were doing was wrong. They knew what they were doing was risking great danger to Mr. Perry,” proclaimed U.S. Attorney Martin Estrada. “But they did it anyways. In the end, these defendants were more interested in profiting off of Mr. Perry than caring for his well being.” It enraged me. I understand why charging these people may seem like a good idea. Text messages between two of the doctors indeed show a deep callousness toward Perry, whom they refer to as “a moron” as they speculate about their potential payday. But the false narratives surrounding addiction in our nation keep us sick. Arresting Perry’s suppliers is not a solution to addiction. It’s smoke and mirrors; a PR tactic meant to convince Americans our government is doing something about the problem. The truth is addiction is a terrible and mysterious disorder of the brain. Philip Seymour Hoffman, Heath Ledger, Prince, Whitney Houston and Matthew Perry did not survive it. Inexplicably, I did — so far. I’ve been off heroin for many years. But if I were to overdose tomorrow, the Drug Enforcement Administration would not be dispatched to investigate. I am not in the public eye and don’t have a fan base. Law enforcement doesn’t need to prove to anyone they’re doing something about my death. I’d be just one more statistic. I also can’t imagine any dealer considering a career change because of these arrests. The market for drugs is like any other, a question of supply and demand. If the five people who helped Perry procure drugs hadn’t come through, he would have found five others who would. He had the money to do so. Not everyone does. Addiction is a medical issue, not a moral one. What does “justice” look like? Arresting a doctor here or a personal assistant there? This sort of targeted prosecution is the flimsiest of Band-Aids. It implies the matter has been closed, and it enables society to bypass our responsibility — both to Perry and to each other. How do we convince the American people to invest in evidence-based drug treatments for addicts when other patients can’t get the basic health coverage they need? France cut heroin overdoses by almost 80%, a stunning success rate. But it has health care for all and centers devoted to not just getting addicts off drugs, but also to providing therapy and job training. There’s another aspect of this tragedy that is difficult to convey, and even more difficult to accept. And that is the notion of what is and isn’t help. I’ve been dope sick before, and it’s a hell I wouldn’t wish on my worst enemy. Perry asked his longtime live-in assistant for relief; according to court documents, the assistant administered three injections of ketamine between 8:30 a.m. and 1:30 p.m. on the day of the actor’s death. I can’t imagine Perry wanting that assistant punished for fulfilling his requests. (And of course, now we’ll never be able to ask.) I don’t expect everyone to understand an impulse that isn’t rational. But for addicts, help is often only one thing: more of what kills us. If we lived in a nation that recognized addiction as the disorder of the brain it is proven to be; if we provided medical support not just to addicts, but to all Americans; and if we finally gave up the yoke of puritanism and accepted the medical science surrounding addiction treatment, I might say: Go ahead. Arrest the dealers. But we do not live in such a nation. When our government cracked down on doctors for overprescribing with no other solutions in place, some addicts looked for relief on the streets. Some killed themselves. People in chronic pain were stranded. Illegal fentanyl killed hundreds of thousands. Should Kamala Harris become our next president, I hope she has the wherewithal to rewrite our addiction policy. In the meantime, the men and women who fed Perry’s addiction will go to jail — probably. Perry’s assistant has already pleaded guilty to one count of conspiracy to distribute ketamine causing death. The public’s thirst for revenge may be slaked temporarily. But nothing else will change."
Why Kimberly Cheatle’s journey from Secret Service director to protectee isn’t shocking,Not Avaiable For MSNBC,"Aug. 16, 2024, 6:04 PM PDT",https://www.msnbc.com/rachel-maddow-show/maddowblog/kimberly-cheatle-protected-by-secret-service-rcna166980,"Tonight, NBC News’ Kelly O’Donnell reported that former U.S. Secret Service Director Kimberly Cheatle has become U.S. Secret Service protectee Kimberly Cheatle. That’s because Cheatle, who resigned from her post on July 23, has become the target of unspecified, but presumably credible and significant, threats in the wake of the assassination attempt against former President Donald Trump and the Secret Service’s failure to prevent it. But as shocking as it is to see a former Secret Service director need the protection of her own former agency, it’s much less surprising when one considers the overall threat environment facing those whom Trump loyalists perceive as a danger to him — or them. After all, we learned earlier this week that the daughter of Judge Juan Merchan, who oversaw Trump’s New York hush money trial, and her business partner have each been subjected to death threats and harassment, and that law enforcement has advised the daughter and her family to leave their home for their own safety. Further, in an interview with my NBC News colleague Ken Dilanian last month, Attorney General Merrick Garland noted that the Justice Department has brought 400 cases over the last two years alone dealing with threats against federal and state judges, federal and state prosecutors, federal and state legislators, and federal, state and local law enforcement officers. Of course, those are just the cases federal law enforcement has brought, not the totality of the threats. And several of those cases concern targeted people who, simply for doing their jobs, have raised Trump supporters’ ire. They become part of the online stew of conspiracy theories, misogyny, white supremacy and MAGA devotion that can catalyze grievances into threats — or worse. Take Spencer Gear, a 32-year-old Nevada man indicted last month. The Justice Department alleges that from November 2023 through July 2024, Gear made threats to injure or kill 11 federal or state officials, including five federal judges in Washington, D.C., and Judge Lewis Kaplan, who presided over both of E. Jean Carroll’s defamation trials against Trump. According to that indictment, Gear also directed threats, via a June 3 voicemail, at Manhattan District Attorney Alvin Bragg, who brought the 34-count felony hush money case against Trump, as well as against Merchan. To be fair, neither the fact of Gear’s indictment nor the identities of his alleged targets is new. But the transcript of Gear’s bail hearing, which MSNBC has obtained, includes the government’s description of how resolute, methodical and unafraid those making the threats can be, even when warned by federal law enforcement, as officials say Gear was, that the types of messages he had been leaving for officials were not protected by the First Amendment. According to that transcript, prosecutors say days after a Manhattan jury returned its verdict in the hush money case, Gear left a voicemail message at Bragg’s Harlem office in which he claimed, “We’re at war now,” and then, referencing Bragg and Merchan, warned, “You’re dead men, we’re going to kill you ... we’re going to round you up, and we’re going to put you before our own court, and then we’re going to f---ing execute you.” Prosecutors played that voicemail for the court in arguing that Gear should not be free pending trial. Gear was equally bold even when the FBI came to arrest him, authorities say, initially refusing to leave his house and cutting his hand while throwing back a drone the agency flew into the house. By the time FBI was able to conduct a search, agents found not only “multiple firearms throughout the house,” but also a “tactical vest that had a significant amount of ammunition on it” and “fresh blood — as if he had been handling that tactical vest.” And although he left his home without violence, he told the FBI, “You can smile today because I chose a different path. You’re not the enemy, but you work for them. This organization is not constitutional. I hope you guys understand that.” We obviously don’t — and likely won’t — know the nature of the threats to Cheatle. But if even one of the people making those threats is as unrepentant and potentially prepared as authorities say Spencer Gear was, her rapid transformation from political appointee to guardee is perfectly understandable."
RFK Jr. clearly has something Trump wants,Not Avaiable For MSNBC,"Aug. 16, 2024, 2:29 PM PDT",https://www.msnbc.com/the-reidout/reidout-blog/trump-seems-desperate-rfk-jrs-endorsement-harris-care-less-rcna166949,"I’ve long wondered what erstwhile Democrat Robert F Kennedy Jr. — now an independent — is after with his MAGA-friendly presidential campaign. I’ve thought: “Does he simply want to help Donald Trump win? Does he want to seek retribution, alongside his antivax buddies, against liberals for daring to try to prevent mass death during the Covid pandemic?” A new report from The Washington Post seems to have landed on a rather simple answer: power and ambition.  Apparently, Kennedy, through an intermediary, sought a meeting with Vice President Kamala Harris’ campaign to see if she’d be willing to offer him a role in her potential administration in exchange for his endorsement.  The Harris campaign’s response? Essentially: “boy, bye.” Per the Post:  Kennedy said in response to the report that he had reached out to all the candidates, but never asked the Harris campaign for a Cabinet position. As the Post noted, the cold shoulder Kennedy reportedly received from the Harris campaign was markedly different from the response he received from Trump’s campaign regarding a similar offer. Weeks earlier, Kennedy and Trump spoke directly about the idea of Kennedy endorsing Trump in exchange for a Cabinet position or advisory role in a potential Trump White House. Portions of one of their discussions were even posted online. And though no agreement seems to have been reached, the fact the chats occurred at all highlights a pretty clear contrast. Team Trump seems thirsty for Kennedy’s endorsement, or for him to leave the race at least, and Team Harris doesn’t seem to care either way. Recent polling data show why that may be. As my colleague Zeeshan Aleem explained, Harris’ entry into the presidential race has attracted independent and third party voters who’d been considering Kennedy when President Joe Biden was the presumptive Democratic nominee. On the other hand, Kennedy’s ongoing presence in the race only seems to hurt Trump. So even if they were to meet, Harris could reasonably ask Kennedy: “Why do I need your endorsement when your ‘supporters’ are already flocking to me?” Trump seems acutely aware that Kennedy’s campaign, which has been imploding as of late, seems to be pulling from his support. That would explain his public attack on conspiratorial podcaster Joe Rogan after Rogan praised Kennedy’s campaign. I’d argue all of this puts Kennedy in a prime position to extract some kind of concession from Trump down the line. He clearly has something Trump wants, whether that’s a suspension of his campaign or a full-on endorsement. And Trump has shown shameless deference to people willing who aid his campaign in any way."
Read: Donald Trump's 2024 financial disclosure documents,Not Avaiable For MSNBC,"Aug. 16, 2024, 2:07 PM PDT",https://www.msnbc.com/top-stories/latest/read-trump-financial-disclosure-documents-pdf-rcna166929,"Republican presidential nominee Donald Trump's personal financial disclosure forms were released Thursday by the U.S. Office of Government Ethics, revealing details about the various sources of his personal wealth. Trump has made money from a number of licensing deals that include $300,000 from the ""Greenwood Bible,"" which retails for around $60 and also comes in an autographed edition for $1,000. He also made more than $7 million from his association with a company producing NFT ""trading cards"" with his likeness. Among his most substantial assets at the moment is his investment in Trump Media & Technology Group, which owns social media platform Truth Social. Trump listed 115 million shares, which CNN reports ""would be worth about $2.7 billion at the current price of $23.57."" Also listed, under ""litigation,"" are his bonds for the civil judgments against him brought by E. Jean Carroll and the New York attorney general. Read all the forms below:"
Leaked videos show how Trump’s allies plan to equate abortion with murder,Not Avaiable For MSNBC,"Aug. 16, 2024, 1:58 PM PDT",https://www.msnbc.com/opinion/msnbc-opinion/project-2025-training-videos-abortion-trump-rcna166924,"The more that Donald Trump and his campaign try to distance themselves from the authoritarian ambitions of Project 2025, the more revelations emerge about how tightly linked they are. Videos of the Project’s Presidential Administration Academy, recently obtained by the investigative reporting outlet ProPublica, provide even more damning evidence of how former Trump administration officials plan to carry out their agenda in a possible second term — and how abortion is one of their key targets. ProPublica published 14 previously secret videos produced by the Heritage Foundation to train future administration appointees. Two of these videos in particular show that despite Trump’s gaslighting of the public that he has “moderated” on abortion, his Project 2025 allies are plotting multiple ways to attack it. Project 2025 lays out multiple anti-abortion plans, including revoking Food and Drug Administration approval of the abortion medication mifepristone and using the Comstock Act as a means of instituting a national abortion ban by criminally prosecuting the sale of abortion pills through the mail. These videos show how Trump’s allies also plan to radically reshape the federal government to elevate anti-abortion activists and even equate abortion with murder. In the section “Coalition Building,” Paul Teller, a former special assistant to the president and a senior aide in the Office of the Vice President, and Sarah Makin, a former deputy assistant to the president and former director of outreach in the Office of the Vice President, discuss the importance of building relationships with outside advocacy groups to advance the administration’s agenda, particularly on “pro-life” issues. Makin highlighted her role in planning a Rose Garden event during which Trump addressed the annual March for Life remotely. For optimal “optics,” she reached out to “an umbrella organization for pregnancy centers” to arrange a group of people to stand behind Trump. She lauded that “we had moms and their babies, babies who’d been rescued from abortion by these pregnancy centers come and stand behind the president.” (The comments start around the 11:15 mark.) Pregnancy centers, sometimes called crisis pregnancy centers, are “facilities that represent themselves as legitimate reproductive health care clinics providing care for pregnant people but actually aim to dissuade people from accessing certain types of reproductive health care, including abortion care and even contraceptive options,” according to the American College of Obstetricians and Gynecologists. They often use “false and misleading information, emotional manipulation, and delays.” In the segment titled “Left-Wing Code Words and Language,” Katie Sullivan, former acting assistant attorney general in charge of the Department of Justice’s Office of Justice Programs, and Bethany Kozma, deputy chief of staff at the U.S. Agency for International Development during the Trump administration, devoted more than 45 minutes to vilifying Democratic programs to combat climate change, promote equity and advance LGBTQ and reproductive rights as a diabolical leftist plot to control peoples’ lives, akin to rule under Stalin or Hitler. The pair discussed their experiences as “part of a coordinated effort in the Trump administration focused on trying to take back hijacked language and definitions across the United States government.” The left, Kozma claimed, “got very creative years ago and started using different words to make abortion sound a little less like murder,” using instead phrases like sexual and reproductive health or reproductive rights. Sullivan added, “it’s incredible how the left is able to make killing children and babies a ‘pro’ movement."" Sullivan promised the video would teach trainees “how to identify the left’s progressive language,” “how to scrutinize career staff compositions for dangerous language,” and “how to combat their manipulative efforts, ensuring clarity of definition and conservative intention.” Sullivan also said that “you can do this in any role at any level of seniority.” Although Trump pandered to the anti-abortion movement during his first term, and stacked the Supreme Court with the conservative majority that overturned Roe, it’s clear he is now terrified that the Dobbs decision is an albatross around his neck — and that all the attention on Project 2025 is a perpetual reminder of his allies’ radical goals. Last month, Trump clumsily tried to claim in a Truth Social post, “I know nothing about Project 2025. I have no idea who is behind it” and “I have nothing to do with them.” But Trump can’t beat the truth with misdirection. At least 140 Project 2025 contributors, including those featured in the training videos, previously worked in his administration. In 2022, Trump flew to a Heritage Foundation conference on the organization’s private plane, with the organization’s president, Kevin Roberts, to deliver a speech. In the speech, Trump said, “They’re going to lay the groundwork and detail plans for exactly what our movement will do.” Rolling Stone reported that just before publishing his bogus denial on Truth Social, “Trump had been privately — and very bitterly — complaining about the abortion policies laid out in the lengthy Project 2025 manifesto, and trashing the Project 2025-linked ‘lunatics’ who keep demanding unpopular abortion bans and restrictions.” Trump is keenly aware of polling data showing that, as public awareness of Project 2025 has skyrocketed, voters have recoiled from it. Trump can try to run, but he can’t hide from his closest allies’ plans to turn America into a dystopia where abortion is criminalized, and his loyalists wield power to police and censor even any discussion of it at the highest levels of government."
Oklahoma doesn't want to execute Richard Glossip. The Supreme Court might force it anyway.,Not Avaiable For MSNBC,"Aug. 16, 2024, 1:04 PM PDT",https://www.msnbc.com/deadline-white-house/deadline-legal-blog/richard-glossip-execution-supreme-court-oklahoma-death-row-rcna166928,"A brief filed at the Supreme Court this week argues that a state court decision ordering an execution “was riddled with errors from start to finish.” Notably, that brief wasn’t filed by the death row prisoner, Richard Glossip, but by the state of Oklahoma, which, in a remarkable turn of events, is practically begging not to execute him. The state has admitted prosecutorial misconduct in keeping key evidence from the jury in securing Glossip’s conviction. But the Oklahoma Court of Criminal Appeals didn’t think much of the government’s plea, instead reasoning in April of last year that the admission “cannot overcome the limitations on successive post-conviction review.”  Glossip, who has maintained his innocence, then asked the justices to stay to his execution. With the state supporting his request, the high court did so in May of last year. Yet, instead of summarily ordering a new trial like the state asked for — “so that justice can be done in this case,” the state said — the Supreme Court appointed a third party to defend the state court ruling. It’s not unprecedented for the court to appoint a third party to argue an abandoned position, but the implications of the justices potentially upholding the state court ruling here are extraordinary. “The [Oklahoma Court of Criminal Appeals] had no valid basis to order Oklahoma to execute Richard Glossip over the objection of the State’s chief law officer,” the state argued in its latest brief to the justices. In another notable feature of the case, Oklahoma is represented by top conservative Supreme Court lawyer Paul Clement, who’s also representing former Trump White House chief of staff Mark Meadows in his bid to move his Georgia state criminal charges to federal court.  “When the prosecution takes the extraordinary step of confessing error in criminal cases, courts are obliged to take the confession seriously, not apply procedural obstacles the State has waived,” Oklahoma’s brief said, adding: “That is particularly true in capital cases, and doubly so when the confessed error involves prosecutorial misconduct.” The oral argument is set for Oct. 9, during the first week of the court’s upcoming term. The hearing may provide a sense of where the court stands, ahead of a ruling expected by July 2025. In yet another noteworthy aspect of the dispute, Justice Neil Gorsuch recused himself from the case, presumably because he previously sat on the 10th U.S. Circuit Court of Appeals, which covers Oklahoma and thus some of Glossip’s prior litigation. While Gorsuch has sided with certain criminal defendants in cases where his Republican-appointed colleagues haven’t, he has routinely ruled against capital defendants. Subscribe to the Deadline: Legal Newsletter for updates and expert analysis on the top legal stories. The newsletter will return to its regular weekly schedule when the Supreme Court’s next term kicks off in October."
Judge suspended after putting a teen in handcuffs for sleeping in court during a field trip,Not Avaiable For MSNBC,"Aug. 16, 2024, 12:32 PM PDT",https://www.msnbc.com/top-stories/latest/detroit-judge-teen-handcuffs-sleeping-kenneth-king-rcna166921,"A judge in Detroit has been suspended after he ordered a teenage girl to be handcuffed and threatened her with jail after she fell asleep in his courtroom during a field trip. District Court Judge Kenneth King was temporarily removed from the docket after an internal investigation and will “undergo the necessary training to address the underlying issues that contributed to this incident,” Chief Judge William McConico said in a statement Thursday. The 15-year-old girl was in King's courtroom Tuesday as part of a group trip organized by the Greening of Detroit, a local nonprofit organization, to help young people learn about the judicial process. A now-deleted YouTube video showed the girl falling asleep between hearings, when King yelled at her and ordered her to be put in handcuffs and to change into a Wayne County Jail jumpsuit, the Detroit Free Press reported. Colleen Robar, a representative for the Greening of Detroit, said in a statement Tuesday that the judge “chose to make an example of a 15-year-old girl in front of her peers,” calling his punishment “unacceptable.” The girl’s mother told NBC News that her daughter was tired because they don’t have permanent housing and that they had arrived late at the place they were staying the night before the trip. She told the Free Press: “My daughter is hurt. She is feeling scared.”  King’s excessively punitive reaction to the teen falling asleep has been widely condemned. He told WXYZ-TV on Tuesday that he was not so much “disturbed” by her falling asleep but by her “whole attitude and her whole disposition.” “That’s not something that normally happens. But I felt compelled to do it because I didn’t like the child’s attitude,” King told the local outlet. “I haven’t been disrespected like that in a very long time.”"
