Title,Edit_Date,Origal_Date,Link,Content
"Friday’s Mini-Report, 8.9.24",Not Avaiable For MSNBC,"Aug. 9, 2024, 2:30 PM PDT",https://www.msnbc.com/rachel-maddow-show/maddowblog/fridays-mini-report-8924-rcna166032,"Today’s edition of quick hits. * Disaster in Brazil: “An airplane carrying 58 passengers and four crew members crashed in Brazil on Friday, according to the airline operating the flight. The plane took off from Cascavel and was headed to the São Paulo-Guarulhos International Airport, according to a statement from the airline Voepass Linhas Aéreas. Cascavel is in the state of Paraná, southwest of São Paulo.” * In Moscow: “Russian President Vladimir Putin convened a meeting of his Security Council on Friday and his military commanders rushed to send reinforcements as a stunning Ukrainian incursion into Russia’s western Kursk region presented the biggest challenge to the Russian leader since an uprising by Wagner mercenaries in June 2023.” * A case we’re watching closely: “U.S. District Judge Tanya Chutkan on Friday approved a request from special counsel Jack Smith to allow for more time to propose the next steps in the government’s election interference case against former President Donald Trump. The decision came a day after Smith and fellow prosecutors asked the judge to delay the deadline to offer a new timetable in the case until Aug. 30.” * A 20-year sentence for David Dempsey: “A Donald Trump supporter who stood in front of a gallows and spoke of his desire to hang Democratic politicians before he assaulted numerous police officers during the Jan. 6 attack on the U.S. Capitol was sentenced to 20 years in federal prison Friday. It’s the second-longest sentence handed out in a Jan. 6 case to date.” * Difficult diplomacy: “Leaders of the United States, Egypt and Qatar jointly demanded Israel and Hamas return to stalled talks on the war in Gaza next week, saying Thursday that ‘only the details’ of carrying out a cease-fire and hostage release remain to be negotiated.” * In Maine: “With eleventh hour guidance from the state, Maine gun retailers on Friday began requiring a three-day wait period for gun purchases under one of the new safety laws adopted following the state’s deadliest mass shooting.” * Donald Trump told a story at his Mar-a-Lago press conference about being in a helicopter with Willie Brown, the former speaker of California’s state assembly, which had to make an emergency landing. Nearly all of the details of the story were wrong, and that wasn’t the only problem with the made-up story. Have a safe weekend."
There are no trans women athletes at the Paris Olympics. So bigots manufactured them.,Not Avaiable For MSNBC,"Aug. 2, 2024, 11:22 AM PDT / Updated Aug. 9, 2024, 2:30 PM PDT",https://www.msnbc.com/opinion/msnbc-opinion/olympics-boxer-imane-khelif-anti-trans-rcna164721,"UPDATE (August 9, 2023 05:30 p.m. E.T.): Imane Khelif won welterweight gold on Friday, defeating China's Yang Liu in a unanimous decision. Lin Yu-Ting faces Poland’s Julia Szeremeta in the featherweight gold medal bout Saturday. There are no trans women at this year’s Olympics. There are two nonbinary athletes competing in their assigned sex at birth category, but no trans women. Years of anti-trans activists and conservatives openly raging at any sporting organization that even hinted at including trans women in women’s sports succeeded in killing the Olympic dream for any trans kids watching this year’s Games. But none of that was enough for the internet transphobe brigade as the first week of the Olympics unfolded. First they noticed a woman with a very strong jawline on the American rugby team that took bronze in dramatic fashion Tuesday and incorrectly assumed she was trans. Next it was Facebook users reviving claims American swimming legend Katie Ledecky is trans, because of her shoulder width and musculature. And since Thursday, the internet transvestigators have honed in on  two boxers who — again — are not trans.  After Italy’s Angela Carini quit 46 seconds into her fight against Algeria’s Imane Khelif, conservative politicians, including former President Donald Trump and Sen. Marco Rubio, and other anti-trans voices such as author JK Rowling and YouTuber Logan Paul took to social media Thursday to accuse Khelif of being a man. The rumor mill over Khelif ran wild, ranging from people claiming she was a trans woman, to others who claimed she’s just a cis man who hasn’t even transitioned and just wants to cheat. Similar accusations were levied against Khelif’s fellow boxer Lin Yu‑ting of Taiwan. The true story is, of course, much more complex than can be explained clearly in a handful of rage tweets. Both Khelif and Lin were born as women. They have always identified as women. And for years they competed in women’s boxing, including at multiple world championships and the pandemic-delayed Tokyo Olympics. Both have posted numerous losses to cis women in their careers.  The anti-trans fury stems from last year’s world championships, when the International Boxing Association disqualified both boxers for failing “to meet eligibility rules.” IBA president Umar Kremlev claimed at the time that Khelif and Lin were “proven they have XY chromosomes.” But the circumstances around that claim are hugely suspicious. The IBA, the Russian-led organization that suspended her, has actually itself been suspended by the International Olympic Committee over rampant governance problems and corruption issues. Kremlev, who is Russian, made his comments to a Russian news outlet after Khelif defeated a Russian boxer. IBA officials never released details of the method or results of the gender tests. Following the World Championships, Taiwan’s sports administration conducted their own tests and confirmed Lin’s eligibility for international competition. “We have no knowledge of what the tests were,” IOC spokesperson Mark Adams told The Washington Post. “They were cobbled together, as I understand, overnight [during the world championships] to change the results.” Yet a lone, unverified claim, along with the boxers’ short hair, has led to masses of online anti-trans activists hurling abuse at two women simply for pursuing their Olympic dreams. Even some journalists like the Guardian’s Sean Ingle have called attention to the Italian boxer’s suffering and demanded explanations from the IOC. But according to The Associated Press, Carini “said she wasn’t making a political statement and was not refusing to fight Khelif.” This whole “controversy” shows how far the anti-trans movement will push in its pursuit to stamp out gender nonconformity from society. It already pushed trans women out of sports. Now it is going after anyone with a strong jaw or a muscular physique. What’s next? Are women with elevated testosterone levels (which can arise from diseases like polycystic ovary syndrome) going to be declared men? Where does it end? It’s truly a shame that so many people have attacked Khelif’s gender when her true story is one of inspiration. As a kid, she wanted to learn how to box, but her father forbade it, telling her that the sport was “not for girls.” Now she is competing at the Olympics. Yet even self-proclaimed feminists like Rowling want to ban her from boxing like Khelif’s father once did. Every day, it seems, anti-trans voices narrow who counts as a “real woman” in sports, in bathrooms and in life. Their fury and gender obsession come at the expense of women and girls who suddenly find themselves excluded from an increasingly restricted definition of womanhood. How much further must we bend to these ideologues? They succeeded in killing the Olympic dream for trans children everywhere. Now they want to push out women who do not meet their arbitrary standard of womanhood. Society has no need for gender police. It’s time we say, “no more.”"
"Why pro-Palestinian protesters are going after Kamala Harris, not Donald Trump",Not Avaiable For MSNBC,"Aug. 9, 2024, 2:02 PM PDT",https://www.msnbc.com/top-stories/latest/harris-gaza-israel-protests-obama-dreamers-rcna166006,"This is an adapted excerpt from the Aug. 7 episode of “Alex Wagner Tonight,” guest hosted by Ali Velshi. The last time Democrats sought to hold onto the White House after four years in power was in 2012, when then-President Barack Obama was running against Republican candidate Mitt Romney. Romney was not the most conservative candidate in the Republican Party, even back then. But he had staked out an aggressive hard-right position on the issue of immigration, running on a platform of “self-deportation” — making life so hard for immigrants in this country that they have no choice but to leave. Given that, it probably surprised a lot of people that young undocumented immigrants had chosen to spend their time and energy protesting … President Obama. They held mass demonstrations outside the White House where many were arrested. They showed up at his campaign offices in California, carrying signs that read, “Obama stop deporting Dreamers.” Protesters even held a hunger strike sit-in at Obama’s campaign offices in the then-swing state of Colorado. At issue were protections for Dreamers, people who were brought to this country without legal authorization as children, many of whom had lived in the U.S. almost their entire lives. Obama supported protections for those Dreamers, but he insisted that he could not grant them those protections alone. He said the Republican-controlled Congress would have to send him a bill. But then, in June of 2012, right in the middle of the campaign, something remarkable happened: Obama came around and decided to try. He announced that he would grant protection to thousands of Dreamers through executive order.  The pressure worked and Obama was re-elected with strong support from the Latino community, despite the protests. However, much to the chagrin of the Obama administration, the protests didn’t stop. Many of those Dreamers were now protected, but there were still some who weren’t. And the parents of those Dreamers could still be deported at any moment. So those activists kept pushing, even interrupting the president during speaking events. Obama, again, insisted that he did not have the power to take those actions alone. But activists kept the pressure on. The following year, Obama moved again, using another executive order to shield even more Dreamers from deportation and deprioritize the deportation of people without criminal records. There were plenty of people at the time who questioned the strategy of those protesters, who asked why they weren’t protesting Romney and the Republicans in Congress who were blocking progress on immigration reform; but those protesters understood a key part of how social movements work. They understood that sometimes in order to make real change you have to target the people who are moveable, the people who want you in their coalition, the people who actually care. That is both the burden and the beauty of what it means to be part of a functioning, big-tent political party that's responsive to social change — to be on the side of what the late Rep. John Lewis called “good trouble.” On Wednesday, at a rally in Detroit, Vice President Kamala Harris was interrupted by a group of demonstrators protesting the war in Gaza. After their second interruption, Harris shut down the protesters, telling them, “If you want Donald Trump to win, then say that. Otherwise, I’m speaking.” That’s a snappy line that makes for a good soundbite and it’s undeniably true that she will be a better president for their cause than Donald Trump. But, as those immigration protesters proved back in the Obama administration, these issues are more complicated than “we’re better for you than the other guys.” Harris has already proven she is the kind of thoughtful leader who listens and that she understands the nuance of this particular issue, even while some continue to insist that neither nuance nor context matters on this story. Her campaign presents a real opportunity to reset the relationship with the varied communities expressing dissatisfaction over this war, and America’s role in it. But will the Harris campaign use this as an opportunity to listen? And can those protesters use this as an opportunity to be heard? Join Ali Velshi, Rachel Maddow and many others on Saturday, Sept. 7, in Brooklyn, New York, for “MSNBC Live: Democracy 2024,” a first-of-its-kind live event. You’ll get to see your favorite hosts in person and hear thought-provoking conversations about what matters most in the final weeks of an unprecedented election cycle. Buy tickets here."
Mike Lindell company must pay attorney fees in 'Prove Mike Wrong' case,Not Avaiable For MSNBC,"Aug. 9, 2024, 1:58 PM PDT",https://www.msnbc.com/deadline-white-house/deadline-legal-blog/lindell-mypillow-attorney-fees-prove-mike-wrong-rcna166007,"In the latest legal development for conspiracy theorist Mike Lindell, his company was ordered to pay attorney’s fees in the fallout from litigation over his challenge to disprove his 2020 election fraud claim. Back in February, a federal judge approved a $5 million award against Lindell’s company in the so-called Prove Mike Wrong challenge. Lindell Management LLC had hosted a cyber symposium in which a participant could win $5 million if they proved that certain data Lindell had wasn’t valid election data. Robert Zeidman effectively succeeded in that task, and a federal judge ordered the award to be paid. Lindell Management has filed an appeal seeking to vacate the award. Meanwhile, a federal magistrate judge on Thursday ordered the company to pay another, much smaller amount. The latest litigation concerned Zeidman’s request for attorney’s fees connected with bringing a motion to compel responses during discovery. Zeidman sought $12,800, but the court found he was entitled to $4,508, with the judge applying a lower hourly rate than Zeidman requested and noting that his discovery requests were overbroad and contributed to the costs he incurred. Though it pales in comparison to the millions Lindell’s company was ordered to pay in the challenge loss, the MyPillow CEO may nonetheless appreciate the judge’s scrutiny of the fee award, especially if he loses his appeal. Subscribe to the Deadline: Legal Newsletter for updates and expert analysis on the top legal stories. The newsletter will return to its regular weekly schedule when the Supreme Court’s next term kicks off in October."
MAGA influencers say Trump is on track to lose the election,Not Avaiable For MSNBC,"Aug. 9, 2024, 1:05 PM PDT",https://www.msnbc.com/the-reidout/reidout-blog/trump-election-laura-loomer-nick-fuentes-maga-rcna166003,"Concerned about Donald Trump’s prospects of winning the presidential election, some right-wing influencers are lashing out over what they feel has been a weak campaign. Laura Loomer, a bigoted conspiracy theorist and social media troll whom Trump has praised repeatedly, sounded the alarm on X on Thursday. “President Trump needs to make some serious changes in his campaign ASAP,” she wrote in part. “The ground game is not sufficient. “The offense is lacking. “The communication is dismal. “The momentum is crashing. “Why are people who want to assist being pushed away instead of being embraced?” I don’t know precisely what Loomer means about people who want to assist being pushed away, though her outlandish behavior has, at times, made her a tad too toxic for some Trump supporters to associate with. Lately, however, Trump has had no problem sharing her bigoted, baseless attacks concerning Kamala Harris’ biracial identity, as he and other conservatives have falsely questioned the vice president’s Blackness. In the replies and quote tweets on Loomer’s post about Trump’s ground game, there was some pushback. But a number of popular MAGA enthusiasts were in agreement with her. That includes white nationalist Nick Fuentes, who wrote on X that his former dinner mate’s campaign is in a “death spiral” and listed his grievances. In the comments replying to his post, Fuentes faced a deluge of angry backlash. More criticism came from popular conservative pundit John Cardillo, who claimed on X that far-right activist group Turning Point USA and other pro-Trump groups are out of their depth. “Guys, we do not have a ground game,” he wrote in part. “Outsourcing that most critical function to TPUSA Action and two other untested PACs are not the actions of a campaign serious about winning. “Frankly, it’s insane.” Predictably, Cardillo faced blowback from TPUSA members and affiliates, who insisted that their efforts to help Trump have been moving swimmingly along. We’ll know in just a few months. But for the time being, there’s clearly discontent and division in MAGA world, with many Trump supporters worried about a campaign they think is primed to lose."
Why isn’t Donald Trump spending more time on the campaign trail?,Not Avaiable For MSNBC,"Aug. 9, 2024, 12:54 PM PDT",https://www.msnbc.com/rachel-maddow-show/maddowblog/isnt-donald-trump-spending-time-campaign-trail-rcna166022,"While his criminal trial unfolded in May, Donald Trump routinely complained that the legal proceedings represented “election interference.” To back up his rhetoric, the former president had a habit of telling reporters, “I’d like to be campaigning.” As the argument went, the Republican candidate wanted to be on the campaign trail — holding rallies, meeting voters, attending fundraisers, doing photo-ops, etc. — and the fact that he was stuck in a criminal courtroom a few days per week was interfering with his electoral opportunities. There were, however, a couple of glaring problems with the claim. For one thing, criminal proceedings aren’t simply put on indefinite hold when a defendant seeks elected office. For another, there were plenty of off-days in the trial, when Trump could’ve held campaign events. He didn’t bother. Three months later, the trial has run its course — a jury found the Republican guilty of 34 felonies — and the GOP nominee still isn’t maintaining much of a campaign schedule. CNBC reported: In August 2016, the then-candidate held 27 campaign rallies across 15 states. As August 2024 gets underway, Trump has held one event so far, and over the last six weeks, he’s only held eight. The Washington Post ran a related analysis, further documenting just how much the Republican candidate has slowed his schedule down this year. Asked at his meandering press conference about his light schedule, the former president called it a “stupid question,” before adding that he doesn’t believe he has to campaign to win. “I’m leading by a lot,” Trump said. The problem, of course, is that the line of inquiry wasn’t stupid — and he isn’t leading by a lot. The result is a good question for which there is no obvious answer: Why isn’t Trump campaigning more? Perhaps he has no idea how competitive the 2024 race has become. Maybe he’s become lazier. Perhaps he’s come to believe holding campaign events doesn’t help much. Maybe there’s an undisclosed health issue. It’s impossible to say for sure from a distance. Whatever the explanation, Trump’s next campaign event is in Montana — which is nowhere near a battleground state — not because he’s trying to give his campaign a boost, but because of a personal vendetta against a Democratic senator who bothered him six years ago. It’s quite a strategy."
