Title,Edit_Date,Origal_Date,Link,Content
Tim Walz deserves better than Team Trump's 'stolen valor' smears,Not Avaiable For MSNBC,"Aug. 9, 2024, 12:08 PM PDT",https://www.msnbc.com/opinion/msnbc-opinion/tim-walz-military-record-vance-trump-stolen-valor-rcna165978,"Minnesota Gov. Tim Walz is one of the finest people I’ve known in politics. He’s a leader of integrity, honor, humility and fight. He’s also a veteran who cares deeply about the well-being of his fellow veterans. Which is why it’s enraging and sad to watch Ohio senator and fellow veteran JD Vance and Team Trump attempt to smear his military record and accuse him of “stolen valor.” “When Tim Walz was asked by his country to go to Iraq, do you know what he did? He dropped out of the Army and allowed his unit to go without him — a fact that he’s been criticized for aggressively by a lot of the people that he served with,” Vance, a Marine veteran who served in Iraq, said Wednesday. The truth is that Walz enlisted in the Army National Guard at 17 and retired honorably before his run for Congress in 2005. As an artilleryman, Walz “served overseas in support of Operation Enduring Freedom and was the highest-ranking enlisted National Guard Soldier in southern Minnesota when he retired from 1st Battalion, 125th Field Artillery in 2005,” according to the U.S. Army. Building on this experience, Walz has dedicated his political career to helping other veterans. As the ranking member of the House Veterans Affairs Committee, veterans had no finer and more tenacious advocate than Walz. Every veteran service organization and veteran leader knows he is one of our own, and that we could always count on him. He knows how to get things done in Washington and for his communities. And he always has our back, from the new GI Bill expansion way back in 2008 to the Clay Hunt SAV Act in 2016 to countless fights in between.  The Democrats had to pick a veteran. And they picked one whom everyone knows, respects and trusts. (And one Rep. Nancy Pelosi and other key party leaders know, respect and trust.) Walz is a patriotic, down to earth and lovable bulldog.  If the Democrats weren’t going to pick a Republican or true independent — or Arizona Sen. Mark Kelly — I believe Walz is their best chance to win. Pew research from 2022 showed “about two-thirds of Republicans and Republican leaners (66%) say they like political leaders who have military experience,” with men generally more likely to regard military service as a positive.  Walz still embodies the spirit of his high school football coaching career. He knows how to spot talent, support teammates, make people better, rally diverse groups and encourage a team to victory. And he’s a fighter. Especially in hard times.  The loss of his brother Craig in 2016 was an unthinkable tragedy. But Walz rallied his family through it — like he can rally our country through all this pain and uncertainty now. He understands suffering, he understands working people, he understands national security, he understands America.  And he understands how to punch back. He’s also more liberal than me (and plenty of other Americans), and that will surely challenge him with independents and moderates. And with Walz and Harris together, the Democrats are going to have to fight incredibly hard to show they’re more moderate than the narrative suggests.  Republicans are already weaponizing the fact that Walz was Sen. Bernie Sanders’ preferred pick.  And now, they’re pulling one of their oldest, nastiest and most effective plays out of the playbook, by attacking Walz’s service.  The Harris-Walz campaign was clearly not ready for the Swift boat attacks — but they were entirely predictable. Details, military records and validators who know Walz and the truth should have been buttoned up in advance, ready at the announcement, and shared with the public and media. Unfortunately, they were not.  This is an unnecessary communications and strategy failure, and a reflection of a deeper lack of military and veterans cultural competency in the Democratic Party. This problem also exists in the GOP (to a lesser degree) and indeed all across our society. And it is an important reminder that we need more veterans across the political, media, education and business ecosystem. But the lack of representation — and resulting ignorance — is especially painful in politics. Just ask former Sens. Jim Webb (Virginia) or Bob Kerrey (Nebraska).  The Trump campaign hired Chris LaCivita — a longtime political operative who led the “Swift Boat Veterans for Truth” back in 2004 and helped sink Vietnam veteran John Kerry’s campaign — months ago. There’s no reason why Democrats should have been caught flat-footed this time around. Indeed, whether the Swift boat attacks are fair or not, the Harris-Walz campaign should have been more prepared for battle. Failing to plan is planning to fail. Now the campaign (and Walz himself), need to get a plan together, be transparent, clear and forceful, and make up the ground lost. And, where they can, counterattack smartly. This is the first battle of its kind for this new Democratic ticket. But it definitely won’t be the last. Every vote and foot of political ground taken is critical to victory. Especially with veterans — and especially with independent veterans in swing states.  I’d like to live in an America where nobody attacks a veteran's service or tries to compare one term of service to another. Every person who volunteers to wear the uniform has done something for our country that 99% of the public has not. And that should be respected — whether they’re a Navy SEAL hunting Osama Bin Laden or a cook making breakfast for other troops stateside at Fort Liberty. Service to our country is honorable. And one of the most dangerous jobs in America, whether you’re combat deployed or training back home.  But we live in this America. And no matter what anyone says, Tim Walz is incredibly sincere, hard-working, tough and likable. He’s a leader of integrity and character. He’s the opposite of ""weird."" And, yes, he’s funny.  He will change some hearts and minds. Hopefully, enough to beat Trump.  I’m just one veteran. But I’m rooting for him."
"On abortion rights, Trump keeps creating opportunities for Dems",Not Avaiable For MSNBC,"Aug. 9, 2024, 12:01 PM PDT",https://www.msnbc.com/rachel-maddow-show/maddowblog/abortion-rights-trump-keeps-creating-opportunities-dems-rcna166008,"In the spring, Donald Trump raised a few eyebrows by confirming — out loud, on camera, and on the record — that he was “looking at” possible restrictions on contraception. The former president eventually walked that back, but not before he created an opportunity that Democrats are already exploiting. In the summer, he’s doing it again. At his long, meandering press conference at Mar-a-Lago, Trump began by assuring the public that voters don’t much care about reproductive rights — a line Republicans have clung to in recent years, despite overwhelming evidence to the contrary — before lying about the Democratic agenda in deeply ugly ways. All of which set the stage for the pièce de resistance. NBC News reported: The GOP nominee went on to argue that there are “many things on a humane basis that you can do outside of that.” The audio in the clip isn’t great, but NBC News’ Garrett Haake posted a written transcript of the exchange online, which reinforces the fact that Trump didn’t appear to have any idea what he was talking about. In fact, all things considered, it’s reasonable to wonder whether the former president has any idea what mifepristone is. For those unfamiliar with the medication — a group that apparently includes the Republican nominee — the FDA approved it nearly a quarter of a century ago, to be used as part of a two-step process to terminate unwanted pregnancies up to 10 weeks. The drug has proven to be safe, effective, and commonly used. A notorious Trump-appointed judge in Texas curtailed access to the drug, though he was later overturned by the U.S. Supreme Court. Nevertheless, many on the right still harbor hopes that the Republican, in a second term, might enforce the Comstock Act, which prohibits the mailing of drugs used for abortions by mail. Indeed, all of this is part of the right-wing Project 2025 agenda, written in large part by members of Team Trump. It was against this backdrop that the GOP candidate left the door wide open to revoking access to the medication during the Q&A at Mar-a-Lago. Harris-Walz campaign manager Julie Chavez Rodriguez wasted little time in seizing on the comments from the press conference. “Already, women across the country are suffering because of the nightmare Donald Trump unleashed by overturning Roe v. Wade,” she said. “That reality — women forced to the brink of death before receiving the care they need, doctors facing the threat of jail time for doing their jobs, and survivors of rape and incest made to flee their states for basic health care — will only get worse if Donald Trump wins and wipes out access to medication abortion.”"
Indian wrestler Vinesh Phogat appeals weight disqualification ahead of gold medal match,Not Avaiable For MSNBC,"Aug. 9, 2024, 11:00 AM PDT",https://www.msnbc.com/deadline-white-house/deadline-legal-blog/vinesh-phogat-appeal-disqualified-weight-olympics-rcna165964,"Indian wrestler Vinesh Phogat just barely failed to make weight ahead of what was set to be her Olympic finals match on Wednesday against American wrestler Sarah Hildebrandt. Cuba’s Yusneylis Guzman Lopez, whom Phogat beat in the semifinal the day before, took Phogat’s place in the 50-kilogram final, and Hildebrandt won the gold — the second for U.S. women wrestlers in as many days. While it was a great feat for Hildebrandt and the U.S. team, it was devastating for Phogat and her many supporters. As NBC News reported, she’s known for her “impassioned activism against sexual harassment in her sport, including making major allegations against the former president of the Wrestling Federation of India.” Phogat then announced her retirement, writing on social media (in a translation from Hindi by Reuters) that her “dreams are shattered. I don’t have any more strength.” Now, you might be wondering: Why are you reading this dramatic wrestling story on a legal blog? That’s because the story might not be over: It’s now a legal one of sorts. Phogat has pleaded her case to the Court of Arbitration for Sport, an institution headquartered in Switzerland with an ad hoc division set up in Paris for the games. On Friday, the court noted that Phogat had filed an application with the tribunal, challenging United World Wrestling’s decision to replace her in the gold medal match. She wants to be awarded a (shared) silver medal.  There are separate weigh-ins for each day of wrestling, so Phogat had made the weight cut-off in her matches leading up to the finals. She reportedly only missed the weight on Wednesday by 100 grams — about a fifth of a pound. Sports Illustrated reported that “she was not only disqualified from the match against Hildebrandt but also had her previous victories in the tournament nullified.” Phogat’s path to success in her challenge is unclear because the UWW's wrestling rules state: “If an athlete does not attend or fail the weigh-in (the 1st or the 2nd weigh-in), he will be eliminated of [sic] the competition and ranked last, without rank.” The sports court said the matter has been referred to an arbitrator to hold a hearing with the parties on Friday, with a decision expected before the end of the Olympic Games on Sunday. Subscribe to the Deadline: Legal Newsletter for updates and expert analysis on the top legal stories. The newsletter will return to its regular weekly schedule when the Supreme Court’s next term kicks off in October."
Jack Smith seeks more time for planning after immunity ruling,Not Avaiable For MSNBC,"Aug. 9, 2024, 8:25 AM PDT / Updated Aug. 9, 2024, 10:18 AM PDT",https://www.msnbc.com/deadline-white-house/deadline-legal-blog/jack-smith-trump-delay-chutkan-immunity-rcna165928,"UPDATE (Aug. 9, 2024, 1:18 p.m. ET): On Friday, Judge Tanya Chutkan granted special counsel Jack Smith's request for a time extension to file a joint status report in Donald Trump's federal election interference case. The report is now due Aug. 30 and a status conference is set for Sept. 5, Chutkan said. A hallmark of Donald Trump’s litigation strategy has been delay. Now special counsel Jack Smith wants more time in the federal election interference case, though not for the purpose of dragging it out. In a joint filing on Thursday from Smith and Trump’s lawyers, the special counsel told U.S. District Judge Tanya Chutkan that prosecutors are still assessing the Supreme Court’s presidential immunity ruling in Trump v. United States, including by consulting with other components of the Justice Department. “Although those consultations are well underway, the Government has not finalized its position on the most appropriate schedule for the parties to brief issues related to the decision,” according to the filing, called a “joint status report.” Smith asked Chutkan for “additional time to provide the Court with an informed proposal regarding the schedule for pretrial proceedings moving forward.” Chutkan had asked the parties for the proposal to determine how to proceed after the case returned to her following the Supreme Court's July 1 immunity ruling. She had also set a status conference for Aug. 16. In Thursday’s filing, Smith asked Chutkan for an extension to submit another joint report by Aug. 30, and to hold the previously scheduled Aug. 16 conference at some point after that. Unsurprisingly, the filing noted that Trump “does not object to the Government’s request for an extension.” So, what’s going on here? It’s not fully clear from the filing, which (unsurprisingly) didn’t detail the DOJ’s deliberations or the extent to which there is disagreement within the department over how to move forward. To be sure, the Supreme Court’s new test for determining what may be immune from prosecution is cryptic enough that it could prompt different interpretations and prosecutorial strategies. The forthcoming filing on the government’s position may provide more insight into the matter. At any rate, pushing the proposal back a few weeks won’t make the difference in whether a trial happens before the election. The timing and substance of the Supreme Court ruling has already made that impracticable. The real question now isn’t whether a trial happens before the presidential election but, in the near term, whether Trump wins that election, in which case he can crush the prosecution himself. If he loses, then the question is what will be left of the case after the high court ruling that at least narrows the prosecution. That’s not an excuse for the government being unprepared with its position about how to proceed, but it’s a reality hovering over the case no matter what Smith’s eventual position is. The bottom line for now is that, since there won’t be a pre-election trial, it’s difficult to see this development as a meaningful delay in the grand scheme of things. That delay has already occurred. The next move is up to Chutkan to decide whether to accept the request. If she does, then there won’t be significant movement in the case before September. As it happens, that’s when Judge Juan Merchan is expected to rule on the immunity decision’s effect on Trump’s guilty verdicts in New York and to sentence him that month if he finds that the immunity ruling doesn’t stand in the way. So the next big filing in Trump’s cases could be Smith’s brief due later this month to the 11th U.S. Circuit Court of Appeals, challenging the dismissal of Trump’s federal classified documents case, whose fate, like the federal election interference case, is also partly tied to the presidential election outcome.    Subscribe to the Deadline: Legal Newsletter for updates and expert analysis on the top legal stories. The newsletter will return to its regular weekly schedule when the Supreme Court’s next term kicks off in October."
Donald Trump and JD Vance are failing America's favorite political test,Not Avaiable For MSNBC,"Aug. 9, 2024, 10:09 AM PDT",https://www.msnbc.com/the-reidout/reidout-blog/trump-vance-harris-walz-beer-question-rcna165834,"This is an adapted excerpt from the Aug. 7 episode of ""The Reid Out."" Let’s talk about joy — no not me, Joy, but the feeling of joy. More specifically, the joy being felt by Americans backing the Harris-Walz ticket. A joy that is palpable and pervasive.  We saw that joy on full display, with massive crowds greeting Vice President Kamala Harris and Minnesota Gov. Tim Walz at their rallies in Wisconsin and Michigan on Wednesday. It feels like we are experiencing another 2008 Obama moment. The energy, the excitement, the enthusiasm. It feels fun. Imagine that, American politics … joyful again. The 2024 presidential election has quickly become the tale of two tickets: one radiates joy and the other is dour and frankly, frightening. And it’s clear that has Republicans freaking out. Harris has not only been criticized for her race, gender and parental status — but also for laughing. As if an infectious, energizing belly laugh — the literal display of joy — is a bad thing. Walz is also a joyful guy. His former students love him. He was a popular and successful high school football coach. He made “weird” happen. He’s a Midwesterner with “big dad energy” who will offer tips on how to fix your car and save money to boot. Some of you may be familiar with the “beer question” in U.S. politics: a thought experiment often utilized by the media or in polling, which says voters will generally elect the candidate they would rather have a beer with. Victory in American politics often goes not to the candidate who better articulates their platform, but rather, to whoever is more likable. So you be the judge: Who would you rather have a beer with? Harris, who dares to laugh and Walz, the plain-spoken fun uncle who will defend the people he loves? Or Trump, who rambles about sharks and hatred, who makes fun of people and smirks but who rarely laughs, and who doesn’t seem capable of talking to a child — even his own grandkids? And his cat lady-hating sidekick Sen. JD Vance? That guy is really weird. So weird the couch meme won’t die. Vance is basically stalking the Democratic ticket. On Wednesday, he stunned reporters by attempting to confront Harris and Walz on the tarmac when their planes arrived in Wisconsin at similar times.  Vance told reporters he “just wanted to check out [his] future plane.” Walking up to the vice president and Air Force Two is not a thing that normal people do. His weirdness aside, this race has also been a total reversal of how the parties are normally framed. The Republicans love to attack Democratic elites — but this time around, Harris and Walz actually feel like the more regular, normal middle-class folks. Yes, they are living extraordinary political lives but due to hard work, not connections or riches.  Harris went to Howard University, an HBCU, then The University Of California, Hastings College Of Law. Walz attended an open-admissions teachers college in northwest Nebraska. Quite the opposite of the candidates on the Republican side — with Trump-Vance being the Ivy League ticket, loved by the billionaires. It’s a conundrum for the Republican Party. The so-called populist MAGA movement is now bankrolling a celebrity who inherited his wealth, who is not out there campaigning but instead golfing at this exclusive ritzy resort, and a vice presidential candidate anointed by another super weird guy, tech investor Peter Thiel. It’s also a ticket backed by billionaire tech bros who want to unleash Project 2025 — the brainchild of rich people — on the American people.  It is a hateful vision that all people should fear … and it’s a vision reflected perfectly by the two men who want to execute it. Join Joy Reid, Rachel Maddow and many others on Saturday, Sept. 7, in Brooklyn, New York, for “MSNBC Live: Democracy 2024,” a first-of-its-kind live event. You’ll get to see your favorite hosts in person and hear thought-provoking conversations about what matters most in the final weeks of an unprecedented election cycle. Buy tickets here."
"On Harris’ racial identity, Trump apparently can’t help himself",Not Avaiable For MSNBC,"Aug. 9, 2024, 9:43 AM PDT",https://www.msnbc.com/rachel-maddow-show/maddowblog/harris-racial-identity-trump-apparently-cant-help-rcna165982,"Donald Trump spent much of last week taking aim at Kamala Harris’ racial identity — up to and including the Republican promoting messages related to the Democrat’s birth certificate. The tactics were as racist as they were familiar: Axios described the effort as “Trump’s new birtherism.” Earlier this week, Sen. Lindsey Graham, a former Trump critic who became a sycophantic ally, appeared on Fox News and suggested the party steer clear of comments about Harris’ race and ethnicity. “Every day we’re talking about her heritage ... is a good day for her and a bad day for us,” the South Carolina Republican said. Putting aside the fact that it’s a bad sign when a senator has to publicly appeal to his party’s presidential nominee to be less racist, Graham’s advice appeared sensible. Even Trump’s allies struggled to explain why, exactly, the GOP nominee was investing so much energy into targeting Harris on racial grounds. The former president nevertheless ignored Graham’s recommendation. The New Republic highlighted one of the more memorable exchanges from Trump’s Mar-a-Lago news conference: When a reporter, referencing one of Trump’s comments from last week, specifically asked the former president how it is that Harris only recently decided to be Black, the GOP nominee replied, “You’ll have to ask her that question because she’s the one that said it. I didn’t say it.” As part of the same exchange, Trump went on to argue: “From her standpoint, I think it’s very disrespectful to both, really. Whether it’s Indian or Black, I think it’s very disrespectful to both.” So, a few things. First, the idea that he “didn’t say” that Harris recently decided to be Black is the opposite of the truth. Appearing at the National Association of Black Journalists’ convention last week, Trump said — out loud, on the record and on camera — “She was always of Indian heritage, and she was only promoting Indian heritage. I did not know she was Black until a number of years ago when she happened to turn Black, and now she wants to be known as Black.” He added, “She was Indian all the way, and then all of a sudden, she made a turn and ... she became Black. ... Is she Indian, or is she Black?” Second, the idea that a biracial person is being “disrespectful” by honoring their mother’s and father’s heritage is every bit as offensive as it seems. Finally, spare a thought for the Trump sycophants who’ve tried and failed to defend the former president’s fixation on Harris’ race — Republican Rep. Byron Donalds of Florida, I’m looking in your direction — only to have the GOP nominee casually stroll back into the racist trap of his own making."
