,Title,Edit_Date,Origal_Date,Link,Content
0,Kamala Harris practically dares Trump to debate her,Not Avaiable For MSNBC,2024-07-31 12:56:00,https://www.msnbc.com/top-stories/latest/kamala-harris-trump-debate-september-rcna164521,"Kamala Harris, the de facto Democratic presidential nominee, once again challenged Donald Trump to debate her, telling a roaring crowd in Atlanta on Tuesday night that he was feeling the pressure of running against her in November. ""So the momentum in this race is shifting, and there are signs that Donald Trump is feeling it — you may have noticed,"" the vice president said at a campaign rally, as she pointed to Trump's refusal to commit to a debate in September. “He won’t debate, but he and his running mate sure seem to have a lot to say about me.” “Well, Donald, I do hope you’ll reconsider to meet me on the debate stage,” Harris said. “Because as the saying goes, 'if you’ve got something to say, say it to my face.'” Harris' remarks seem designed to taunt Trump into debating her. The vice president has been engaged in a back-and-forth with the Trump campaign as it dithers the GOP nominee's participation in a previously agreed-upon Sept. 10 debate, which it arranged with Joe Biden's re-election campaign before he withdrew from the race. On Thursday, Harris accused the Trump campaign of “backpedaling” on the scheduled debate, saying, “I think that the voters deserve to see the split screen that exists in this race on a debate stage.” Trump's campaign spokesperson, Steven Cheung, later said it “would be inappropriate to schedule things with Harris because Democrats very well could still change their minds.” The calculations for the Trump campaign have shifted dramatically since Biden dropped out of the race and endorsed Harris. Trump had previously challenged Biden to debate “anytime, anywhere, any place,” and the fallout of Biden’s disastrous showing at the June 27 debate also overshadowed his own blathering performance. Now, as his campaign tries to reorient its strategy for Harris, Trump, whose debate style is rich on insults and poor on substance, now faces the daunting prospect of taking on a former prosecutor known for her debate punches on live television. In an interview with Fox News this week, Trump himself waffled on the subject. He suggested there was no point debating Harris because “everybody knows who I am, and now people know who she is.” He then said he would “probably” debate Harris, but added that he “can also make a case for not doing it.”"
1,Harris' historic campaign builds on breakthroughs by other Black women,Not Avaiable For MSNBC,2024-07-31 12:15:00,https://www.msnbc.com/top-stories/latest/harris-historic-moseley-braun-2024-rcna164343,"This is an adapted excerpt from the July 29 episode of ""The Beat."" It was a whirlwind first week for Vice President Kamala Harris’ historic presidential campaign. The Guardian described her candidacy as a generational shift in U.S. politics.  Harris, of course, is no stranger to breaking barriers — she’s serving as the first woman vice president in our country’s history — but she's drawn from a range of trailblazers who laid the groundwork for this moment.  Geraldine Ferraro, a Democrat, became the first female vice presidential candidate on a major U.S. party ticket in 1984. There's also former Alaska Gov. Sarah Palin, the Republican Party's first female candidate for vice president. In 2016, Hillary Clinton shattered the glass ceiling when she won the Democratic presidential nomination. Shirley Chisholm was both the first Black woman elected to Congress and the first to run for president. Chisholm pushed her party, which has since come to rely heavily on Black voters, to take Black leadership seriously. Before ascending to the highest echelon of the Democratic Party, Harris was the only Black woman in the Senate. There was only one Black female senator who served before her. That senator was Sen. Carol Moseley Braun of Illinois, sworn into the Senate in 1993. Moseley Braun, who ran on a platform of women’s and civil rights, immediately challenged the status quo in Washington. In her first year in office, she defiantly took to the Senate floor to protest the renewal of a congressional patent for the United Daughters of the Confederacy, whose insignia featured the Confederate flag. “I’ve got to tell you, this vote is about race. It is about racial symbolism. … It is about our racial past and the single most painful episode in American history,” Moseley Braun told her colleagues.  Moseley Braun also challenged sexism in the Senate. She was among the first to buck the unofficial ban on women wearing pants on the Senate floor. Moseley Braun wore them repeatedly until the rule was changed. The feminist publication Ms. described that action as a “rebellion” and “a seismographic event.” On Monday’s episode of “The Beat,” I spoke with the former senator about Harris’ historic candidacy. Moseley Braun told me she was “over the moon” and “strongly supporting” the vice president. She also pledged to do everything in her power to help Harris make history yet again: “We have 98 more days to the election itself. We all have to show up and be there for her, take advantage and not let this enthusiasm dwindle. People have short memories sometimes. But if we can keep the drumbeat going, we can have our first woman president.”  Join Ari Melber, Rachel Maddow and many others on Saturday, Sept. 7, in Brooklyn, New York, for “MSNBC Live: Democracy 2024,” a first-of-its-kind live event. You’ll get to see your favorite hosts in person and hear thought-provoking conversations about what matters most in the final weeks of an unprecedented election cycle. Buy tickets here."
2,"Trump pushes his luck with new attack on Harris, China and Russia",Not Avaiable For MSNBC,2024-07-31 07:49:00,https://www.msnbc.com/rachel-maddow-show/maddowblog/trump-pushes-luck-new-attack-harris-china-russia-election-2024-rcna164482,"In her first week as an unexpected presidential candidate, Vice President Kamala Harris confronted plenty of racist and sexist lines of attack, but as a Washington Post report makes clear, Donald Trump added to this record in an especially ugly way in his latest Fox News interview. Fox News’ Laura Ingraham started to ask the GOP candidate how international leaders would consider a Harris presidency, but before she could even finish asking, Trump interjected. “They’ll walk all over her,” the former president said, adding, “She’ll be so easy for them. She’ll be like a play toy. They look at her and they say, ‘We can’t believe we got so lucky.’” Trump then appeared to turn toward the camera and said, “And I don’t want to say as to why, but a lot of people understand it.” A Trump campaign spokesperson told the Post the Republican nominee wasn’t referring to race or gender, and if you believe that, I have a lovely Trump University seminar I’d love to sell you. The obvious problem with the former president’s comments was that they were overtly offensive in ways even he should be able to understand. But there are plenty of less obvious problems, too. For one thing, Harris has spent the last four years in national office, meeting with international officials and leaving no doubt that she’s a force to be reckoned with. For another, if Trump is so convinced that international leaders will walk all over the Democrat, perhaps he could explain why he’s so afraid to share a debate stage with her. But perhaps most important is the degree to which Trump keeps failing tests of self-awareness. Indeed, if he’s looking for an American leader who wasn’t taken seriously abroad, Trump probably ought to find a mirror. In 2018, for example, he addressed the United Nations general assembly, where foreign diplomats literally laughed at him. China’s state-run media routinely characterized Trump — during his presidency — as a bumbling fool who had a habit of slapping himself in the face. Even U.S. allies quietly conceded that they perceived the then-president as an intemperate child with a short attention span. Let's also not forget about a 2019 international gathering in which Canadian Prime Minister Justin Trudeau, French President Emmanuel Macron, and the U.K.'s Boris Johnson were overheard mocking Trump, treating him like a punch-line to a joke they found rather exasperating. Russia’s Vladimir Putin was more reluctant to ridicule Trump in public, but that’s only because he enjoyed walking all over the Republican and didn’t feel the need to put that advantage at risk. All of which is to say, Trump’s latest line of attack isn’t just ugly, and it isn’t just wrong. It’s also the latest example of the former president engaging in projection."
3,"The problem(s) with Trump’s ugly rhetoric about Harris, antisemitism",Not Avaiable For MSNBC,2024-07-31 06:00:00,https://www.msnbc.com/rachel-maddow-show/maddowblog/problems-trumps-ugly-rhetoric-harris-antisemitism-jewish-election-2024-rcna164448,"Donald Trump seems determined to convince voters that Vice President Kamala Harris is antisemitic. She’s not, and the former president’s attacks are as ugly as they are false, but the Republican appears preoccupied with pushing this line anyway. During a speech last week, for example, the GOP nominee falsely said his likely Democratic rival is “totally against the Jewish people” — a curious claim about someone who’s married to a Jewish person — and as the Associated Press reported, Trump went even further yesterday. The former president seemed quite worked up on the issue, ranting that Harris dislikes both Israel and Jews — it’s something “everybody knows,” Trump said, reality notwithstanding — while adding that Jewish voters are “fools” to vote Democratic. The radio host, Sid Rosenberg, proceeded to say that Harris’ Jewish husband, second gentleman Doug Emhoff, is “a crappy Jew” and “a horrible Jew.” And while Trump didn’t use those words himself, as an audio clip makes clear, he seemed to agree with the condemnations. A Politico report described the comments as ""bizarre."" A press statement from the Harris campaign, not surprisingly, went much further, describing the on-air exchange as “disgusting” and adding, “America is better than the fear, hate, and despicable insults of Donald Trump.” At this point, we could spend a few paragraphs talking about how wrong the Republican’s attack is. We could also highlight the fact that Trump hasn’t even tried to substantiate his absurdities with evidence. But as important as those points are, I’m struck by a larger point: Trump apparently believes he has credibility when it comes to antisemitism, but he really doesn’t. As regular readers might recall, it was just four months ago, for example, when the GOP nominee invoked a familiar dual loyalty trope by claiming that Jewish voters who support Democrats hate Israel. To put it mildly, Jewish Democrats in Congress were not impressed. An Axios report quoted Rep. Debbie Wasserman Schultz of Florida, for example, saying, “Trump demonstrates daily his lack of fitness for the presidency by spreading dangerous stereotypes and embracing antisemites.” Rep. Kathy Manning of North Carolina added that the former president’s rhetoric is “particularly disgraceful and dangerous at a time when Jews are facing dangerous levels of antisemitism nationwide.” Rep. Jamie Raskin of Maryland issued an especially pointed response, noting, “Luckily I don’t know any Jews who look to Donald Trump for advice on how to be Jewish. After all, this is the guy who saw ‘very fine people on both sides’ of an antisemitic riot and entertained the neo-Nazi Holocaust denier Nick Fuentes over at his house at Mar-a-Lago for dinner.” That larger pattern was of particular interest. During his 2016 campaign, for example, Trump spoke to the Republican Jewish Coalition and said, “You’re not gonna support me because I don’t want your money. You want to control your politicians.” He added, “I’m a negotiator — like you folks.” Several months later, in the run-up to Election Day 2016, the Republican promoted antisemitic imagery through social media. In the closing days of the campaign, Trump again faced accusations of antisemitism, claiming Hillary Clinton met “in secret with international banks to plot the destruction of U.S. sovereignty in order to enrich these global financial powers.” While in office, the then-president used some highly provocative rhetoric about Jews and what he expected about their “loyalties.” Trump also spoke at the Israeli American Council’s national summit, where he suggested Jewish people are primarily focused on wealth, which is why he expected them to support his re-election campaign. There was also his ugly reaction to a racist event in Charlottesville in 2017, in response to torch-wielding bigots chanting, “Jews will not replace us.” After his defeat, Trump kept this going, whining that Jewish voters “don’t love Israel enough,” dining with prominent antisemites at Mar-a-Lago and arguing that Jews need to “get their act together” and “appreciate” Israel “before it is too late.” In late 2022, the former president went so far as to declare that Jewish leaders “should be ashamed of themselves” over their “lack of loyalty.” Around the same time, he added to the list, using related rhetoric about Jews with a documentary filmmaker. In his earlier campaigns, Trump has struggled badly with Jewish voters. If he thinks lying about Harris will change that, the Republican probably ought to lower his expectations. This post updates our related earlier coverage."
4,Beyoncé's 'Freedom' becomes the soundtrack to Kamala Harris' historic campaign,Not Avaiable For MSNBC,2024-07-25 09:41:00,https://www.msnbc.com/top-stories/latest/beyonce-kamala-harris-campaign-freedom-rcna163599,"In the days since Vice President Kamala Harris launched her bid for president, Beyoncé’s song “Freedom” has become the soundtrack to her campaign. Harris walked out to the song at her first visit to her campaign headquarters in Wilmington, Delaware, on Monday. It played the next day at her first campaign rally in Wisconsin. On Thursday, the campaign released its first ad, which again featured the song. The video contrasts Donald Trump's vision for the country with hers, with Harris saying in a voiceover: “There are some people who think that we should be a country of chaos, of fear, of hate. But us? We choose something different: We choose freedom.” Beyoncé’s “Freedom,” which features rapper Kendrick Lamar, was released in 2016 as part of her visual album “Lemonade.” Rolling Stone called the song at the time “one of the most striking political statements” of Beyoncé’s career. Although the Grammy Award-winning artist has not officially endorsed any candidate in this year's race, she did grant Harris’ campaign permission to use the song through the next few months of the election, CNN reported on Monday. (That Harris is using the music with the artist's permission also stands in stark contrast to Trump, who's been asked not to play songs by the Rolling Stones, R.E.M., Prince, Neil Young, Rihanna, Guns N' Roses, Queen and Adele — among others.) Harris is a known Beyoncé fan. She and her husband, Doug Emhoff, went to the singer’s Renaissance World Tour concert in Maryland last August. The tickets, valued at $1,655.92, were a gift from Beyoncé, according to Harris’ financial disclosure report earlier this year. Beyoncé has a history of supporting Democratic candidates. She sang the National Anthem at President Barack Obama's 2013 inauguration and performed at a concert for Hillary Clinton's 2016 campaign alongside her husband, Jay-Z — much to Donald Trump's consternation, even years later. Beyoncé also endorsed the Biden-Harris ticket in 2020."
5,"Trump says Harris shouldn’t be ‘allowed to run,’ recycling weird claim",Not Avaiable For MSNBC,2024-07-25 06:00:00,https://www.msnbc.com/rachel-maddow-show/maddowblog/trump-says-harris-shouldnt-allowed-run-recycling-weird-claim-rcna163593,"In his first rally since President Joe Biden withdrew from the 2024 race, Donald Trump did exactly what everyone expected him to do: The Republican spent much of the event going after Vice President Kamala Harris. The former president’s case against his new rival, however, has tended to rely heavily on vague name-calling: Trump called the likely Democratic nominee a “lunatic,” for example. But during his pitch in North Carolina, one the GOP nominee’s lines of attack stood out: The Republican’s followers, naturally, cheered the rhetoric. There is a degree of irony to the comments: A jury recently found Trump guilty of nearly three dozen felonies. If Harris “shouldn’t even be allowed to run for president” because “she’s committing crimes,” then I supposed we should look forward to the former president delivering a withdrawal speech of his own. What’s more, insisting that the Democratic vice president is “committing crimes” would be less ridiculous if Trump had any evidence of Harris, you know, actually committing crimes. But of particular interest was the GOP candidate’s suggestion that his likely Democratic rival “shouldn’t even be allowed to run” for the White House. If the comment rang a bell, there’s a good reason for that: Part of the problem here is that the Republican nominee is getting lazy, recycling stale insults, nicknames and attacks. But just as notable is the fact that Trump has long taken a keen interest in who should and shouldn’t be “allowed” to run against him, and in a remarkable coincidence, he consistently argues that those who stand in his way are — or should be — ineligible for American ballots. Trump already earned a reputation as someone who was hostile toward democracy. This won’t help. This post updates our related earlier coverage."
6,Trump voters fear 'excitement' of Harris campaign,Not Avaiable For MSNBC,2024-07-25 03:00:00,https://www.msnbc.com/top-stories/latest/wisconsin-voters-swing-state-trump-harris-2024-rcna163528,"On Tuesday, Elise Jordan, an MSNBC political analyst and former George W. Bush administration staffer, sat down with voters in the battleground state of Wisconsin. The Badger State has played a pivotal role in deciding the last two presidential elections. In 2016, Donald Trump became the first Republican to win Wisconsin since 1984, defeating Hillary Clinton by almost 23,000 votes. In 2020, Joe Biden turned the state back to blue, beating Trump by a similar margin. Ahead of the 2024 election, Jordan spoke with two voting blocs that could help move the margin in either candidate's direction: female Trump supporters and right-leaning swing voters. Jordan, who was just in Wisconsin last month conducting similar focus groups, said she was shocked at the burst of energy Vice President Kamala Harris' candidacy had injected into the race — among both Trump supporters and swing voters. The group of Trump supporters told Jordan they feared the Democratic ticket shake-up could lower Trump’s chances of retaking the White House, since they believe Harris could motivate young, minority and female voters to head to the polls. “Everyone is excited about her, and that scares me,"" one voter shared. Asked how they view Harris’ competence and experience compared to Biden, voters said they saw the vice president as worse. One woman called out Harris for her role in the administration's immigration policy: ""She doesn't even know what's going on at the border, and that's what she was supposed to be in charge of? I mean, as a schoolteacher, if I didn't do what I was supposed to be doing, you better believe my job would be in jeopardy."" Another voter took aim at Harris' intelligence, calling her an ""idiot"" and ""not real smart."" The voters also expressed doubt over the possible election outcome. Asked whether a Harris victory in November would be an ""honest result,"" the entire group shook their heads at Jordan. As for right-leaning swing voters, the group said they had concerns about both Harris and Trump. One voter told Jordan she was open to voting for Harris but felt ""uneasy"" over how much the vice president may have known about Biden's mental and physical fitness. She said if Harris was ""willing to hide that type of information"" about Biden, ""what she’s willing to hide for herself?” As for their views of the former president, a voter told Jordan she couldn't ignore Trump's criminal convictions. She also had issues with his integrity and moral character, suggesting Trump could use the office to ""retaliate"" against his enemies. Another voter voiced shared concern over Trump’s “making too aggressive of choices” and acting out of impulse. However, she also worried Harris could be too cautious in responding to threats and make the U.S. appear ""weak."" One swing voter had a message for both candidates: “It would just be nice if they concentrate more on the issues instead of the mudslinging and personal attacks. ... Let’s try to find that common ground where we can agree on things. Let’s start with that.”"
