,Title,Edit_Date,Origal_Date,Link,Content
7,The Secret Service failed Trump. They can’t fail Harris too.,Not Avaiable For MSNBC,2024-07-24 14:57:00,https://www.msnbc.com/top-stories/latest/secret-service-president-assassination-trump-harris-rcna163421,"This is an adapted excerpt from the July 23 episode of ""The Last Word."" With just over 100 days until Election Day, Vice President Kamala Harris spent her first day as the presumptive nominee for president of the Democratic Party on the campaign trail in the crucial electoral college state of Wisconsin. Harris’ Secret Service detail, which was already very strong, should now be strengthened  — not just because she has moved up from vice presidential nominee to presidential nominee, but because we have seen recent proof of Secret Service protection not being strong enough. The director of the Secret Service resigned Tuesday after being sharply questioned by both Democrats and Republicans in a congressional hearing about how a lone gunman was allowed to get on a roof within range of a presidential candidate and fire shots that could have killed the candidate and did kill one of the spectators and wounded two others. That is the first time in history that a Secret Service director has resigned after shots were fired, even though every single time shots have been fired at a president since the creation of the Secret Service, after Abraham Lincoln’s presidency, it has always been the Secret Service’s fault. Every time.  In every single shooting, the Secret Service made the mistake of giving the shooters a clear shot. In 1901, the Secret Service allowed an assassin to walk right up to President William McKinley to shake his hand and instead revealed a handgun shooting the president to death. Congress had no hard questions for Secret Service Director John Wilkie after that, and the Secret Service director served another 10 years in that job after failing to protect the life of President McKinley. In 1933, two weeks before his inauguration, an assassin approached President-elect Franklin Delano Roosevelt’s car in Florida and fired shots that missed him but killed a mayor who was standing on the running board of the president-elect’s car. Once again, the Secret Service let an assassin with a gun get too close to the president-elect. Roosevelt was riding in an open car. It was an easy shot because it was an open car. The world was lucky that the assassin missed. Congress did not grill Secret Service Director William Moran who allowed that assassin to get so close to the president. Congress did not ask why Moran allowed the president-elect to ride in an open car. Moran served three more years as Secret Service director and continued to allow Roosevelt to ride fully exposed in an open car, which Roosevelt did throughout his presidency. Thirty years after those shots were fired at Roosevelt, shots fired at President John Fitzgerald Kennedy riding in the back of an open car took the life of the youngest president in history. As pieces of the president’s skull and brain tissue fell onto the surface of the open car behind President Kennedy’s head, his wife tried to reach back to grab those pieces while the fully incompetent Secret Service began climbing onto the back of the limousine and urging the first lady to stay in the car.       It was only after Kennedy was pronounced dead at Parkland Memorial Hospital in Dallas, Texas, that afternoon that Secret Service Director James Rowley decided the president should never again ride in an open car. And no president ever has, since that day. If Rowley had made that decision one day before, American history would be so much less tragic. Rowley served 10 more years as Secret Service director after losing Kennedy on his watch because of his incompetence. Kennedy’s younger brother Bobby Kennedy was assassinated in 1968 while running for president.  The Secret Service provided protection to presidential candidates starting the day after Bobby Kennedy was assassinated. Bobby Kennedy’s assassin was able to walk up to him and shoot him point blank.  In 1975, the Secret Service allowed President Gerald Ford to be shot at twice within two weeks. Stuart Knight was the director of the Secret Service then. He allowed people with no firearms training to simply get too close to the president.  He’s the only Secret Service director in history who allowed the same president to be shot at twice. But he wasn’t finished. He became the only Secret Service director in history to allow two different presidents to be shot at.  He was in charge when the Secret Service allowed another completely untrained pedestrian with a handgun to walk up and get close enough to President Ronald Reagan to fire shots as the president was entering the Washington Hilton. In that shooting, the Secret Service also allowed the president’s press secretary to be shot. And in that shooting, the Secret Service also allowed a Secret Service agent to be shot. All because the Secret Service and Secret Service directors had not yet figured out how to prevent pedestrians from randomly walking up to presidents and firing handguns at them.  There was no condemnation of Knight after the Gerald Ford shootings — two in one month — or the Ronald Reagan shooting. He left the Secret Service after eight years as director.  The Secret Service got marginally better after some of these shootings. No more open cars. No more people allowed to get close to a president moving on foot in or out of a building.  And now the Secret Service thinks it has figured out how to protect Donald Trump at his rallies. The Washington Post reports that the Secret Service urged the Trump campaign to “stop scheduling large outdoor rallies and other outdoor events with big crowds.”  But at the outdoor rally in Pennsylvania, the Secret Service failed to do the elementary thing of securing every possible elevated firing position. The roof it decided not to secure was the roof the murderer used to fire at the candidate and his supporters. It was, as usual, the Secret Service’s fault. The Secret Service director was right to resign, but she should not have been the first to resign. The new acting director of the Secret Service, Ronald Rowe, is a 24-year veteran of the Secret Service. We can only hope that he will provide the protection that allows this campaign to make it to Election Day with all of the big surprises being only political surprises. Join Lawrence O'Donnell, Rachel Maddow and many others on Saturday, Sept. 7, in Brooklyn, New York, for “MSNBC Live: Democracy 2024,” a first-of-its kind live event. You’ll get to see your favorite hosts in person and hear thought-provoking conversations about what matters most in the final weeks of an unprecedented election cycle. Buy tickets here."
8,"Mike Johnson insists Kamala Harris’ race and gender are irrelevant, as Republicans keep calling her a ‘DEI hire’",Not Avaiable For MSNBC,2024-07-24 12:53:00,https://www.msnbc.com/top-stories/latest/republicans-kamala-harris-dei-hire-race-gender-rcna163484,"As the ugly attacks on Kamala Harris from the right take shape, House GOP leaders are warning their fellow Republicans not to focus on her race or gender in their criticism of the de facto Democratic presidential nominee. The racist and misogynistic attacks on the vice president from conservative commentators and GOP lawmakers began almost immediately after she announced that she will seek her party’s nomination. Some lawmakers have called her a “DEI hire,” suggesting that Harris — who has served as a U.S. senator, a California attorney general and a San Francisco district attorney — is where she is due to identity politics and not because of her accomplishments. It appears that the top brass in the House GOP are trying to steer members of their party away from such bigoted attacks. At a closed-door meeting Tuesday, Rep. Richard Hudson of North Carolina, who chairs the National Republican Congressional Committee, urged his party members to instead focus on Harris’ record with the Biden administration, Politico reported. Afterward, House Speaker Mike Johnson told Politico that this election “has nothing to do with race” and that it’s a comparison between the two candidates’ strengths and their ideas for how to solve the country’s problems. “This election will be about policies and not personalities,” the Louisiana Republican told reporters after the meeting, according to The Associated Press. “This is not personal with regard to Kamala Harris, and her ethnicity or her gender have nothing to do with this whatsoever.” Whether such calls will sink in among House Republicans remains to be seen — they certainly do not seem to have gotten through to their presidential nominee. According to NBC News, while on a call hosted by the Republican National Committee on Tuesday, Donald Trump accused Harris of having “played the race card on a level you rarely see” in debates with Joe Biden during the Democratic presidential primaries in 2020."
9,Republicans’ case against Kamala Harris is off to an ugly start,Not Avaiable For MSNBC,2024-07-24 10:00:00,https://www.msnbc.com/rachel-maddow-show/maddowblog/2024-election-republicans-case-kamala-harris-ugly-start-rcna163468,"Three days into the transformed 2024 presidential race, how is the Republican Party’s case against Vice President Kamala Harris coming along? While pondering the question, consider the headline on one of The Associated Press’ overnight reports: “Republican leaders urge colleagues to steer clear of racist and sexist attacks on Harris.” From the article: On the one hand, Republican officials believe this will be the year in which they break through with voters in communities of color. On the other hand, GOP leaders feel the need to remind their members that targeting Harris with racism isn’t a good idea. That said, the reminders have merit. A political sprint is obviously underway — Election Day is just over 100 days away — and it stands to reason that Republicans are going to take on the likely Democratic nominee in every possible way. But it’s also hard not to notice that the GOP’s case against the incumbent vice president is off to a rough start. Over the course of the last 72 hours, the American public has seen Republicans target Harris with: • racism; • sexism; • false claims about her serving as a “border czar”; • complaints about her laugh; • complaints that she has served the public for too many years; • complaints about her hometown of San Francisco; • complaints that she likes Venn diagrams too much; and • complaints about plastic straws. For good measure, let’s not overlook the fact that Republican Sen. JD Vance — a year before getting elected to Congress, and two years before receiving his party’s vice presidential nomination — took rhetorical aim at Harris during a Fox News appearance, emphasizing the fact that she does not have biological children of her own. As part of his Senate campaign in Ohio, Vance specifically referred to Democrats as “a bunch of childless cat ladies who are miserable at their own lives and the choices that they’ve made and so they want to make the rest of the country miserable, too.” The Republican added that this included Harris. The GOP will need a winning message against the likely Democratic nominee. This isn’t it."
10,Dems in array: Handoff from Biden to Harris appears seamless,Not Avaiable For MSNBC,2024-07-24 08:22:00,https://www.msnbc.com/rachel-maddow-show/maddowblog/election-2024-democrats-array-handoff-biden-harris-appears-seamless-rcna163430,"Ahead of President Joe Biden’s withdrawal from the 2024 race, many of the Democratic incumbent’s supporters said he had to keep going with his re-election bid — because the alternative would be intraparty chaos, division and disarray. There was one important flaw, however, in the argument: Democrats were already dealing with intraparty chaos, division and disarray. Nearly every day, more party officials called on the president to pass the torch, and there were multiple polls showing most rank-and-file Democratic voters as wanting an alternative to Biden. It appeared unsustainable. It also appears that the party has turned a corner. A Wall Street Journal report summarized: With extraordinary speed, a party that appeared fractured is suddenly united. A party that saw its fundraising efforts screeching to a halt is suddenly reporting record-breaking hauls. A party that cringed in response to every new poll is celebrating the latest national survey data. This seamless handoff from Biden to Harris wasn’t inevitable, but it has been executed with striking skill. It prompted Matt Compton, a veteran of the Obama White House, to note via social media: “Shout out to the staffers in Delaware who just lived through the most stressful five weeks in campaign history, then flipped every piece of branding and content on a dime, raised $100m, recruited 58,000 volunteers, and generally just lit the internet on fire for Kamala Harris.” Pod Save America’s Dan Pfeiffer added, ""What [the Harris campaign team] has pulled of since Sunday is truly incredible. No campaign in history has ever undergone such a shift with no notice. The way they been able to capture the wave of enthusiasm is so impressive. True professionals."" That’s certainly fair, though it’s also worth pausing to emphasize Biden’s role. The incumbent president didn’t just do the bold thing by standing aside, he also played a direct role in helping rally Democrats behind their likely new nominee. The results have been unmistakably impressive."
11,"Kamala Harris sounds different, but she could still be a status quo president on Israel",Not Avaiable For MSNBC,2024-07-24 06:58:00,https://www.msnbc.com/opinion/msnbc-opinion/kamala-harris-israel-netanyahu-gaza-rcna163202,"President Joe Biden’s decision to drop his bid for re-election has sparked curiosity and hope among progressives and Arab Americans who were turned off by his support for and complicity in Israel’s brutal siege of the Gaza Strip. Many are wondering whether Vice President Kamala Harris, the front-runner to win the Democratic presidential nomination, may be more inclined than her boss to push back more forcefully against Israel and offer support to Palestinians. It’s a tricky assessment to make, in no small part because Harris doesn’t have a deep background in foreign policy. Most of Harris’ career focused on law enforcement, and during her brief stint in the Senate she wasn’t a major foreign policy player. Her ill-fated 2020 presidential campaign focused mostly on buzzy domestic policy ideas. As vice president she did delve into foreign affairs and diplomacy, but her job wasn’t to craft major policy — it was to execute it. There are some small hints that Harris could be to the left of Biden on the issue. But there are also plenty of reasons to think she would approach the issue similarly to him, and that her divergence from Biden could come down to speech style rather than policy.  The case for Harris as being potentially more sympathetic to Palestinian interests is primarily based on subtle rhetorical signals. In March, Harris delivered a speech that included some of the most overtly critical statements about Israel’s operation issued by the Biden administration, acknowledging the situation in Gaza as a “catastrophe.” Moreover, that speech might have been even more pointed had it not been softened by her colleagues. NBC News, citing current and former officials, reported that “the original draft of her remarks was harsher on Israel in describing the dire humanitarian situation for Palestinians in Gaza and the need for more aid.” White House National Security Council officials reportedly “toned down” parts of her speech. (A Harris spokesperson at the time called the portrayal ""inaccurate."") Later that month Harris said in an interview that she didn’t rule out “consequences” for Israel if it launched an invasion of Rafah, which was at the time a stronger warning to Israel than any Biden official had made to date. As Politico reported at the time, Harris “has consistently gone further than President Joe Biden by at least half a step” in her rhetoric criticizing Israel. And in an interview with The Nation, Harris at least came across as more specifically attentive to the suffering of Gazans — and U.S. protesters on their behalf — than Biden. However, Harris’ criticisms of Israel, while notable, have been modest in scope, and might appear stronger than they are because Biden has set such a low bar. As independent journalist Spencer Ackerman has pointed out, in her March speech, Harris might have sounded more upset by the humanitarian horror show than Biden, but she refused to condemn or fully critique Israel’s policy that helped give rise to it: the collective punishment of Gaza by vastly restricting food, electricity and supplies in violation of international law. Harris' Nation interview might have sounded humane, but she made no substantive policy statements and declined to clarify which, if any, protesters she felt were right. And Harris’ saying Israel might face “consequences” over Rafah was not a red line comment, and hardly guarantees that she has the resolve to confront Israel in a meaningful manner.  From the beginning of Israel’s response to Hamas’ Oct. 7 war crimes, the Biden administration has hinted that it could do something but has basically done nothing significant about it beyond private pressure — with the exception of a temporary pause on a shipment of some of the heaviest ordinance it sends to Israel. The more one digs into Harris’ background, the case that she could be an agent of the status quo on Israel appears meatier than the case against. Her rhetoric on Israel has generally ticked all the conventional U.S. foreign policy establishment boxes, including emphasizing the “ironclad” nature of the U.S.-Israeli alliance and Israel’s right to defend itself. As a senator, she spoke twice at conferences held by the hawkish American Israel Public Affairs Committee (AIPAC), pledged support for Israel’s security and described the bond between the U.S. and Israel as “unbreakable.” During her first AIPAC speech in 2017, she noted that her first act as a senator was to introduce a resolution condemning a United Nations Security Council resolution condemning Israel. Jeremy Scahill of Drop Site News recently wrote up a comprehensive evaluation of Harris’ policy record on Israel and described her as having “hardline” support for Israel, noting, among many other things, her co-sponsoring legislation in 2017 “condemning former President Barack Obama’s decision to abstain from vetoing a UN Security Council Resolution critical of Israel.” In addition to Harris’ conventional pro-Israel positioning, her national security adviser, Phil Gordon, is reportedly likely to remain central to her foreign policy agenda. He is a longtime U.S. foreign policy establishment adviser, who seemingly aligns with a number of Biden’s views of Middle East policy. When you put all this together, the picture emerges of a politician who, at least after Israel’s response to the Oct. 7 attacks, has a rhetorical tendency slightly to the left of Biden. But most of her public positions don’t suggest that she is ready to change the course of the U.S.-Israeli relationship in a substantial way, if at all. Aaron David Miller, a senior fellow at the Carnegie Endowment for International Peace and a seasoned former Middle East hand, summed up his assessment this way in a recent interview with NBC News: Her views on Israel are to the “left of what Biden is prepared to do but way to the right of those who argue we need to impose costs and consequences on Israel to make it clear we’re the superpower and they’re not.” Miller's synopsis is a reminder that Harris' rhetoric could cut both ways: it could signal openness to new directions, but it could also provide cover for business as usual. The one major X factor of Harris’ worldview is she is still a relative newbie in the world of foreign policy. Her worldview is still forming, and the world is changing. It is possible that Harris’ perception of Israeli policy — like many Americans’ — was changed by Hamas’ attacks or Israel’s response to them. While newness can make some politicians more conservative, still others might feel emboldened to shake up the status quo. Harris’ newness might, theoretically, make her more more receptive to left-wing pressure on the issue. That activism is already taking place — such as a recent statement by major unions calling on the U.S. to halt military aid to Israel. Some of it is likely to be on the way — such as widely anticipated pro-Palestinian protests at the Democratic National Convention. A sustained resurgence of effective pro-Palestinian protests could extract policy wins from Harris, whether on the campaign trail or during a potential presidency. Harris will most likely try to use use ambiguity and a light touch to work to her advantage. Without doing much, she can allow many progressives to project hope onto her as an alternative to the status quo. And without doing much, she can bank on most pro-Israel supporters of the Democratic Party, who’ll most likely assume she’s still on board with the Biden-Harris foreign policy they’ve come to expect. For now, Harris appears to be treading carefully. She won’t be presiding over or attending Israeli Prime Minister Benjamin Netanyahu’s controversial address to Congress on Wednesday, which a number of Democrats are boycotting. She will instead be on the campaign trail and is expected to meet with Netanyahu privately during his visit. It’s a perfect way for her to avoid any polarizing optics — or make clear to anyone exactly where she stands."
12,"Eyeing new polls, Team Trump pushes flawed ‘Harris Honeymoon’ memo",Not Avaiable For MSNBC,2024-07-24 06:45:00,https://www.msnbc.com/rachel-maddow-show/maddowblog/new-polls-2024-trump-election-kamala-harris-honeymoon-memo-rcna163401,"It’ll probably be a few days before many of the leading polling outlets release new data on the 2024 presidential race, but in the wake of President Joe Biden’s withdrawal announcement — which was just three days ago — there are some preliminary survey numbers to kick around from polls conducted after Sunday’s news. The latest national Reuters/Ipsos poll, for example, found Vice President Kamala Harris leading Donald Trump by 4 points, 42% to 38%, with third-party candidates in the mix, and by 2 points, 44% to 42%, in a head-to-head match-up with the former Republican president. (Click the link for information on the survey’s methodology and margins of error.) The latest national NPR/PBS News/Marist poll, meanwhile, showed the Democratic VP tied with Trump in a multicandidate field, and in a head-to-head match-up, the GOP nominee was ahead by the narrowest of margins, 46% to 45%.(Click the link for information on the survey’s methodology and margins of error.) It was against this backdrop that one of the former president’s pollsters thought it’d be a good idea to issue a memo on where things currently stand. HuffPost reported: “The coverage will be largely positive and will certainly energize Democrats and some other parts of their coalition at least in the short term,” Fabrizio wrote in his memo. “That means we will start to see public polling — particularly national public polls — where Harris is gaining on or even leading President Trump.” The document added that Harris is seeing a “bump” in the polls now, and this is likely to “last a while until the race settles back down.” At face value, there’s nothing especially wrong with Fabrizio’s analysis. There’s also no great mystery about the pollster’s motivation: With Biden out of the race and Trump’s advantage in national surveys slipping away, it stands to reason that the Republican’s top polling expert would issue a document that, for all intents and purposes, tells his party — and his client — “Don’t panic. This is temporary.” There is, however, a relevant detail that the memo downplayed: where Team Trump expected to be at this point. Ahead of the recent presidential debate, the GOP nominee was already well positioned in the 2024 race. After the debate, his advantage grew. Then Trump was shot, the former president named his running mate and the Republican National Convention soon followed. Right about now, in other words, most political observers — in both parties — would expect to see Trump’s lead reaching new heights. But it’s not, thanks in part to Biden’s willingness to put the country’s needs first, and in part to Democrats rallying behind Harris with great enthusiasm. The fact that the vice president is getting a “bump” isn’t a huge problem for the Republican ticket and its allies; the fact that Team Trump expected to be riding high as July came to an end, however, is far more significant."
