Title,Edit_Date,Origal_Date,Link,Content
Secret Service director resigns after backlash over Trump rally security failures,Not Avaiable For MSNBC,"July 23, 2024, 8:02 AM PDT",https://www.msnbc.com/the-reidout/reidout-blog/secret-service-director-resigns-kimberly-cheatle-rcna163146,"Secret Service Director Kimberly Cheatle resigned on Tuesday, a day after facing bipartisan pressure to step down during a House hearing, NBC News reported. Republicans at the hearing used the assassination attempt against Donald Trump on July 13 as a Trojan horse to push their anti-diversity agenda.  Republicans and Democrats at the hearing were largely in agreement that Cheatle should resign over the Secret Service's failure to prevent the attack. Later Monday, House Oversight Committee Chairman James Comer, R-Ky., and the committee’s top Democrat, Jamie Raskin of Maryland, signed a joint letter calling on Cheatle to step down. But ever since the shooting, conservative activists, benefactors like Elon Musk and some lawmakers like House Speaker Mike Johnson have baselessly sought to blame the shooting in part on liberal rhetoric or diversity, inclusion and equity measures. The DEI thing became a talking point among far-right influencers online, after they noticed that some members of Trump’s Secret Service detail on the day of the shooting were women.  For his part, Trump has thanked the Secret Service agents who protected him. His sons have defended the women in their father's detail. And Trump campaign adviser Chris LaCivita has condemned right-wing criticism of the women, which shows that these attacks are viewed as beyond the pale even for some at the center of the MAGA universe. So it's remarkable that several House Republicans kept pushing that angle during the hearing.  One can detect more than a hint of condescension in Wisconsin GOP Rep. Glenn Grothman’s questioning, for example.  “You’ve spent some time trying to change the makeup of the Secret Service,"" Grothman said. ""OK, you feel there — whatever — too high a percentage are men. Um, does this affect at all who you are hiring for the Secret Service?” The congressman went on to ask whether Cheatle was ever “not hiring men because of your desire to hit certain targets,” a seeming reference to hiring goals set by some organizations that right-wingers kvetch over in their attacks on diversity efforts. Cheatle said the agency only hires the most qualified candidates. But after briefly deviating from this misogynistic line of questioning, Grothman asked, “Can you elaborate why you want one-third of the Secret Service to be women?” Cheatle denied ever saying this. Grothman, who told a reporter earlier this week that he feels Democrats are backing Harris ""because of her ethnic background,"" sure seems eager to ascribe someone else's success to their gender or ethnicity, which is quite rich coming from a white man in Congress. Rep. Scott Perry, R-Pa., also appeared to question the diversity and qualifications of Secret Service agents, asking why someone shorter than Trump or incapable of physically carrying him should be allowed to serve on his security detail.  Perry didn’t mention women specifically, but his remarks sounded like an allusion to the female Secret Service agents bashed by bigoted, right-wing social media trolls. Cheatle yet again affirmed that she’s only hired people who are qualified and capable of doing the job, and Perry responded by claiming this was the sign of a “culture” in which “the primary objective here seems to be something other than securing the site, securing the principal, and securing the people at the site.” Tennessee Rep. Tim Burchett was the most overt in his bigotry, calling Cheatle a “DEI horror story” during the hearing. And he told CNN on Monday that he believes Harris was a ""DEI hire"" by the Biden campaign in 2020. When asked by Rep. Jasmine Crockett, D-Texas, whether the security failures had to do with DEI, Cheatle said they had “nothing to do” with such initiatives. You can watch Crockett and fellow Democratic Rep. Ayanna Pressley, of Massachusetts, respond to the baseless, bigoted attack on DEI here. As I wrote last week, House Republicans are risking dooming their probe into the Trump assassination attempt by politicizing it in the way they already have. Using this investigation to push cheap political crusades undermines its seriousness."
Harris campaign contacts five Dems in search for running mate,Not Avaiable For MSNBC,"July 23, 2024, 7:30 AM PDT",https://www.msnbc.com/rachel-maddow-show/maddowblog/harris-campaign-contacts-five-dems-search-running-mate-rcna163207,"On the first full day of the new 2024 presidential race, it quickly became apparent that Vice President Kamala Harris was likely to be the Democratic nominee. It was equally evident that she’d need a running mate — and she wouldn’t have much time to find one. With this in mind, multiple news organizations confirmed that former attorney general Eric Holder and his law firm would oversee an intense vetting process And who, pray tell, will they be vetting? The answer is just now starting to come into focus. NBC News reported that the Harris campaign has requested vetting materials from five potential vice presidential contenders, according to two sources familiar with the list (in alphabetical order): It’s worth emphasizing that this shouldn’t necessarily be seen as an exhaustive list. We know from previous election cycles that some who make short lists like these fall out of favor, while others are sometimes added to the list as the process unfolds. The eventual Democratic vice presidential nominee might very well come from this quintet, but there are no guarantees. Kentucky Gov. Andy Beshear, for example, has been rumored to be in contention for the job, though he’s not on this list. That doesn’t mean, however, that he’s out of the running. As for the list itself, these are, by any fair measure, five strong contenders. Shapiro claims he hasn't been contacted as part of the running-mate search, but the Pennsylvania Democrat is nevertheless a popular governor in a key battleground state, who also happens to have a background as a prosecutor who took on the Trump administration. Cooper and Whitmer are also popular governors from battleground states, and while the latter suggested that she’s not interested in serving as her party’s vice presidential nominee, perspectives change when opportunities are no longer abstractions. Kelly, the only senator on the list (so far), has an impressive background in the military, and is a former astronaut. What’s more, while Democrats would hate to see Kelly leave the Senate, Arizona has a Democratic governor who’d appoint his successor and keep the seat “blue.” Walz’s inclusion on the list might seem surprising to some, but I’d recommend keeping a close eye on the Minnesotan. He’s an excellent speaker, a successful governor in a Midwestern state, a former well liked congressman, and perhaps most importantly, Walz is a decorated military veteran. As the process advances, spare a thought for the researchers who have a daunting and expedited task ahead of them. Politico reported that delegates to the Democratic convention could begin voting on the party’s presidential and vice presidential nominees as early as next week. The report added, “Such a timeline, if it were implemented, could result in Kamala Harris, President Joe Biden’s endorsed successor, selecting her running mate by the middle of next week.” Watch this space."
Ohio Republican forced to scramble after ‘civil war’ comments,Not Avaiable For MSNBC,"July 23, 2024, 6:46 AM PDT",https://www.msnbc.com/rachel-maddow-show/maddowblog/ohio-republican-forced-scramble-civil-war-comments-rcna163189,"It was just 10 days ago when a gunman shot Donald Trump at a campaign rally in Pennsylvania, and while the shooter’s motives are still being investigated, Republicans responded to the assassination attempt by blaming Democratic rhetoric. As far as the former president’s GOP allies were concerned, Democrats weren’t just responsible for the gunman, they had a responsibility to “lower the volume” in the public discourse. All of this came to mind watching a Republican campaign rally in Ohio yesterday. Politico reported: In context, Vance had not yet taken the stage at the official campaign event, though a local state senator was warming up the crowd before introducing the Republican vice presidential nominee. “I’m afraid if we lose this one, it’s going to take a civil war to save the country, and it will be saved,” Lang said. “It’s the greatest experiment in the history of mankind, and if we come down to a civil war, I’m glad we got people like ... Bikers for Trump on our side.” It’s important to emphasize that while the GOP legislator made these comments — out loud, on camera, in front of a large audience — and he appeared to mean what he said, Lang did issue a written statement soon that walked it all back. “Remarks I made earlier today at a rally at a rally in Middletown do not accurately reflect my views,” Lang said via social media. “I regret the divisive remarks I made in the excitement of the moment on stage.” Nevertheless, Vice President Kamala Harris’ campaign said in a statement, “Donald Trump and JD Vance should denounce George Lang’s calls for violence and apologize for platforming this kind of violence.” There has been no such apology. “Donald Trump and JD Vance are running a campaign openly sowing hatred and promising revenge against their political opponents,” the Harris campaign added. “That’s why a Republican official was empowered to predict a civil war while introducing these candidates.”"
An emboldened Trump is threatening to sue those who indicted him,Not Avaiable For MSNBC,"July 23, 2024, 6:09 AM PDT",https://www.msnbc.com/rachel-maddow-show/maddowblog/trump-sue-mar-a-lago-raid-cannon-rcna163118,"As many major news outlets continue to digest President Joe Biden’s withdrawal from the 2024 race and the Democratic Party’s swift rallying around Vice President Kamala Harris as its standard bearer, you would be forgiven if you had turned your attention away from the person who commanded last week’s news cycle: Donald Trump. But almost 24 hours to the minute after Biden announced he was leaving the race, Trump took to Truth Social on Monday with what could be a significant post of his own, suggesting it’s his “time to sue” an unspecified “them for illegally breaking into, and raiding, Mar-a-Lago” in the wake of federal District Judge Aileen Cannon’s dismissal of the classified documents case. Yet, that case — which concerns Trump’s alleged possession of classified and other national security related documents at Mar-a-Lago and both his and his two co-defendants’ alleged obstruction of the federal investigation of the same — was not thrown out because of any finding that the August 2022 search of Mar-a-Lago was legally defective. Instead, Cannon dismissed the case for a wholly unrelated reason: She ruled that the appointment of special counsel Jack Smith and the funding of his office violate two distinct clauses of Article II of the U.S. Constitution. Nonetheless, the former president-turned-GOP-presidential-nominee is now not only insisting that the Mar-a-Lago search and seizure of evidence broke the law, but also that he intends to sue prosecutors and/or the FBI for violating his rights. And his post therefore begets two questions: One, is Trump serious about a civil lawsuit against federal prosecutors? And two, assuming he is, would that suit have any chance of succeeding? Let's start with whether Trump truly intends to sue. A spokesperson for the Trump campaign did not immediately respond to a request for comment, but if past is prologue, the answer is likely yes. Recall that the nation was first introduced to Cannon not as a result of the indictment against Trump, which was randomly assigned to her, but through the civil case Trump himself filed two weeks after the Mar-a-Lago search and used to secure the appointment of a special master to review the evidence collected ""to preserve the sanctity of executive communications and other privileges."" The second and more significant question then is what such a lawsuit would look like. Let's assume Trump is going to sue and that what he's after is a damages award that would hurt and embarrass the government. Whom would Trump sue and what claims might he advance? Ordinarily, under Supreme Court precedent, the federal government and its agencies are immune from damages unless they waive sovereign immunity. Yet a federal statute — the Federal Tort Claims Act — does exactly that. It specifically allows lawsuits for torts such as false arrest, abuse of process or malicious prosecution where those claims are rooted in the acts of federal investigative or law enforcement officers, a category broadly defined to include ""any officer of the United States who is empowered by law to execute searches, to seize evidence, or to make arrests for violations of Federal law."" That doesn't, of course, mean Trump is filing any such suit in the immediate future, especially as the special counsel's office has indicated its intent to appeal Cannon's dismissal of the case. Nor does it mean any lawsuit Trump files will necessarily be one for malicious prosecution. In part, that's because it's at best unclear whether Trump could establish the elements of malicious prosecution under Florida law, which would govern in this case. Under a 1994 Florida Supreme Court ruling, claims of malicious prosecution in the state require proof not only that the plaintiff — here, hypothetically Trump — obtained a dismissal in his favor, but also that the case was dismissed because of his innocence. Plus, that plaintiff must also show, among other factors, proof that prosecutors lacked probable cause and acted with malice. Here, by contrast, the case was dismissed on procedural, not substantive grounds, and there are no conclusive judicial findings from the litigation before Cannon that the Mar-a-Lago search was inappropriate or legally defective. On the contrary, late last month, Cannon found Trump failed to make even a preliminary showing that the affidavit submitted by the Justice Department to obtain the Mar-a-Lago search warrant contained any material false statements or omissions, a showing required to obtain any further hearing about the warrant's propriety. So should we take Trump at his word that he intends to sue? Sure. But can we expect Trump to launch this newest legal effort soon, much less successfully? That's both more dubious and murkier."
Trump allies reconsider: Is JD Vance the right running mate?,Not Avaiable For MSNBC,"July 23, 2024, 6:00 AM PDT",https://www.msnbc.com/rachel-maddow-show/maddowblog/trump-allies-reconsider-jd-vance-right-running-mate-rcna163172,"As Donald Trump and his team evaluated potential running mates, there were plenty of “safe” choices for the former Republican president. Sen. JD Vance wasn’t necessarily one of them. The 39-year-old Ohio senator — the least experienced major-party running mate in nearly nine decades — has no accomplishments to speak of. He has a record of extremism on key issues. He comes from a state the GOP ticket is almost certain to win anyway. He actually hated Trump in the recent past. As the public was reminded at Vance’s first solo rally since joining Trump’s team, the guy doesn’t exactly radiate charm and charisma, either. Even in his home state, Vance is hardly a powerhouse. In 2022, as Republican Gov. Mike DeWine cruised to a landslide, 26-point re-election victory, Vance appeared on the same ballot — and won by six points. As a recent Washington Post analysis summarized, the young senator “underperformed every other statewide Republican on the ballot by a large margin. Ohio went strongly for Republicans; it did not go strongly for Vance.” So why in the world did Trump pick him as his new running mate? Why choose a Republican with little appeal beyond the former president’s far-right MAGA base? At least in part because Trump assumed he was poised to win anyway. As the former president saw it, with an inevitable 2024 victory in hand, there was no harm in running up the ideological score, satisfying the base and establishing greater control over the Republican Party’s vision for the foreseeable future. That, of course, was when the GOP nominee expected to defeat President Joe Biden. As the incumbent stands down, the party’s recent moves are being reassessed and recontextualized. Tim Alberta wrote for The Atlantic: That luxury is now gone. Alberta added via social media, “[The] most striking thing I heard from Trump allies yesterday was the second-guessing of JD Vance—a selection, they acknowledged, that was borne of cockiness, meant to run up margins with the base in a blowout.” Oops. I’ve long argued that the running mate selection is the most important choice a presidential candidate will make during his or her campaign. Trump did not choose wisely — and it’s apparently not just Democrats who’ve noticed."
It's not enough for Kamala Harris to not be Joe Biden,Not Avaiable For MSNBC,"July 23, 2024, 3:00 AM PDT",https://www.msnbc.com/opinion/msnbc-opinion/kamala-harris-presidential-campaign-policy-trump-rcna163002,"President Joe Biden’s historic exit from the White House race and endorsement of Vice President Kamala Harris to replace him marks a thrilling turn of events for many Democrats. Biden’s re-election prospects had been looking terrible. Harris has injected an air of new possibility into the race, and she instantly benefits from not being dogged by questions about her mental acuity. Harris is taking control of Biden’s campaign operation, garnering endorsements from across the party and positioning herself as the favorite for the Democratic presidential nomination. But it is imperative that she not allow her candidacy to be defined purely in negative terms as a generic alternative to someone undesirable: It is not enough to not be Joe Biden. It is not enough to not be Donald Trump. If Harris wants to make a splash, re-introduce herself to the public and have a decent shot at beating the former president, then she must embrace a compelling policy vision and sell it with gusto. This is an arena in which Biden largely failed. Harris needs to avoid making the same mistake. The Biden-Harris campaign had focused mostly on selling re-election as a way to protect democracy and abortion rights. Those are deeply important ideas that can fire up the Democratic base. But most American voters are not the Democratic base, and Democrats need to get their attention and secure trust their trust by unveiling policies that pique their interest. This is a realm in which Harris can improve upon Biden’s platform and shore up her potential weaknesses against Trump. The Democratic Party must not just stand against things. It must stand for things.  Less politically engaged voters and swing voters have an outsize interest in economic issues, and polling data indicates that Trump tends to poll better than Biden on the economy. A set of recent surveys from The New York Times, Siena College and The Philadelphia Inquirer found that a large majority of voters in five battleground states want sweeping change in our economic and political systems. And even though inflation has subsided, Americans persistently believe that the cost of living is too high. Big, bold proposals that acknowledge that there are big structural problems in the way our economy distributes wages, wealth and freedom can engage and excite people. It would be negligence of the highest order for Harris to not adopt the language and policy vision of economic populism as a focal point of her campaign. Big policy swings can help Harris renew and build coalitions on the left, as well. Buzzy policy commitments and rhetorical emphasis on issues such as increasing the minimum wage, expanding the child tax credit, creating a public option for health insurance, universal child care, free higher education options, tackling skyrocketing housing prices and cracking down on tax cheats, among countless others, would allow Harris to engage activists and specific constituencies and motivate them to work to elect her. Biden unveiled some eye-catching policies on banning medical debt, controlling rental costs and reforming the Supreme Court in the final weeks of his campaign. But his pivot was too little, too late. Those policy announcements mostly came about as concessions to the left wing of the party as Biden scrambled to secure support from Sen. Bernie Sanders, I-Vt., and the progressive House members known as “the squad” as his support fell after his debate against Trump. It remains to be seen how Harris will approach those policies, but one hopes she considers them alongside other potential headline-generating policies. A bold economic populism can also serve as a shield for Harris. Unfortunately Trump, his running mate, JD Vance, and their GOP allies are likely to use the kinds of racist and sexist tropes to try to tear her down just as they have done in the past. Even more unfortunately, those lines of attack could persuade voters even outside the MAGA camp who are amenable to bigoted messaging. But if Harris hammers home social and economic policies that would benefit all people regardless of background, then she can help keep the conversation grounded in universal terms and help ensure that she sounds grounded in the struggles that working people face across all demographic backgrounds. Additionally, Harris can use economic populism to help rebuff the MAGA world’s increasingly sophisticated courtship of unions and call out the ruse of right-wing populism, which claims to champion working-class people even as it prioritizes the desires of corporations and the rich. Harris is an experienced, energetic and competent candidate suited to take the torch from Biden in an emergency. But with Trump looking unusually strong in polls this year, Democrats must remember that fear of Trump is not a strong enough strategy for winning the election. Harris can shut down shallow theorizing about whether she is “electable” by getting to work and doing what Biden failed to do: making a bold case for how to make America better for everyone."
