Title,Edit_Date,Origal_Date,Link,Content
"At Republican convention, Tucker Carlson completes transformation",Not Avaiable For MSNBC,"July 19, 2024, 6:46 AM PDT",https://www.msnbc.com/rachel-maddow-show/maddowblog/republican-convention-tucker-carlson-completes-transformation-rcna162691,"We don’t need to wonder what Tucker Carlson genuinely believed about Donald Trump after the Republican’s 2020 defeat because we already know. As my MSNBC colleague Zeeshan Aleem noted last year, the since-settled Dominion Voting Systems lawsuit against Fox News produced a treasure trove of communications from the network’s hosts, including candid messages from Carlson that his viewers weren’t aware of in real time. In early January 2021, for example, Carlson texted, “We are very, very close to being able to ignore Trump most nights. I truly can’t wait.” He added soon after, “I hate him passionately,” and he confessed that he “can’t handle much more of this.” This came on the heels of Carlson telling a colleague, in reference to Trump, “What he’s good at is destroying things. He’s the undisputed world champion of that.” The former Fox host went on to say that he found it “disgusting” how many Americans believe Trump’s rhetoric. Reflecting on Trump’s failed term, Carlson also wrote, “We’re all pretending we’ve got a lot to show for it, because admitting what a disaster it’s been is too tough to digest. ... But come on. There isn’t really an upside to Trump.” That was three and a half years ago. A lot has changed since. In fact, Carlson has not only taken his shtick online, he’s also managed to position himself as an influential ally to the Republican he hated “passionately.” It was Carlson who helped Trump choose his running mate. It was Carlson who seemed to be having a grand time at the Republican convention. And as a New York Times report noted, it was Carlson who made a return to prime time with remarks at the Republican National Convention. To be sure, more than a few prominent Republican voices have made the transition from Trump critic to Trump sycophant. In fact, I’m aware of only one current member of the U.S. Senate who has characterized Trump as “America’s Hitler,” and the former president just tapped him as his running mate. Has Carlson experienced a genuine change of heart, or is he opportunistically sailing on the prevailing winds in Republican Party politics? Only the right-wing host knows for sure, though his 2021 messages seem to offer a hint. Either way, however, a HuffPost report raised a point that stood out for me. We don’t know who the president will be next year, but if it’s Trump, it’s safe to say Carlson will have walk-in privileges in the Oval Office, his 2021 assessments notwithstanding."
Trump's speech veered from somber to maudlin to unhinged,Not Avaiable For MSNBC,"July 19, 2024, 6:22 AM PDT",https://www.msnbc.com/opinion/msnbc-opinion/trump-rnc-acceptance-speech-tone-rcna162414,"On Thursday night, my party bent the knee and enthusiastically nominated a man convicted of numerous felonies for president of the United States. In a Milwaukee convention hall full of activists and party loyalists whom I have known for years, there were also election deniers, organizers of the fake electors scheme and active participants in the insurrection against our nation on Jan. 6. Then, in that most poignant of moments when a political party says “here is the best among us that we have to offer for service to our nation,” Donald J. Trump accepted his third Republican presidential nomination. From the opening of his acceptance speech, Trump appeared to be deliberately somber, not leaning into the fiery affect that he so often uses at his rallies. This version of Trump was just weird. He still can’t read a teleprompter properly, even as he launched into an account of the attempt on his life last weekend.  Now, I’m not going to begrudge a man from sharing his thoughts about a brush with death, and certainly many in the audience appeared visibly moved by it. But by the time he decided to kiss the helmet of former volunteer firefighter Corey Comperatore, the whole scene was just a little too maudlin and unserious. It was also a weird bit of stagecraft considering that Trump took three days to call Comperatore’s widow. Once we were past the emotional part of the program, it did not take long for Trump to return to form, offering his usual diatribe of lies and exaggerations about cities flooded with crime and inflation spiraling out of control. But of all the untrue things he said, perhaps the biggest was when he claimed “this movement has never been about me.” It’s only ever been about him, and he has spoon-fed Republicans so much of himself that it’s now all they want, no matter how incoherent or offensive it may be. On Thursday night, the Party of Lincoln finally solidified itself as the Party of Trump. And it wasn’t even his speech that did it. It happened the moment he accepted the nomination.  For more thought-provoking insights from Michael Steele, Alicia Menendez and Symone Sanders-Townsend, watch “The Weekend” every Saturday and Sunday at 8 a.m. ET on MSNBC. And join Michael Steele, Rachel Maddow and many others on Saturday, Sept. 7 in Brooklyn, New York, for “MSNBC Live: Democracy 2024,” a first-of-its kind live event. Buy tickets here."
Meet the new Donald Trump; he’s the same as the old Donald Trump,Not Avaiable For MSNBC,"July 19, 2024, 6:00 AM PDT",https://www.msnbc.com/rachel-maddow-show/maddowblog/meet-new-donald-trump-convention-speech-2024-election-rcna162677,"It might seem like six months ago, but it was just six days ago when a gunman in Pennsylvania nearly killed Donald Trump. In some political circles, people assumed that the outrageous assassination attempt wouldn't just change the 2024 election cycle, it was also change the candidate who was targeted. “In this moment, it is more important than ever that we stand United,” the former president wrote on his social media platform the morning after the attempt on his life. Hours later, the Republican was even more succinct, adding, “UNITE AMERICA!” As the week got underway, Axios reported that Americans should expect to see a different kind of Trump going forward. “Almost dying rocks perspectives — and people,” the report read. Axios added, “Yes, Trump has shown little appetite for changing his ways, tone and words. But his advisers tell us Trump plans to seize his moment by toning down his Trumpiness, and dialing up efforts to unite a tinder-box America.” During the Republican nominee’s convention address, some observers would be forgiven for thinking the assurances were true — at least initially. In the first part of his remarks, Trump spoke in a somber tone while describing the awful events of Saturday and at least paid lip service to the “unity” theme he’d promoted days earlier. “Together, we will launch a new era of safety, prosperity and freedom for citizens of every race, religion, color and creed,” the former president said. “The discord and division in our society must be healed. We must heal it quickly. As Americans, we are bound together by a single fate and a shared destiny. We rise together. Or we fall apart.” And then Trump ripped off the mask, abandoned the pretense and reverted to form. As a Washington Post analysis summarized: I’ve seen a great many convention speeches from presidential nominees, and I think it’s fair to say Trump’s was the worst. At times, it seemed as if he were trying to make himself even less popular with an American electorate that already holds him in low regard, reminding voters of all the things they don't like about him. The speech was breathtakingly dishonest. It was painfully long — to the point that even some of his loyalists left the convention floor before it was over. It rewrote recent history. It made fools of those who genuinely believed his “unity” rhetoric and took seriously the idea that Saturday’s shooting had changed him. But most of all, it was familiar. CNN’s Daniel Dale noted overnight that fact-checking the former president’s convention speech was surprisingly easy “because he’s told almost all of those lies before.” He added, “Trump is hardest to fact check because of the extreme volume of false claims but easiest to fact check because he does the same false claims dozens of times over years.” This was partly a convention speech and partly a greatest hits package, filled with petty lies, conspiracy theories, cheap shots, juvenile taunts (""Crazy Nancy""? Seriously?), borderline incoherent asides about Trump’s overwhelming sense of grievance, praise for the authoritarian leaders he admires, and the latest in a series of weird references to “the late, great Hannibal Lecter.” Meet the new Trump; he’s the same as the old Trump. By some measures, this was the best news Democrats have received in weeks. If the former president had demonstrated real leadership on the Republicans’ convention stage, his opponents would have new reason to worry. Instead, in a rather literal sense, Trump simply couldn’t help himself."
The case against Biden's candidacy remains as strong as ever,Not Avaiable For MSNBC,"July 19, 2024, 3:00 AM PDT",https://www.msnbc.com/opinion/msnbc-opinion/biden-drop-out-schiff-pelosi-trump-shooting-rcna162384,"In the wake of the attempted assassination of former President Donald Trump, there was a pause in the Democratic campaign to pressure President Joe Biden to drop his White House re-election bid. That moment of quiet was appropriate, as the nation took a brief break from politics as usual to take in what had just happened and sought calm to ensure the shooting did not spark further chaos. But that slowdown has come to an end. On Wednesday, Rep. Adam Schiff of California called on Biden to “pass the torch” in one of the most high-profile objections to Biden’s candidacy to date. Senate Majority Leader Chuck Schumer, D-N.Y., did not deny an ABC report claiming that in a meeting he had with Biden he pressed the president to step down. And CNN, citing four sources briefed on the phone conversation, reported that former House Speaker Nancy Pelosi of California told Biden he cannot win the race and that his candidacy could ruin his party’s chances of winning the House.  The renewed pressure campaign on Biden is welcome news. The case against Biden’s candidacy did not grow any weaker in light of an assassination attempt against Trump. All the reasons Biden is ill-suited to be a candidate — and ill-suited to be president for four additional years — remain intact. In fact, the case is stronger than ever.  The polls present an unceasing torrent of terrible news for the president. Trump continues to best Biden in the polls despite his felony convictions and authoritarian rhetoric. According to New York Times and Siena College polling records, Trump holds his largest lead over a Democrat since his 2016 White House bid. A poll by the AP-NORC Center for Public Affairs Research found that a remarkable 65% of Democrats want Biden to drop out of the race and allow his party to select a different candidate. Biden is still getting clobbered by Trump in polls of swing states and lagging far behind his Democratic colleagues in those states, indicating that he is a distinctly weak candidate within the party. Data for Progress’ latest survey finds that swing voters consider Biden’s age to be a much larger concern than Trump’s criminal charges. (The same survey conducted before the debate had found the reverse to be true — swing voters were more concerned about Trump’s charges.) There are concrete signs of how frustration over Biden’s candidacy is already demoralizing the party. NBC News reports that major donations have “fallen off a cliff” and that grassroots fundraising is falling short of campaign needs. In a worst-case scenario, this downturn is a preview of how disenchantment over Biden’s age could dampen his appeal not only to independents and swing voters, but also to ordinary Democratic voters. This is why top Democrats are warning that they fear a full-on wipeout of Democrats in government. Biden’s debate performance has generated a strange and shortsighted media game. Every one of the president’s media appearances these days is scrutinized to determine whether he presents any better than he did during his mumbling and at-times incoherent debate performance. Journalists and Democrats assess the timbre and smoothness of every word he utters and then grade the performance afterward typically on the spectrum of somewhere from “bearable” to “alarming.” The problem is that these performances are measured against the unacceptably low standard of Biden’s debate performance, and that Biden is ultimately not defined by his unremarkable moments, but his most troubling ones. It is naive to think Biden can fix this. Widespread concerns about his age predate the debate, and for good reason: For years — and especially during the past year — Biden has displayed a striking decline in his capacity to communicate clearly and display the level of energy appropriate for the most powerful political office in the world. The perception of him as too old is thoroughly entrenched, and challenging Trump to a golf showdown is not going to remedy that. Trying to game out how strong Biden is relative to other potential Democratic candidates is the wrong way to think about this issue. Every potential candidate possesses pros and cons, and electability is mostly poor-quality guesswork. The way to think about this issue is to acknowledge that Biden cannot do his job. These days Biden cannot explain his policy accomplishments. He cannot respond with confidence to politically sensitive questions from reporters that he needs firm responses to. He cannot speak sentences that are consistently intelligible or audible. He cannot paint a vivid and attractive picture of what America should look like in the future. In other words, he cannot make the case for his own candidacy. If he cannot do these things, then he cannot fulfill one of the most basic requirements of any politician: to communicate ideas and persuade people to join them in an endeavor to make them a reality. Such a task will always be required of a politician, whether in private meetings with power brokers or at public rallies ahead of elections. It requires willful denialism — of the polls, of common sense — to suggest that Biden's communicative problems do not help explain why he is trailing in the polls against one of the weakest presidential candidates in modern political history, and why it's hard for him to close the gap. The leaders of any responsible party would attempt to intervene and find someone who can do the job, and it is refreshing to see reports that, for all their flaws, Democratic leaders are doing just that. If the campaign to persuade Biden to step aside fails and he remains the Democratic nominee, the choice between him and Trump will be a no-brainer for the majority of Democratic voters. Biden’s values and judgment — even if executed poorly — are far better alternatives to Trump’s ethno-nationalist authoritarian fantasy. But most voters are not partisan Democrats. And less-engaged Democrats, independents, true swing voters, disenchanted Republicans and potential third-party voters are all persuadable demographics who will play a critical role in who wins the election. The Democrats need someone capable of persuasion — not just through rhetorical competence but also a meaningful and ambitious policy vision. First they must persuade Biden that, as much as he may wish that he could, he is no longer capable of doing what waging a presidential campaign and leading the country demand."
The return of Melania Trump,Not Avaiable For MSNBC,"July 18, 2024, 12:03 PM PDT / Updated July 18, 2024, 10:20 PM PDT",https://www.msnbc.com/opinion/msnbc-opinion/melania-trump-rnc-will-not-speak-rcna161908,"A year ago this spring, when the 2024 presidential campaign was just kicking off, it seemed evident that Melania Trump, wife of former President Donald Trump, had decided to give it a miss. Little has changed since then. Her continued detachment from campaign events and rallies, her absence in all the primaries save Florida’s (where she voted), her skipping her husband’s lengthy hush money trial and his June 28 debate against President Joe Biden come alongside the strong speculation that she won’t live full-time in the White House again should Trump be re-elected. All of it taken together seems only to confirm that her distance from Trump’s political life will continue no matter what happens Nov. 5. Melania Trump has, it is true, held two campaign fundraisers for the Log Cabin Republicans at her homes; but by contrast, first lady Jill Biden has held frequent fundraising tours with multiple destinations. Jill Biden, described as “defender-in-chief” of her husband’s campaign by the Economist, and described by The New York Times as “comforter-in-chief” to some jittery Democrats, has visited red states and blue ones, often alone, and been an actively political surrogate for her husband. Melania Trump’s limited appearances could not be in starker contrast. Though she has been harder to find, Melania Trump did attend the Republican National Convention in Milwaukee. However, unlike she did in 2016 and 2020, this time she did not speak. Her silence ends an unbroken tradition that goes back to Barbara Bush in 1992 of first ladies and candidates’ spouses giving significant addresses at conventions. As long as she is visible at the convention, even if she’s silent, Melania Trump will win plaudits from Trump fans, many of whom only want more of her. Still, her silence and her rare appearances are further evidence, as Katie Rogers noted recently, that Melania Trump has significantly reshaped the role of first lady: “She broke open the role and actually showed us [that] you don’t have to do anything with it if you don’t want to.” For more than a century, whether they desired it or not, first ladies have been highly visible campaigners. As many American women got to vote for the first time in 1920, for example, Florence Harding eagerly stood on her front porch, in what was called the Front Porch Campaign, hosting tens of thousands of visitors alongside her husband, President Warren G. Harding. Similarly, Eleanor Roosevelt called for Franklin D. Roosevelt’s unprecedented third term during her “no ordinary time” speech at the Democratic convention in 1940, a step that, as First Ladies Association for Research and Education President Nancy Kegan Smith notes, “was credited with helping FDR to unify the convention.” Two decades later, Lady Bird Johnson was the first to take to the hustings on her own, with the whistle-stop tour in 1964 — a bold venture into a hostile South that helped bring about LBJ’s victory. Pat Nixon was the next to appear at a convention, in 1972, thrilled to offer remarks about her husband, Richard Nixon, following an eight-minute standing ovation. Then in 1992, Barbara Bush, already known for a significant speech at Wellesley College, had the opportunity to speak “about the centrality of family … in a model of conciliatory rhetoric,” as scholar Myra Gutin explains. Since then, first ladies’ speeches at conventions have often focused on family matters; Hillary Clinton spoke of children and family in 1996, as did Michelle Obama in 2008: “I come here as a wife; I come here as a mom.” In 2012, Michelle Obama further highlighted hers and President Barack Obama’s humble family histories. In 2020, during the coronavirus pandemic, Jill Biden offered a speech “as a mother and a grandmother” from a classroom at a high school where she once taught. Both Melania Trump’s speeches in 2016 and 2020 were similarly focused on family, addressing mothers like herself — and women as a whole.        This theme of family was also echoed by Melania Trump this past weekend in the wake of the assassination attempt on her husband. In an effort to reach across the aisle, she pointed out that “every single politician is a man or a woman with a loving family.”  Her statement was heartfelt and empathic, calling for Americans to see each other as “human beings.” Considering her absence during so much of the campaign so far, her outspokenness at this moment was notable — and will likely carry significant political weight. Her comments, of course, stand in stark contrast to the way her husband told supporters to ""fight like hell"" right before the Capitol riot on Jan. 6, 2021. Melania Trump’s words were important in humanizing her husband, and they suggest that GOP strategist Alex Conant is overlooking something significant when he claims that “people vote for the presidential candidate, not their spouse or their vice president.” This is because for more than a century now, whether they are particularly interested in politicking or not, first ladies have served their spouses’ campaigns immeasurably, by humanizing and broadening their appeal. With her statement, Melania Trump did just that after the assassination attempt in Butler, Pennsylvania. And Jill Biden’s call to her in the wake of the attack underlined the sisterhood of first ladies, all of whom know that what happened Saturday is what each of them dreads the most."
