Title,Edit_Date,Origal_Date,Link,Content
Trump’s RNC speech proved again there’s never a ‘New Trump’,Not Avaiable For MSNBC,"July 18, 2024, 9:41 PM PDT",https://www.msnbc.com/opinion/msnbc-opinion/donald-trump-rnc-acceptance-speech-rcna162654,"For a minute there, former President Donald Trump sounded different on Thursday night. “Whether you’ve supported me in the past or not, I hope you will support me in the future, because I will bring back the American Dream,” Trump told a sea of conservative believers at the Republican National Convention. “With great humility, I am asking you to be excited about the future of our country.” The acceptance speech he delivered lacked the soaring phrasing of Ronald Reagan telling the RNC crowd in 1980 that “the time is now, my fellow Americans, to recapture our destiny, to take it into our own hands.” The overall tone of the prepared text distributed ahead of his speech was a far cry from his first acceptance speech eight years ago, let alone his inauguration address, later dubbed the “American Carnage” speech. It was a shift in line with the reported “new softness” he’d displayed since last week’s assassination attempt. As with most things Trump, though, any shift away from his usual bombast was surface level — at best. The facade of a new Trump evaporated quickly, just like the last several times we were promised a new Trump. Even when he has managed to momentarily project a calmer persona, a state that lasted only minutes into an address that broke records as the longest acceptance speech ever, Trump remains substantively the same: impulsive, xenophobic and more than happy to go on the attack in exchange for the applause of a crowd. In his remarks, Trump initially portrayed himself as a happy warrior, one fighting for all Americans, in sharp contrast to his usual polemics against Democrats. “Together, we will launch a new era of safety, prosperity and freedom for citizens of every race, religion, color and creed,” he intoned toward the beginning of his speech. “The discord and division in our society must be healed. We must heal it quickly. As Americans, we are bound together by a single fate and a shared destiny. We rise together. Or we fall apart.” If you’d handed me that quote before Thursday night, I would have sooner guessed it came from President Joe Biden or almost any other political figure before I ever landed on Trump. In promising to be the “president for ALL of America, not half of America, because there is no victory in winning for half of America,” Trump played against type in a way that I hadn’t expected even having read the reporting that he’d torn up his original speech in the aftermath of the shooting. But despite promising unity, his speech only grew Trumpier as it continued, as he leaned into his worst instincts, riffing to the crowd’s delight as he threw it red meat. Even in the prepared text, though, he was still disparaging of LGBTQ Americans when declaring “we will not have men playing in women’s sports.” It was still filled with lies about a supposed surge in crime fueled by migrants sneaking across the border. It still framed the criminal cases against him as partisan witch hunts from Democrats, rather than the results of his own actions. It was still packed with pie crust promises, easily made and easily broken, that “incomes will skyrocket, inflation will vanish, jobs will come roaring back, and the middle class will prosper like never before.” It is hard to find the unity in promising to “launch the largest deportation operation in the history of our country,” darkly warning that “bad things are going to happen” otherwise. He miraculously managed to (mostly) avoid directly attacking Biden, using his name directly only once, saying the “damage he’s done to the country is unthinkable.” But I’m pressed to find anything meant to win over skeptical Republicans who couldn’t bring themselves to vote for him in the primary campaign, let alone disenchanted Democrats and independents. Even if he did rewrite the speech he was prepared to give as he claimed, Trump couldn’t help but go off script and attack “crazy Nancy Pelosi,” drawing boos from the crowd, and accusing Democrats of “destroying our country” and “cheating at elections.” There was nothing he said that contradicted the conservative agenda laid out in Project 2025, even as he urged listeners to “rise above past differences and disagreements and go forward united, as one people and one nation.” In the end, Trump may have offered to “a hand of loyalty and friendship” to “every citizen, whether you are young or old, man or woman, Democrat, Republican or independent, Black or white, Asian or Hispanic,” but he did little to disguise the racism and fearmongering at the heart of his campaign. The Trump we saw on display Thursday night wasn’t the chastened, humbled man some predicted might be on display. It was exactly the Trump we’ve come to know over the last nine years. The bottom line is this: Donald Trump still wants the same things for this country that he did before Saturday’s attempt on his life and is still willing to do it in the least unifying way possible."
Read: Jamie Raskin asks Biden to reconsider campaign in early July letter,Not Avaiable For MSNBC,"July 18, 2024, 3:05 PM PDT",https://www.msnbc.com/top-stories/latest/jamie-raskin-biden-letter-read-pdf-rcna162607,"In a letter dated July 6, Rep. Jamie Raskin urged President Joe Biden to reconsider his re-election bid, joining dozens of other prominent Democrats who have publicly called for their presumptive nominee to step aside. In his four-page letter, first reported by The New York Times and later obtained by NBC News, Raskin doesn't explicitly call for Biden to drop out. Rather, he warns that the country is ""under siege every day by the autocrats and monarchists, from Moscow to Mar-A-Lago"" and that the stakes of the November election are high. ""I am not writing to presume to tell you what to do, Mr. President, because that is up to you and Jill and your family entirely,"" Rasking wrote, adding: ""No one envies the choice you must make now, Mr. President, but remember this as the great politician you are and have always been."" ""The hard questions that have been raised about your mental and physical stamina ... are not just medical and scientific questions now,"" he added. ""They are also political questions because both political leaders and tens of millions of voting citizens have formed judgments based on the events of the last few weeks."" Read Raskin's full letter below:"
Joe Biden has big plans — and terrible timing,Not Avaiable For MSNBC,"July 18, 2024, 2:42 PM PDT",https://www.msnbc.com/opinion/msnbc-opinion/biden-campaign-second-term-agenda-rcna162330,"Timing has not been President Joe Biden’s strong suit lately. Hours after he declared in an interview released Wednesday that he would consider ending his campaign if doctors told him he had “some medical issue,” the White House announced he had tested positive for Covid. The only reason his exit is even being discussed is his performance in the first debate with former President Donald Trump. It was his team’s decision to hold the abnormally early faceoff before the Democratic National Convention, leaving enough time for second thoughts about his candidacy to percolate. Among the fears his performance sparked is whether, as my colleague Zeeshan Aleem argued, his campaign has been too focused being anti-Trump rather than presenting a second-term policy agenda. With that in mind, it makes sense that Biden finally has begun to roll out his plans for what he’ll do if he wins. You’d be forgiven if you missed the announcement for his plan for the first 100 days of his second term. It came during a Friday night event in Detroit — the day before the failed assassination attempt on Trump. Such has been the case for Biden the last several weeks, as forces outside his direct control have overshadowed his attempts to steady his wavering campaign. Biden’s pitch for his second term included some familiar agenda items, unfinished business from when the Democrats held both houses of Congress in his first two years. He pledged that the first bill he sends Congress will be to “restore Roe v. Wade to make it the law of the land.” Biden also said that he’d sign the John Lewis Voting Rights Act and the Freedom to Vote Act, both of which ran into a Republican filibuster when last presented to the Senate in 2022. Other portions of his proposed plans would expand or codify actions his administration has already taken. Last month, Vice President Kamala Harris and Lena Khan, head of the Federal Trade Commission, announced a new rule that would ban medical debt from being included in credit reports. Biden said on Friday that he would go after medical debt writ large if he returned to the White House, drawing applause from Sen. Bernie Sanders, I-Vt. Likewise, he vowed to cap insulin costs at $35 per month for all Americans with diabetes, the same way the the Inflation Reduction Act did for Medicare enrollees. But there were some new announcements in his speech that will hopefully get more attention over the coming months. One was a pledge to finally tackle the cost of housing, a crisis that affects Americans across the country. Biden told the crowd that he’d advocate a plan to “build 2 million housing units and cap rent increases at 5% a year so corporate landlords can no longer gouge everyone like they’re doing.” Since then, his administration has already rolled out details on his new housing plan in hopes of getting traction on the issue ahead of November. And while it wasn’t mentioned in his Friday address, we’ve also learned that that he’s developing a proposal to reform the Supreme Court, a major shift for him to address Democrats’ angst over the deeply conservative court and the ethics scandals circling several of the justices. On the one hand, this is exactly what Zeeshan was calling for in his piece, offering up a substantive, positive agenda to counter Project 2025, the conservative blueprint for the next GOP president’s agenda. It also reportedly comes after progressives like Sanders and Rep. Alexandria Ocasio-Cortez, D-N.Y., threw Biden a political lifeline following the initial calls for him to step aside. Looking down ballot, announcing these policies now also gives Democrats running for Congress items to sell to their voters, as many of them would require retaking the House and retaining the Senate. The immediate question, though, isn’t whether these are good policies — which they are, offering up a clear difference for Americans about what a Democratic president will do compared to Trump. For that matter, it’s not even about whether it will move the needle for undecided voters ahead of this fall. That’s a question that’s more up in the air, as a Gallup poll from last month showed that more independents surveyed said that Biden is too liberal than thought Trump is too conservative. Instead, the question has become whether Biden would necessarily be the one to implement those policies next year. While the intense scrutiny he’s faced since the debate has been a bit much at times, it was still eyebrow raising when he mangled his housing policy when speaking at the NAACP earlier this week. And after a brief respite in the aftermath of this weekend’s shooting, the tide against him remaining in the race has continued to pummel him. On Wednesday, Rep. Adam Schiff, D-Calif., became the most prominent Democrat to publicly call for Biden to drop out in favor of another candidate. Hours later, the White House announced that he has Covid, taking him off the campaign trail. Curiously, Biden’s inability to sell these second-term policies on the stump for the next few days highlights how few of them are uniquely associated with Biden. Much of what’s been announced could easily be the position of any Democrat running for president in 2024. Without a competitive primary season to distinguish between the alternative candidates whose names have been floated, the debate has been over who voters will believe is best equipped to win against Trump. Maybe that wouldn’t have been the case if Biden had started making his case earlier — but, again, timing is everything here."
"Thursday’s Mini-Report, 7.18.24",Not Avaiable For MSNBC,"July 18, 2024, 2:30 PM PDT",https://www.msnbc.com/rachel-maddow-show/maddowblog/thursdays-mini-report-71724-rcna162594,"Today’s edition of quick hits. * On Capitol Hill: “The Republican chairman of the House Oversight and Accountability Committee issued a subpoena Wednesday to the Secret Service director compelling her to appear before the committee on Monday for what is scheduled to be the first congressional hearing into the attempted assassination of former President Donald Trump.” * In related news: “[I]n addition to the Congressional inquiries, [Director Kimberly Cheatle] and the Secret Service are also facing an inquiry by the Department of Homeland Security’s inspector general.” * More information on the shooter: “The 20-year-old Pennsylvania man who tried to kill former president Donald Trump at a rally last weekend had searched online for information about Trump and President Biden and had photos of both men saved on his phone, according to lawmakers and others briefed on the investigation. ... In addition to Trump and Biden, the shooter had photos of Attorney General Merrick Garland and a member of the British royal family saved on his phone, two people familiar with the probe said.” * This White House sure is serious about student loan debt relief: “The Biden administration announced Thursday it will cancel $1.2 billion in student debt for 35,000 workers, as a result of its recent fixes to a popular debt relief program for public service workers.” * On the other hand: “A federal appeals court blocked the implementation of the Biden administration’s student debt relief plan, which would have lowered monthly payments for millions of borrowers. In a ruling Thursday, the 8th Circuit Court of Appeals granted a motion for an administrative stay filed by a group of Republican-led states seeking to invalidate the administration’s entire student loan forgiveness program.” * A case worth watching: “The U.S. Securities and Exchange Commission sued the former CEO of the blank-check company that merged with Trump Media, accusing him of lying about his firm’s plans to combine with Donald Trump’s social media startup. Patrick Orlando allegedly lied in public filings when he said his company, Digital World Acquisition Corp., had not contacted any possible merger targets and had no specific merger plans, the commission said in the lawsuit filed Wednesday night in Washington, D.C., federal court.” * Onto the 11th Circuit: “Special counsel Jack Smith formally filed notice on Wednesday that he will appeal a Florida judge’s decision to dismiss Donald Trump’s 40-count indictment for allegedly mishandling classified documents and obstructing government efforts to retrieve them.” * A familiar face in Nevada politics: “Michele Fiore, a Nevada politician known for her fiery brand of conservatism, was indicted on fraud charges on Tuesday for what prosecutors said was a scheme to spend charitable donations on personal expenses.” See you tomorrow."
"With Roe gone, abortion foes tee up another precedent for the Supreme Court to overturn",Not Avaiable For MSNBC,"July 18, 2024, 1:55 PM PDT",https://www.msnbc.com/deadline-white-house/deadline-legal-blog/supreme-court-abortion-clinic-hill-v-colorado-rcna162543,"When the Supreme Court overturned Roe v. Wade in 2022, the majority complained that prior abortion rulings had “distorted First Amendment doctrines.” The case the court cited for that proposition was Hill v. Colorado, a 2000 decision that upheld a law that barred approaching people without consent outside of a health care facility for the purpose of leafletting, displaying signs, protesting, educating or counseling.  A new petition to the justices this week asks the court to overrule Hill — and there’s reason to think the court will do it. Hill was decided 6-3 in 2000, when the court’s composition was much different than it is today (as one may have guessed from the Dobbs majority’s disapproving citation). Justice Clarence Thomas, who dissented in Hill, is the only justice from that original ruling who is still on the court. The new petition comes from the anti-abortion group Coalition Life. It challenges a Carbondale, Illinois, ordinance that it says is virtually identical to the one that the court upheld in Hill, which set the zone within 100 feet outside a facility and within 8 feet of a person. “The lower courts had no choice but to uphold that carbon-copy measure,” the group said in the petition filed by the group's legal representatives, the Thomas More Society and Paul Clement, a top conservative Supreme Court lawyer. “This Court has a better option,” it said: overrule Hill.  The city has an opportunity to respond before the court considers whether to grant review, which takes four justices. Based on the majority’s negative reference to Hill in the Dobbs decision — on top of the court’s First Amendment rulings since Hill — it appears there are at least that many justices who would consider overturning Hill. And Coalition Life's is not the only petition seeking to ditch the 2000 precedent. There's another one pending before the justices, filed by the American Center for Law and Justice, whose chief counsel is Trump impeachment lawyer Jay Sekulow, who argued Hill for the challengers. Whether in these pending appeals or any another, the issue is one to watch as the court fills out its docket for the next term, which starts in October."
Why JD Vance’s record on abortion rights matters in 2024 race,Not Avaiable For MSNBC,"July 18, 2024, 11:32 AM PDT",https://www.msnbc.com/rachel-maddow-show/maddowblog/jd-vances-record-abortion-rights-trump-2024-race-rcna162554,"NBC News published an interesting report in March on Donald Trump’s search for a new running mate and the importance the former president had placed on abortion rights. The Republican, the report noted, was “laser-focused on the abortion issue, especially when it comes to his vice presidential pick,” mindful of the Democratic advantage on the issue. NBC News quoted a source close to Trump saying, “He’s concerned it will have a drag on the ticket if they’re seen as holding too staunch a position.” To be sure, “too staunch” is a matter of perspective, but if the presumptive GOP nominee tapped Sen. JD Vance for the ticket assuming that his views on reproductive rights would seem mainstream, Trump made a poor choice. Take this Washington Post report, for example. Unfortunately for the Republican ticket, this is just one of many relevant data points. While Trump has avoided endorsing a national abortion ban, for example, CNN reported that Vance, during his Senate candidacy, said, “I certainly would like abortion to be illegal nationally.” Vance, the year before reaching Capitol Hill, said at the time, “I’m sympathetic to the view that like, okay, look here, here’s a situation — let’s say Roe vs. Wade is overruled. Ohio bans abortion, in 2022 or let’s say 2024. And then, you know, every day George Soros sends a 747 to Columbus to load up disproportionately Black women to get them to go have abortions in California. And of course, the left will celebrate this as a victory for diversity — uh, that’s kind of creepy.” “And, and it’s like, if that happens, do you need some federal response to prevent it from happening?” Vance said, “I’m pretty sympathetic to that actually. So, you know, how hopefully we get to a point where Ohio bans abortion in California and the Soroses of the world respect it.” The comments are hardly ancient history: The Republican said this just two years ago. What’s more, Vance’s campaign website described him as “100 percent pro-life” — under a headline that read, “END ABORTION” — though the text was quietly removed after Trump chose him for the GOP ticket. In case that weren’t quite enough, Talking Points Memo ran a related report this week, noting that the Biden administration finalized new regulations under HIPAA that limited law enforcement access to medical records tied to reproductive health. Eight Republican senators pushed back against the administration’s efforts — and Vance was one of the eight. And did I mention that Vance publicly endorsed his home state’s six-week abortion ban, which does not include exceptions for rape or incest? Because he did that, too. All of which brings us back to the concerns Trump reportedly expressed in the spring. “He’s concerned it will have a drag on the ticket if they’re seen as holding too staunch a position”? By any fair measure, Vance is one of the Senate’s most far-right Republicans when it comes to reproductive rights, with a series of beliefs that most Americans would see as extreme."
Why haven’t Senate Republicans called on Bob Menendez to resign?,Not Avaiable For MSNBC,"July 18, 2024, 10:46 AM PDT",https://www.msnbc.com/rachel-maddow-show/maddowblog/havent-senate-republicans-called-bob-menendez-resign-rcna162379,"Sen. Bob Menendez was already facing a bleak political and legal future, but things went from bad to worse for the New Jersey Democrat after a jury found him guilty on 16 federal corruption counts. Ahead of the verdict, most of his colleagues in the Senate Democratic conference had called for Menendez’s resignation, and after the verdict, the number grew — quickly. Indeed, Senate Majority Leader Chuck Schumer wasted no time in calling for Menendez to step down. Others, including Sens. Bob Casey of Pennsylvania and Jacky Rosen of Nevada, raised the prospect of expelling their criminal colleague if he failed to resign. But it was a point from another member of the Senate Democratic leadership that stood out for me. NBC News reported: “I strongly reiterate my call for him to step down,” Murray said in a written statement. “No one is above the law — it’s pretty straightforward. Now if only my Republican colleagues would apply the same standards to the convicted felon who is running for President of the United States as their nominee.” In fact, while the list of Senate Democrats calling on Menendez to resign grew — and continues to grow — there was no comparable push among Senate Republicans. GOP senators learned that one of their colleagues had just been convicted on corruption charges, but they made no real effort to show him the door. Circling back to our earlier coverage, there might very well be an ideological dimension to this: When it comes to foreign policy, Menendez is to the right of most of his Democratic colleagues. Senate Republicans could be content to have him stick around because, on matters related to international affairs, they agree with him quite a bit — and no matter which Democrat replaced him, the GOP would almost certainly disagree with him or her more. But Murray’s point is ultimately the more persuasive one: If Republicans were to agree that Menendez’s crimes leave him unfit for office, it would almost certainly mean that Donald Trump is equally unsuitable for positions of public trust. For most Democrats, there’s no inconsistency to reconcile: They’re comfortable saying Trump has disqualified himself and showing Menendez the door. But for the GOP, it’s apparently easier to stay silent on Menendez than to try to explain why the senator should resign but the Republican Party’s felonious presumptive nominee should return to the White House. This post updates our related earlier coverage."
