Title,Edit_Date,Origal_Date,Link,Content
Kamala Harris has a lot of VP options. She should choose Josh Shapiro.,Not Avaiable For MSNBC,"July 23, 2024, 10:42 AM PDT",https://www.msnbc.com/opinion/msnbc-opinion/kamala-harris-josh-shapiro-vp-pennsylvania-rcna163093,"Now that President Joe Biden has withdrawn from the presidential race and endorsed Vice President Kamala Harris as the Democratic nominee, it seems increasingly likely that Harris will be the party’s choice to run against former President Donald Trump in November.  After all, a wave of endorsements immediately flooded in. The Clintons, John Kerry, 32 senators and 181 House Democrats quickly voiced their support. Given these endorsements and Harris’ ability to swiftly incorporate Biden’s campaign infrastructure, she’s the clear front-runner for the nomination at the August convention. As Harris solidifies her position, attention turns to her potential running mate. Pennsylvania Gov. Josh Shapiro stands out as a compelling choice, bringing political acumen, intelligence and relevant skills to the ticket.  Despite his relatively short tenure as governor, Shapiro has already made significant strides. He demonstrated interstate cooperation by partnering with New Jersey to form a task force strengthening labor law enforcement and worker protections. This showcases his ability to collaborate across state lines to achieve progressive goals.  As attorney general of Pennsylvania, Shapiro rooted out sexual abuse in the Catholic Church. Combine his background in fighting for survivors of sexual abuse with Harris’ background as a prosecutor protecting victims of sex crimes, and the choice between the Democratic ticket and one headlined by Trump, a sexual predator, is a stark one for voters. Shapiro’s initiatives in Pennsylvania have not only bolstered his popularity but also solidified his standing as a leader capable of bridging partisan divides. His approach to governance emphasizes practical solutions and effective communication, qualities that are increasingly valued in today’s polarized political landscape. Shapiro’s success in navigating complex policy issues — such as labor law enforcement and infrastructure projects — underscores his ability to deliver tangible results while maintaining broad public support.  Shapiro also has a skill the White House desperately needs right now: showcasing government achievements.  As we saw when Shapiro handled the I-95 bridge reconstruction this year, Shapiro knows how to show off the great work the government does. From the moment of destruction to completion, Shapiro documented the rebuild, effectively demonstrating how the government works for its people. This skill is crucial, considering recent polls indicate many voters are unaware of major legislative achievements of the Biden-Harris administration, like the American Rescue Plan, the Bipartisan Infrastructure Law and the CHIPS and Science Act.  Harris needs a political ally who is not only skilled in governance but also adept at communicating these achievements to the public. Politically, Shapiro brings advantages that could prove vital in securing the 270 electoral votes needed for victory.  While Biden’s 2020 win was great, his margins in key states like Georgia, Arizona, Wisconsin and Pennsylvania were narrow. Shapiro’s popularity in Pennsylvania could help secure this crucial swing state. A Quinnipiac University poll in January found Shapiro with a 59% approval rating, well ahead of the 40% approval rating Biden had in the same poll.  When he ran for governor in 2022, Shapiro won in Erie County by 15 percentage points, a key battleground for Democrats who won it twice in 2008 and 2012 with Obama. Erie County is a crucial battleground for the state, where turnout can be a make-or-break factor; just ask Hillary Clinton. If Democrats do not win these key Pennsylvania communities, they will struggle to win the state and consequently the White House. Shapiro’s successes in Pennsylvania can also be extrapolated to other swing states, like Michigan and Wisconsin.  Moreover, Shapiro has experience running against the radical MAGA movement; when he ran for governor, the Republican nominee, Doug Mastriano, was a right-wing fringe candidate who espoused wild conspiracy theories about chemtrails and vaccines. Shapiro was quick to defeat this MAGA-aligned candidate by focusing on kitchen table issues and uniting Pennsylvanians, leveraging his success in the attorney general’s office. A Harris-Shapiro ticket presents the best way for Democrats to win. It combines Harris’ federal experience and prosecutorial background with Shapiro’s proven track record in state governance and his ability to communicate government achievements effectively. This pairing has the potential to secure crucial swing states like Pennsylvania while also appealing to a broad spectrum of voters in Rust Belt states with similar political landscapes. The Harris campaign, by bringing in Shapiro, can effectively demonstrate how the government positively affects the lives of people in rural communities like Pennsylvania, thereby broadening the pro-working family message of the Biden-Harris administration.  As the Democratic Party looks to retain control of the White House, a Harris-Shapiro ticket would offer a blend of experience, youth and political savvy ready to pull off a historic victory that protects our democracy and ends the era of MAGA madness once and for all.  Kamala Harris must soon pick a running mate — one of the first major decisions of her 2024 presidential campaign. As part of our series on some of the top contenders, read the case for Andy Beshear here. "
The Kamala Harris veepstakes has no bad options,Not Avaiable For MSNBC,"July 22, 2024, 12:06 PM PDT / Updated July 23, 2024, 10:11 AM PDT",https://www.msnbc.com/the-reidout/reidout-blog/kamala-harris-best-running-mate-candidates-rcna163054,"UPDATE (July 23, 2024, 1:11 p.m. ET): Kamala Harris' presidential campaign has requested vetting materials from five potential vice presidential contenders, NBC News reported on Tuesday. After President Joe Biden announced that he’s ending his re-election campaign and endorsing Vice President Kamala Harris, there’s speculation about whom Harris might pick as her running mate in the likely scenario that she wins the Democratic nomination. NBC News has a list of potential picks, all of whom bring something unique to the table. As I see it, none of the picks mentioned would be bad by any stretch of the imagination. But there are some who I think stand apart from the rest. Narratively speaking, Kelly might offer the most upside. He’s a former naval captain turned astronaut who made a foray into politics after his wife, then-Rep. Gabby Giffords, was severely wounded in a mass shooting in Arizona. He’s a popular senator from a crucial swing state that has been trending toward Democrats in recent years. He also has been a longtime Harris supporter, having endorsed her Senate candidacy in California in 2016. His military background and outspokenness on behalf of veterans give him credence among people who have served; he would counterbalance the presence of Sen. JD Vance, a Marine veteran, on Trump’s ticket; and he also would help undermine right-wing nonsense about diversity measures being a top issue plaguing the military. Furthermore, Kelly has been vocal on the matter of immigration — a salient political issue in his home state — and earlier this year denounced Trump’s successful effort to tank bipartisan immigration legislation. Shapiro is another popular governor of a potential swing state. His 2022 defeat of MAGA extremist Doug Mastriano in Pennsylvania’s gubernatorial race showed that he’s unafraid of highlighting Trumpian attacks on democracy in plain speak, and he has shown charm and deftness in interviews that could further distinguish Harris’ ticket as the youthful and exuberant one relative to Trump’s old-fashioned authoritarianism. He would also be just the second Jewish vice presidential nominee, after Joe Lieberman, which could send a powerful message in response to the documented antisemitism within the MAGA movement. Cooper, who previously served as North Carolina’s attorney general, is about to be termed out but has maintained popularity in his state despite its trend toward Republicans in recent years. Despite the GOP’s efforts to curtail his powers as governor once he was elected, Cooper has shown an ability to achieve long-sought reform — like Medicaid expansion — in a state where Republicans control the legislature. Having Cooper on the ticket with Harris could give Democrats more confidence in competing for North Carolina, particularly if — as some have predicted — extremist-friendly candidates like Mark Robinson, North Carolina’s Republican gubernatorial nominee, drive Democratic turnout. At 46 years old, Beshear is the youngest potential veep pick on my list of possibles. Like Harris and Shapiro, he served as his state’s attorney general before becoming governor. Beshear’s father was a governor, so he has a political lineage in Kentucky despite the state’s conservative leanings and has won elections over MAGA candidates while being a vocal supporter of abortion rights. It seems unlikely that having Beshear on the ticket would put Kentucky in play, but he has exhibited an ability to speak to white rural voters that could certainly help Harris in key battleground states."
What the Kamala Harris 'coconut tree' meme is all about,Not Avaiable For MSNBC,"July 23, 2024, 9:54 AM PDT",https://www.msnbc.com/top-stories/latest/kamala-harris-coconut-tree-meme-rcna163177,"Just two days into Vice President Kamala Harris' run for the presidency and ""coconut tree"" memes have consumed the internet. “You think you just fell out of a coconut tree?” Harris says, laughing before she turns dead serious. “You exist in the context of all in which you live and what came before you.” The line is from Harris' speech at a White House event for Hispanic leaders in May 2023. In fact, the Republican National Committee's GOP War Room YouTube account may have been the first to isolate that moment from her speech, posting a clip of it that very same day in an apparent attempt to paint her in a negative light. The clip gained renewed attention over the past few months, and it had become a viral meme long before President Joe Biden’s debate performance or any sincere talk about his withdrawing from the race had begun. But the meme gained real momentum in the wake of the debate as the Democratic Party started to reckon with Biden's age and fitness for office. For younger people especially, the cynicism they reported around Biden's candidacy was suddenly replaced with a hope that someone else might take over the top of the ticket. Harris' emergence as a leading contender supercharged the meme, and thus you had people online earnestly admitting to being ""coconut-pilled."" I’ve previously questioned the Biden campaign’s attempt to engineer memes to appeal to voters. Harris is different from many politicians in that she seems innately meme-able — a nebulous quality that her presidential campaign is already capitalizing on. Part of why the coconut tree meme works is because it developed organically on the internet and coincided with Harris’ abrupt and historic rise to the current top of the Democratic presidential ticket. But its stratospheric ascent in recent weeks also comes with a risk of oversaturation, especially as other politicians try to get in on the joke. After Harris announced Sunday that she intended ""to earn"" and ""to win"" the nomination, some Democrats who rushed to endorse her referenced coconut trees in some way. Harris herself has not acknowledged the meme or tried to make a funny reference to it — a move that would almost certainly curdle its charm quickly."
"Old habits die hard: Even now, Trump can’t stop going after Biden",Not Avaiable For MSNBC,"July 23, 2024, 9:52 AM PDT",https://www.msnbc.com/rachel-maddow-show/maddowblog/old-habits-die-hard-2016-election-trump-cant-stop-going-biden-rcna163266,"During the 2016 presidential election, it made sense for Donald Trump to go after Hillary Clinton. The former secretary of state was, after all, his rival at the time, and over the course of the campaign, the two traded plenty of rhetorical shots. But after Election Day 2016 had come and gone, common sense suggested that the Republican would shift his attention. He’d won the race. Clinton had exited the stage, transitioned to retirement, and expressed no interest in pursuing office again. Trump had every reason to focus on governing, and no reason to target his former rival. He did it anyway — repeatedly. In fact, when Trump launched his 2020 re-election campaign, he devoted much of his speech to Clinton, despite the fact that she wasn’t running. With just weeks remaining before Election Day 2020, Trump not only pushed then-Secretary of State Mike Pompeo to uncover and release Clinton emails, he also lobbied then-Attorney General Bill Barr to prosecute Clinton for reasons unknown. (This was before the GOP pretended to care about the “weaponization” of federal law enforcement.) None of this made any sense — she was neither on the ballot nor on the campaign trail — but Trump couldn’t help himself. He’d invested so much time and effort into hating Clinton, he apparently found it impossible to end his offensive. And now it’s happening again. After President Joe Biden announced that he was withdrawing from the 2024 race, it stood to reason that Trump would curtail his attacks for a painfully obvious reason: The Democrat would no longer be his opponent. There was little to be gained from additional rhetorical barrages. But just as the Republican couldn’t shake his hatred for Clinton, as The New York Times reported, he’s still ranting about Biden, too. The GOP nominee responded to Biden’s news on Sunday with ugly tirades and conspiracy theories. It was in Trump’s interest to take the high road, but he apparently didn’t care. A day later, the former president kept going. “It’s a new day and Joe Biden doesn’t remember quitting the race yesterday!” he wrote to his social media platform on Monday morning. This morning, Trump offered more of the same. I won’t pretend to know what’s on the Republican’s mind, but if Democrats are lucky, he’ll keep up the anti-Biden hysterics indefinitely."
"As Biden stands down, spotlight turns to Trump’s age and fitness",Not Avaiable For MSNBC,"July 23, 2024, 8:25 AM PDT / Updated July 23, 2024, 9:26 AM PDT",https://www.msnbc.com/rachel-maddow-show/maddowblog/biden-spotlight-trumps-age-fitness-health-2024-election-rcna163226,"In the wake of last month’s presidential debate, much of the 2024 race shifted to questions about President Joe Biden’s age, health and fitness. Republicans wanted to speak of little else; Democrats fearing Biden’s electoral defeat felt compelled to go public with their concerns; and media professionals covered the conversation in granular detail. For some of Donald Trump’s detractors, this seemed wildly unfair. If the incumbent’s age and occasional difficulties are under the microscope, they asked, how is it that Biden’s rival is avoiding similar scrutiny? Isn’t the nearly-as-old Republican, who routinely seems unable to tell the difference between fiction and reality, equally deserving of the same questions? It was, and is, a fair point — and as a new Washington Post report makes clear, the spotlight is turning in ways the GOP nominee might not like. The Post’s report went on to note that Trump is “a 78-year-old with a history of heart disease and obesity,” who “has not shared any updated bloodwork results or other specific information during this campaign to help experts assess his ongoing medical risks.” To be sure, the Republican has long had a problem with transparency. He promised to release his tax returns, for example, and then went back on his word. His White House also abandoned public access to visitors’ logs. Team Trump was also less than forthcoming when it came to readouts of the then-president’s conversations with foreign leaders, and at times, those close to the Republican even tried to hide information about his golfing habits. But it’s Trump’s secrecy surrounding his health that’s relevant anew — not just because he’s now the oldest presidential nominee in American history, and not just because he’d turn 82 while in office if elected to a second term, but also because he was recently shot during an assassination attempt, and Trump and his team have been reluctant to share even basic details about the care he received after the incident. It's against this backdrop that the former president, just this morning, published an item to his social media platform that read, ""I don’t know who said it, or where it came from, perhaps the Radical Left, but I never discussed, or thought of, Jamie Dimon ... for Secretary of the Treasury."" It was just last month when Trump sat down for an interview with Bloomberg and said he'd consider JPMorgan CEO Jamie Dimon for Treasury secretary. I think we know how the political world would respond if this happened with Biden, which is all the more reason to take seriously questions about Trump's fitness. What's more, there’s no reason to assume these questions will go away as the new presidential race unfolds."
"Tuesday’s Campaign Round-Up, 7.23.24",Not Avaiable For MSNBC,"July 23, 2024, 9:00 AM PDT",https://www.msnbc.com/rachel-maddow-show/maddowblog/tuesdays-campaign-72324-rcna163242,"Today’s installment of campaign-related news items from across the country. * Two days into the new presidential race, a majority of pledged Democratic delegates have now endorsed Vice President Kamala Harris. She has no rivals for the party’s 2024 nomination. * On a related note, the Democratic National Committee confirmed that the party will choose its presidential nominee in a virtual, online voting process by Aug. 7, which is two weeks from tomorrow. With this in mind, there’s a very good chance that Harris will choose a running mate next week. * In an extraordinary development, Harris’ new presidential campaign raised a whopping $81 million in the 24 hours following President Joe Biden’s decision to end his re-election bid. Not surprisingly, this smashed all previous records. * Speaking of fundraising, it turns out that none other than Donald Trump was a Harris donor — once in 2011, and then again in 2013. * I’d recommend taking preliminary polling with a grain of salt, but a new national survey from Quinnipiac University found Trump with a narrow, two-point lead over Harris, 49% to 47%.(Click the link for information on the survey’s methodology and margins of error.) * Harris has quickly embraced Biden’s campaign operation as her own, and the vice president asked Jen O’Malley Dillon, Biden’s campaign chair, to stay on and run her campaign. O’Malley Dillon accepted the role. * Biden is canceling scheduled campaign events, but he’s also promised to hit the trail in support of his party’s ticket. * What happens to the millions of dollars Biden raised for his campaign now that he’s passing the torch? Reuters had a good summary. * And during an appearance on CNN, Colorado Gov. Jared Polis was asked if he’s open to serving as Harris’ running mate. “Look, if they do the polling and it turns out they need a 49-year-old balding gay Jew from Boulder, Colorado, they’ve got my number,” the Democratic governor replied."
