Name,Handle,Timestamp,Verified,Content,Comments,Retweets,Likes,Analytics,Tags,Mentions,Emojis,Tweet ID
Kamala Harris,@KamalaHarris,2024-08-16T18:55:18.000Z,True,My plan to lower costs and expand opportunity for working and middle-class Americans.,4.8K,6.3K,19K,1.6M,[],[],[],tweet_id:1824520327180722673
Kamala Harris,@KamalaHarris,2024-08-16T18:51:09.000Z,True,"As the price of housing has gone up, the size of down payments have gone up as well.

Even if aspiring homeowners save for years, it often still isn’t enough.

My administration will provide first-time homebuyers with $25,000 to help with the down payment on a new home.",12K,3.9K,16K,3M,[],[],[],tweet_id:1824519283705028690
Kamala Harris,@KamalaHarris,2024-08-16T18:49:48.000Z,True,"There’s a serious housing shortage.

As President, I will work in partnership with industry to build the housing we need.

By the end of my first term, we will end America’s housing shortage by building 3 million new homes and rentals that are affordable for the middle class.",7.4K,3.8K,16K,1.1M,[],[],[],tweet_id:1824518943433695306
Kamala Harris,@KamalaHarris,2024-08-16T18:48:15.000Z,True,"I grew up in a middle-class household. For most of my childhood, we were renters.

When I’m elected President, I will make it a top priority to bring down costs, and increase economic security for all Americans.",4.3K,5.2K,25K,839K,[],[],[],tweet_id:1824518552281551247
Kamala Harris,@KamalaHarris,2024-08-16T18:44:52.000Z,True,"Donald Trump wants to repeal the Affordable Care Act, on which 45 million Americans rely for health care. 

We’ve come too far to let that happen.",3.3K,4.7K,21K,911K,[],[],[],tweet_id:1824517699994783831
Kamala Harris,@KamalaHarris,2024-08-16T18:40:39.000Z,True,"As President, I’ll work to pass the first-ever federal ban on price gouging on food.

My plan will include new penalties for companies that exploit crises and break the rules.

And we will support smaller food businesses that are trying to play by the rules and get ahead.",7.2K,5.5K,24K,1.8M,[],[],[],tweet_id:1824516639674581483
Kamala Harris,@KamalaHarris,2024-08-16T18:34:16.000Z,True,"I’m building an economy where everyone can compete and have a real chance to succeed.

Where everyone, regardless of who they are or where they start, has an opportunity to build wealth for themselves and their children.",5.7K,2.5K,11K,641K,[],[],[],tweet_id:1824515033331601670
Kamala Harris,@KamalaHarris,2024-08-16T18:14:55.000Z,True,"America's families deserve a chance not just to get by, but to get ahead. 

Tune in as I take the stage in North Carolina to discuss how we're fighting to lower costs.",1.9K,2.4K,9.6K,424K,[],[],[],tweet_id:1824510162914214113
Kamala Harris,@KamalaHarris,2024-08-16T17:30:03.000Z,True,"As Vice President, I was proud to cast the tie-breaking vote to pass the Inflation Reduction Act.

We capped insulin at $35/month for seniors, and capped prescription drug costs at $2,000/year for those on Medicare.

And it was the largest investment in climate action in history.",3.2K,3.5K,16K,767K,[],[],[],tweet_id:1824498874498576678
Kamala Harris,@KamalaHarris,2024-08-16T15:45:04.000Z,True,"Lowering costs for Americans is one of our campaign’s top priorities. 

I am heading to Raleigh, North Carolina to speak about how we will continue building an economy where every American has the freedom to thrive. See you soon!",5.2K,2.4K,12K,767K,[],[],[],tweet_id:1824472453449457920
Kamala Harris,@KamalaHarris,2024-08-16T14:00:49.000Z,True,"We are fighting for the future—and when we fight, we win. 

Thank you, Arizona.",2.9K,4.3K,19K,511K,[],[],[],tweet_id:1824446216966426852
Kamala Harris,@KamalaHarris,2024-08-15T23:30:01.000Z,True,"When I am President, it will be a day one priority to bring down prices. 

I’ll take on big corporations that engage in illegal price gouging and corporate landlords that unfairly raise rents on working families.",27K,13K,68K,11M,[],[],[],tweet_id:1824227075605086619
Kamala Harris,@KamalaHarris,2024-08-15T21:30:04.000Z,True,"Across our nation, we are witnessing a full-on attack on hard-fought, hard-won fundamental freedoms and rights. We will not stand for it. 

Join us in the fight for freedom:https://secure.actblue.com/donate/web-hfp-waltz-august-2024?refcode=social_20240815_kdh_x…",2.4K,2.2K,7.7K,401K,[],[],[],tweet_id:1824196887861194844
Kamala Harris,@KamalaHarris,2024-08-15T02:12:41.000Z,True,"I could not imagine a better partner than  to lead our campaign.

Watch our full conversation tomorrow: http://kamalaharris.link/conversation",7.2K,9.5K,47K,3.9M,[],['@Tim_Walz'],[],tweet_id:1823905620585480435
Kamala Harris,@KamalaHarris,2024-08-15T21:17:59.000Z,True,Watch my full conversation with : http://kamalaharris.link/conversation,591,556,2.6K,295K,[],['@Tim_Walz'],[],tweet_id:1824193848228319701
Doug Emhoff,@DouglasEmhoff,2024-08-15T16:10:56.000Z,True,So about that time  googled me before our first date.,1.2K,2.1K,12K,612K,[],['@KamalaHarris'],[],tweet_id:1824116572803211742
Kamala Harris,@KamalaHarris,2024-08-15T18:21:09.000Z,True,"The more I get to know , the more I like him. And I liked him a lot to begin with.

Check out our full conversation: http://kamalaharris.link/conversation",4.5K,4.9K,26K,692K,[],['@Tim_Walz'],[],tweet_id:1824149342719992165
Kamala Harris,@KamalaHarris,2024-08-15T16:45:21.000Z,True,Bringing back the joy—one selfie at a time.,8.4K,5.8K,30K,1.2M,[],[],[],tweet_id:1824125237362929761
Kamala Harris,@KamalaHarris,2024-08-15T14:13:18.000Z,True,"Yes, we will. 

Because we love our seniors, and we love our country.",4.4K,6.8K,30K,1M,[],[],[],tweet_id:1824086972345840076
Kamala Harris,@KamalaHarris,2024-08-14T18:00:11.000Z,True,"For 89 years, Social Security has made the difference between poverty or peace of mind for millions of seniors, people with disabilities, and other beneficiaries.

Donald Trump is a threat to these bedrock programs. As President, I will protect and expand them.",7.2K,7.4K,30K,1.2M,[],[],[],tweet_id:1823781681762857388
Kamala Harris,@KamalaHarris,2024-08-14T16:36:11.000Z,True,"It was fantastic traveling across the country to meet voters with  last week. 

When we fight, we…",8.3K,8.4K,46K,1.9M,[],['@Tim_Walz'],[],tweet_id:1823760542210671092
Kamala Harris,@KamalaHarris,2024-08-13T20:26:00.000Z,True,"This election is about which direction our country is going to go in. 

Donald Trump’s Project 2025 Agenda will take us backward. 

We will not let him win.",10K,8.5K,46K,1.6M,[],[],[],tweet_id:1823455989934219739
Kamala Harris,@KamalaHarris,2024-08-13T16:30:06.000Z,True,"In this election, we each face a question: What kind of country do we want to live in?

The beauty of our democracy is that we have the power to answer—with our vote and with our voice. 

Make sure your voice is heard:",8.9K,6.4K,22K,840K,[],[],[],tweet_id:1823396621268201859
Kamala Harris,@KamalaHarris,2024-08-13T14:49:04.000Z,True,"I've served as a U.S. Senator, an Attorney General, and a district attorney and courtroom prosecutor.

In those roles, I took on predators who abused women, fraudsters who ripped off consumers, and scammers who broke the rules. 

I know Donald Trump’s type.",15K,18K,109K,3.3M,[],[],[],tweet_id:1823371196836057163
Kamala Harris,@KamalaHarris,2024-08-12T22:30:24.000Z,True,"Thank you for the warm midwest welcome, Wisconsin and Michigan.

With your help, we are going to win in November.",6.1K,8.1K,44K,1M,[],[],[],tweet_id:1823124907133173865
Kamala Harris,@KamalaHarris,2024-08-12T20:21:05.000Z,True,"One thing that unites us as Americans is our love for our country. The highest form of patriotism is to fight for the ideals of our country. 

That is how we preserve the promise of America.",6.9K,5.3K,25K,1M,[],[],[],tweet_id:1823092364467950045
Kamala Harris,@KamalaHarris,2024-08-12T00:52:20.000Z,True,"If Donald Trump wins in November, he will once again implement policies that target the LGBTQ+ community.

We know he will—just look at what he did his first term in office.",14K,8.1K,31K,10M,[],[],[],tweet_id:1822798239596229052
Doug Emhoff,@DouglasEmhoff,2024-08-11T18:12:21.000Z,True,Premiering November on networks everywhere. ,2.1K,9K,31K,1.4M,[],['@wongbd'],[],tweet_id:1822697577151598911
Kamala Harris,@KamalaHarris,2024-08-11T18:20:32.000Z,True,"This week,  and I kicked off our campaign together—it has been electric. 

Thank you, Pennsylvania!",5.5K,7.4K,36K,988K,[],['@Tim_Walz'],[],tweet_id:1822699636903051265
Kamala Harris,@KamalaHarris,2024-08-11T16:29:20.000Z,True,". and I kicked off our first week on the campaign trail as running mates—and, in just five days, we visited Pennsylvania, Michigan, Wisconsin, Arizona and Nevada. 

Over the next 86 days, we hope to see you all out on the trail.",6.6K,10K,60K,1.9M,[],['@Tim_Walz'],[],tweet_id:1822671654671065532
Kamala Harris,@KamalaHarris,2024-08-11T03:43:25.000Z,True,"Everyone in Nevada knows that  helped lead the way in our country for workers' rights and dignity.

I've been so proud to work by your side.",4.7K,4.1K,20K,808K,[],['@Culinary226'],[],tweet_id:1822478906399605184
Kamala Harris,@KamalaHarris,2024-08-11T03:10:25.000Z,True,"Our campaign is a fight for the future.

We are not going back.",4.6K,5.5K,27K,841K,[],[],[],tweet_id:1822470601707077948
Kamala Harris,@KamalaHarris,2024-08-11T01:16:42.000Z,True,"Governor  and I are running a people powered campaign to represent all Americans—from red states to blue states, from the heartland to the Southwest. Tune in as we take the stage in Las Vegas.",2.9K,3.5K,15K,692K,[],['@Tim_Walz'],[],tweet_id:1822441981743685922
Kamala Harris,@KamalaHarris,2024-08-10T19:01:00.000Z,True,"Next stop on our travels: Las Vegas. 

Governor  and I look forward to rallying with Nevadans and letting them know we are fighting on behalf of ALL Americans.",4.3K,5K,33K,1.1M,[],['@Tim_Walz'],[],tweet_id:1822347433986121821
Kamala Harris,@KamalaHarris,2024-08-10T18:06:01.000Z,True,"Two years ago, our administration honored our most sacred obligation to care for our veterans by signing the PACT Act into law—the most significant expansion of benefits and services for toxin-exposed veterans in more than 30 years.",2.1K,3K,14K,667K,[],[],[],tweet_id:1822333595454709854
Kamala Harris,@KamalaHarris,2024-08-10T14:56:36.000Z,True,"Donald Trump tanked the toughest bipartisan border security bill in decades because he thought it would help him win an election.

When I am President, I will sign the bill.",10K,9.2K,33K,1.3M,[],[],[],tweet_id:1822285928628379876
Kamala Harris,@KamalaHarris,2024-08-10T14:17:20.000Z,True,About last night: Some are calling our rally the largest in Arizona political campaign history.,6.9K,15K,103K,3.1M,[],[],[],tweet_id:1822276048316153992
Kamala Harris,@KamalaHarris,2024-08-10T03:56:25.000Z,True,"Arizona, I love you back.",3.3K,4.7K,29K,798K,[],[],[],tweet_id:1822119790074306655
Kamala Harris,@KamalaHarris,2024-08-10T03:40:21.000Z,True,"Yesterday, we got a fresh reminder that Donald Trump’s Project 2025 agenda would ban medication abortion in every state. 

We are not going to let that happen, because we trust women.",3.8K,4.1K,17K,635K,[],[],[],tweet_id:1822115743015555403
Kamala Harris,@KamalaHarris,2024-08-10T03:05:15.000Z,True,"As President, I will always honor tribal sovereignty, respect tribal self determination, and fight for a future where every Native person can realize their aspirations.",3.4K,7.3K,38K,1.4M,[],[],[],tweet_id:1822106913540104308
Kamala Harris,@KamalaHarris,2024-08-10T02:32:27.000Z,True,"Good evening, Arizona!",2.3K,5.6K,38K,870K,[],[],[],tweet_id:1822098657333612555
Kamala Harris,@KamalaHarris,2024-08-09T23:42:14.000Z,True,"Phoenix, Governor  and I are ready to roll up our sleeves and get to work. Are you with us?",3.4K,4.1K,17K,683K,[],['@Tim_Walz'],[],tweet_id:1822055818839085454
Tim Walz,@Tim_Walz,2024-08-09T23:31:35.000Z,True,Got it.,4K,12K,117K,4.2M,[],[],[],tweet_id:1822053140734066745
Kamala Harris,@KamalaHarris,2024-08-09T20:54:22.000Z,True,"Two years ago, our administration signed the CHIPS and Science Act into law to help America lead in semiconductor manufacturing and R&D while strengthening our supply chains.

Since then, we have created jobs, boosted American innovation, and ensured that semiconductors are made",1.7K,2.7K,12K,568K,[],[],[],tweet_id:1822013575159767399
Kamala Harris,@KamalaHarris,2024-08-09T16:44:18.000Z,True,"Donald Trump’s abortion bans unleashed a health care crisis for women across our nation.

Now, he has made clear that he'd use the federal government to rip away access to medication abortion, effectively banning abortion nationwide.

We will not let him.",7.8K,9.3K,39K,1.9M,[],[],[],tweet_id:1821950642530726246
Kamala Harris,@KamalaHarris,2024-08-09T16:20:02.000Z,True,"We are running a campaign on behalf of all Americans. 

It is great to be in Arizona with Governor .",6.1K,6K,43K,1.2M,[],['@Tim_Walz'],[],tweet_id:1821944539155726614
Kamala Harris,@KamalaHarris,2024-08-08T21:16:45.000Z,True,"I hear that Donald Trump has finally committed to debating me on September 10.

I look forward to it.",24K,25K,295K,10M,[],[],[],tweet_id:1821656821662134368
Kamala Harris,@KamalaHarris,2024-08-08T19:03:30.000Z,True,"I am determined to fight for the people. Because when we fight, we win.

Watch our campaign’s new ad:",7.5K,12K,54K,1.5M,[],[],[],tweet_id:1821623285605384623
Kamala Harris,@KamalaHarris,2024-08-08T15:14:53.000Z,True,"This campaign is not just about us versus Donald Trump.  

Our campaign is about fighting for the future.",7.8K,7.9K,41K,1.3M,[],[],[],tweet_id:1821565755562807342
Kamala Harris,@KamalaHarris,2024-08-08T01:15:42.000Z,True,"Fighting for a brighter future may take hard work, but hard work is good work.",5.2K,4.8K,24K,874K,[],[],[],tweet_id:1821354567914688939
Kamala Harris,@KamalaHarris,2024-08-07T23:32:54.000Z,True,"The power is with the people. 

Tune in as Governor  and I speak with Michigan voters about what’s at stake in this election",2.5K,3.2K,14K,675K,[],['@Tim_Walz'],[],tweet_id:1821328696398975305
Kamala Harris,@KamalaHarris,2024-08-07T22:08:13.000Z,True,"In 90 days, the nation will know Coach Walz by a new title: Vice President of the United States of America.",4.8K,4.9K,30K,964K,[],[],[],tweet_id:1821307385115222524
Kamala Harris,@KamalaHarris,2024-08-07T19:10:54.000Z,True,"This election is a fight for our country, our future, and our fundamental freedoms and rights. 

That's why Governor  and I are in Wisconsin to fire up voters for November.",3.1K,4.1K,18K,672K,[],['@Tim_Walz'],[],tweet_id:1821262763802685465
Bon Iver,@boniver,2024-08-06T21:53:11.000Z,False,"Bon Iver will be performing tomorrow in Eau Claire at an event in support of Vice President .

It’s time to rally around the right candidate for President. One who will fight for women’s and trans rights, and govern with dignity and respect.http://bit.ly/vp-boniver",1.3K,1.2K,7.9K,832K,[],['@KamalaHarris'],[],tweet_id:1820941214671155208
Kamala Harris,@KamalaHarris,2024-08-07T14:46:54.000Z,True,"Three months until Election Day. 

Wisconsin and Michigan, can't wait to see you soon!",4.6K,5.4K,58K,1.8M,[],[],[],tweet_id:1821196322910679116
Kamala Harris,@KamalaHarris,2024-08-07T13:59:20.000Z,True,"With  by my side, and with all of you at our sides—let us fight for the promise of America’s future.",4.9K,9K,78K,1.6M,[],['@Tim_Walz'],[],tweet_id:1821184352408973407
Kamala Harris,@KamalaHarris,2024-08-07T02:13:15.000Z,True,"Let’s get to work, .",3.2K,7.4K,69K,1.4M,[],['@Tim_Walz'],[],tweet_id:1821006662989205540
Kamala Harris,@KamalaHarris,2024-08-07T02:20:07.000Z,True,Join our campaign:,785,661,4K,411K,[],[],[],tweet_id:1821008389146542225
Kamala Harris,@KamalaHarris,2024-08-07T00:30:38.000Z,True,"Coach Walz and I may hail from different corners of our great country, but our values are the same: We both believe in lifting people up, not knocking them down.",4.7K,9.2K,50K,1.3M,[],[],[],tweet_id:1820980836251861004
Tim Walz,@Tim_Walz,2024-08-06T23:33:58.000Z,True,"Over the next 91 days, and every day in the White House, I'll have ’ back—and we'll have yours. 

We just have to fight. As Kamala says: When we fight, we win. 

But we can’t do it alone. Join us:",1.5K,3.2K,18K,800K,[],['@KamalaHarris'],[],tweet_id:1820966576809545826
Tim Walz,@Tim_Walz,2024-08-06T23:21:16.000Z,True,"Like all regular people in America's heartland, JD Vance studied at Yale, had his career funded by Silicon Valley billionaires, and wrote a bestseller trashing that community. 

Come on.

I can't wait to debate the guy—that is, if he's willing to get off the couch and show up.",9.5K,26K,165K,6.6M,[],[],[],tweet_id:1820963380108157166
Kamala Harris,@KamalaHarris,2024-08-06T23:17:21.000Z,True,"Let’s compare ’s resume to that of Trump’s running mate, shall we?",4.1K,4.2K,24K,1.2M,[],['@Tim_Walz'],[],tweet_id:1820962394543165888
Tim Walz,@Tim_Walz,2024-08-06T23:07:36.000Z,True,"This election is about what direction the country will go in.

Donald Trump would damn sure take us backwards.

Don't believe him when he plays dumb: He knows exactly what Project 2025 will do to restrict our freedoms.",2.3K,8.6K,56K,1.2M,[],[],[],tweet_id:1820959939755446751
Tim Walz,@Tim_Walz,2024-08-06T23:03:18.000Z,True,"Minnesota's strength comes from our values: our commitment to working together and to lending a helping hand. 

These same values I learned on the family farm and took to Congress and the state capital.

Now,  and I are running to take them to the White House.",912,2.7K,19K,676K,[],['@KamalaHarris'],[],tweet_id:1820958859575353647
Tim Walz,@Tim_Walz,2024-08-06T23:01:54.000Z,True,"Thank you, , for the trust that you've placed in me. 

And maybe more so, thank you for bringing back the joy.

I couldn't be prouder to be on this ticket—and to help make you the next President of the United States.",2.6K,14K,97K,2M,[],['@KamalaHarris'],[],tweet_id:1820958506733703176
Tim Walz,@Tim_Walz,2024-08-06T22:54:10.000Z,True,"My dad served in the army during the Korean war.

With his encouragement, at 17, I joined the Army National Guard for 24 years.

Service gave me the strength of a shared commitment to something greater than ourselves. And just as it did for my dad and millions of others, the GI",3.6K,9.5K,68K,2M,[],[],[],tweet_id:1820956562875433010
Kamala Harris,@KamalaHarris,2024-08-06T22:57:40.000Z,True,"Donald Trump said he wants to punish women. And, as a result of his actions, today in America, one out of three women live in a state with a Trump Abortion Ban.",3.3K,3.8K,17K,576K,[],[],[],tweet_id:1820957442982764779
Tim Walz,@Tim_Walz,2024-08-06T22:46:57.000Z,True,". has fought on the side of the American people.

She took on predators and fraudsters, took down transnational gangs, and stood up against powerful corporate interests. 

And she's never hesitated to reach across the aisle if it meant improving people's lives.",911,2.6K,19K,644K,[],['@KamalaHarris'],[],tweet_id:1820954743428059603
Kamala Harris,@KamalaHarris,2024-08-06T22:37:03.000Z,True,"We are running a campaign on behalf of ALL Americans. 

If elected, we will govern on behalf of ALL Americans. 

With  and all of you at our side, let us fight for the promise of our future.",6.5K,6.7K,39K,1.3M,[],['@Tim_Walz'],[],tweet_id:1820952251227124065
Kamala Harris,@KamalaHarris,2024-08-06T22:29:39.000Z,True,". has defended the sacred freedom to vote.
 
As governor, he signed the most significant expansion of voting rights in Minnesota in over 50 years.
 
With his help, when I am president, we will finally pass the John Lewis Voting Rights Act and the Freedom to Vote Act.",3.1K,5.4K,28K,944K,[],['@Tim_Walz'],[],tweet_id:1820950390675808464
Kamala Harris,@KamalaHarris,2024-08-06T22:28:27.000Z,True,"Philadelphia, I launched my campaign for President of the United States a mere two weeks ago.

And it has been a bit of a whirlwind. 

But now, I can stand before you today to proudly announce: I am now officially the Democratic Nominee for President of the United States.",2.5K,5.7K,35K,1.1M,[],[],[],tweet_id:1820950087717060788
Kamala Harris,@KamalaHarris,2024-08-06T22:23:17.000Z,True,"At a time when acceptance was hard to find for LGBTQ+ students,  knew the signal it would send for a football coach to get involved in the Gay Straight Alliance.

So he signed on to be the group’s faculty advisor.",1.8K,6.8K,63K,1.8M,[],['@Tim_Walz'],[],tweet_id:1820948790271955116
Kamala Harris,@KamalaHarris,2024-08-06T22:20:48.000Z,True,". was the kind of teacher and mentor that every kid in America dreams of having and deserves.

The kind of coach who makes people feel like they belong, and inspires them to dream big.

And that’s the kind of Vice President he will be, too.",3.5K,5.9K,47K,1.2M,[],['@Tim_Walz'],[],tweet_id:1820948163517145145
Kamala Harris,@KamalaHarris,2024-08-06T22:13:37.000Z,True,"Since the day I announced my candidacy, I set out to find a partner who can help unite our nation and move us forward—a fighter for the middle class and patriot who believes in the promise of America.

I am here today because I found such a leader: Governor .",4.1K,12K,84K,1.9M,[],['@Tim_Walz'],[],tweet_id:1820946356095025425
Kamala Harris,@KamalaHarris,2024-08-06T21:26:08.000Z,True,"We love this nation and together, we will fight to build the future that people deserve.

Tune in now as Governor  and I rally voters in Philadelphia.",1.9K,4.7K,21K,727K,[],['@Tim_Walz'],[],tweet_id:1820934406791377232
Kamala Harris,@KamalaHarris,2024-08-06T20:45:03.000Z,True,". and I are in Pennsylvania for our first rally as your Democratic ticket. 

Tune in to our livestream here around 5:30pm ET to hear how we will move this country forward. 

See you soon, Philadelphia!",2.8K,5.2K,50K,1.4M,[],['@Tim_Walz'],[],tweet_id:1820924066632536565
Kamala Harris,@KamalaHarris,2024-08-06T19:13:13.000Z,True,"When I called  this morning to ask him to join our campaign, I shared my deep level of respect for him and the work we've done together. 

We're going to unify this country and we're going to win.

Let's go get this done.",10K,31K,202K,11M,[],['@Tim_Walz'],[],tweet_id:1820900959045685361
Kamala Harris,@KamalaHarris,2024-08-06T18:35:44.000Z,True,"Tonight at 6:20pm ET,  and I are hosting our first virtual grassroots fundraiser together. We would love for you to be there.

Donate any amount to join:",1.8K,4.6K,20K,3.2M,[],['@tim_walz'],[],tweet_id:1820891522176299464
Tim Walz,@Tim_Walz,2024-08-06T17:56:49.000Z,True,"Growing up, I learned to be generous toward my neighbors, compromise without compromising my values, and to work for the common good. and I both believe in that common good – in that fundamental promise of America. We’re ready to fight for it. And like she says:",3.9K,27K,131K,5.8M,[],['@KamalaHarris'],[],tweet_id:1820881730946977902
Tim Walz,@Tim_Walz,2024-08-06T14:34:50.000Z,True,"It is the honor of a lifetime to join  in this campaign.

I’m all in. 

Vice President Harris is showing us the politics of what’s possible. It reminds me a bit of the first day of school. 

So, let’s get this done, folks! Join us.",19K,42K,283K,8.9M,[],['@kamalaharris'],[],tweet_id:1820830898494791955
Kamala Harris,@KamalaHarris,2024-08-06T14:24:53.000Z,True,"I am proud to announce that I've asked  to be my running mate.

As a governor, a coach, a teacher, and a veteran, he's delivered for working families like his.

It's great to have him on the team.

Now let’s get to work. Join us:",32K,59K,381K,17M,[],['@Tim_Walz'],[],tweet_id:1820828396298879294
Kamala Harris,@KamalaHarris,2024-08-05T20:47:16.000Z,True,"Project 2025 is proof: If Donald Trump wins in November he will continue to attack equality, take away freedoms, and undermine our democracy.",10K,9.1K,37K,1.5M,[],[],[],tweet_id:1820562237041385706
Kamala Harris,@KamalaHarris,2024-08-05T19:28:00.000Z,True,"Generations of Americans before us led the fight for freedom. 

Now the baton is in our hands—each and every one of us. 

Join our fight:",4.3K,4.6K,19K,749K,[],[],[],tweet_id:1820542289904599434
Kamala Harris,@KamalaHarris,2024-08-05T16:39:01.000Z,True,"Let’s be clear: Someone who suggested the “termination” of the Constitution should never have the chance to stand behind the seal of the President of the United States. 

Never again.",12K,41K,236K,5.3M,[],[],[],tweet_id:1820499763713778080
Kamala Harris,@KamalaHarris,2024-08-04T22:26:26.000Z,True,"When we fight, we win.",7.8K,9.5K,44K,2.1M,[],[],[],tweet_id:1820224804571463800
Kamala Harris,@KamalaHarris,2024-08-04T20:46:05.000Z,True,"This election is a fight for our country, our future, and our most fundamental freedoms and rights. 

We believe in the promise of America—and we’re in this fight because we know what’s at stake.",6.8K,8.3K,42K,1.2M,[],[],[],tweet_id:1820199552823013866
Kamala Harris,@KamalaHarris,2024-08-04T18:32:01.000Z,True,"Donald Trump hand-picked three members of the Supreme Court who would overturn the protections of Roe v. Wade.

As he intended, they did—and now he wants to pass a nationwide abortion ban. 

I will not let that happen.",10K,16K,97K,2.6M,[],[],[],tweet_id:1820165811031384335
Kamala Harris,@KamalaHarris,2024-08-04T15:54:06.000Z,True,"As Attorney General, I took on Big Oil—and won.

As Vice President, I helped pass the largest-ever investment to take on the climate crisis.

And as President, I will keep up the fight.

I am grateful for your support , , , and .",8.6K,8.7K,38K,1.2M,[],"['@LCVoters', '@SierraClub', '@NRDC_Action', '@ce4america']",[],tweet_id:1820126072702107755
Kamala Harris,@KamalaHarris,2024-08-03T18:19:05.000Z,True,"Across the nation, we are witnessing a full-on attack on hard-won, hard-fought freedoms. 

Extremists attack the freedom to vote, our freedom to live safe from gun violence, and our reproductive freedom.

I say, bring it on—because we’re not going back.",8.9K,9.2K,42K,1.2M,[],[],[],tweet_id:1819800171363864665
