Name,Handle,Timestamp,Verified,Content,Comments,Retweets,Likes,Analytics,Tags,Mentions,Emojis,Tweet ID
Kamala Harris,@KamalaHarris,2024-09-01T18:59:00.000Z,True,"He said we should “punish” women who have an abortion.
He said he is “proud” of his role in ending Roe.
He unleashed extreme abortion bans across the country. 

Donald Trump’s record and position on reproductive freedom are clear.",12K,14K,57K,2.9M,[],[],[],tweet_id:1830319463884890498
Vice President Kamala Harris,@VP,2024-09-01T14:43:46.000Z,True,"On October 7, Hersh Goldberg-Polin — an American citizen — was taken hostage by Hamas terrorists. He was just 23 years old, attending a music festival with friends. We now know he was murdered by Hamas.

Doug and my prayers are with Jon Polin and Rachel Goldberg-Polin, Hersh's",7K,4.9K,20K,1.9M,[],[],[],tweet_id:1830255230123937864
Kamala Harris,@KamalaHarris,2024-09-01T00:02:26.000Z,True,The secret ingredient for my greens? Tabasco.,12K,5.3K,28K,5.5M,[],[],[],tweet_id:1830033436683215146
Kamala Harris,@KamalaHarris,2024-08-31T23:31:10.000Z,True,"On #OverdoseAwarenessDay, I am thinking of far too many Americans impacted by the scourge of opioids and fentanyl.

For the first time in five years, overdose deaths are declining. As President, I will continue the fight—using every tool at our disposal to end this crisis.",3.9K,1.7K,6.3K,741K,['#OverdoseAwarenessDay'],[],[],tweet_id:1830025570102477059
Kamala Harris,@KamalaHarris,2024-08-31T21:45:07.000Z,True,"Two middle-class kids.  

One, a daughter of Oakland, California, who was raised by a working mother and had a summer job at McDonald’s.   

The other, a son of the Nebraska plains, who spent summers on the farm.   

Only in America is it possible that the two of us would be",13K,11K,60K,3.3M,[],[],[],tweet_id:1829998879573442881
Kamala Harris,@KamalaHarris,2024-08-31T20:27:51.000Z,True,"Last week,  and I accepted the nomination for President and Vice President of the United States.

Our campaign will work every day until November—with joy, optimism, and faith—to win this fight.",6.2K,6.7K,28K,1.9M,[],['@Tim_Walz'],[],tweet_id:1829979434390114344
Kamala Harris,@KamalaHarris,2024-08-31T16:14:09.000Z,True,"As Vice President, I have had the privilege of visiting Arlington National Cemetery several times. It is a solemn place; a place where we come together to honor American heroes who have made the ultimate sacrifice in service of this nation.

It is not a place for politics.

And",50K,30K,137K,111M,[],[],[],tweet_id:1829915590468731167
Kamala Harris,@KamalaHarris,2024-08-31T14:52:09.000Z,True,"First, he got Roe overturned.
Then, he got abortion banned in 20 states.
Now he’s voting for an abortion ban in the state where he lives.

If elected, he’ll sign a nationwide abortion ban if it crosses his desk.",9.6K,11K,38K,4.3M,[],[],[],tweet_id:1829894952274231664
Kamala Harris,@KamalaHarris,2024-08-31T12:34:08.000Z,True,"Donald Trump is surrendering to his advisors who won't allow him to debate with a live microphone. If his own team doesn't have confidence in him, the American people definitely can’t.

We are running for President of the United States. Let’s debate in a transparent way—with the",30K,17K,75K,14M,[],[],[],tweet_id:1829860220912222335
Kamala Harris,@KamalaHarris,2024-08-30T20:15:15.000Z,True,"Donald Trump made his position clear when he hand-picked three Supreme Court justices to overturn Roe—which has decimated reproductive freedom and jeopardized IVF access for American women.

I have never wavered on this, so believe me when I say: I will always protect",10K,10K,43K,2.3M,[],[],[],tweet_id:1829613876951822381
Kamala Harris,@KamalaHarris,2024-08-30T15:18:23.000Z,True,"What would a second Trump administration look like?

Project 2025 lays it all out—and it’s extreme. 

We are not going back.",7.9K,6K,15K,836K,[],[],[],tweet_id:1829539169896435735
Kamala Harris,@KamalaHarris,2024-08-30T13:26:21.000Z,True,"Sometimes you hit the note, sometimes you don't.",4.6K,6K,30K,1.4M,[],[],[],tweet_id:1829510973964652791
Kamala Harris,@KamalaHarris,2024-08-30T02:01:39.000Z,True,"Donald Trump killed our bill to secure the border in order to help himself politically.

It would have added more border agents and allowed us to increase fentanyl seizures.

As President, I will make sure that bill gets back to my desk—and I will sign it.",17K,14K,57K,3.5M,[],[],[],tweet_id:1829338662854656424
Kamala Harris,@KamalaHarris,2024-08-30T01:43:47.000Z,True,"On day one of my administration, I will implement my plan for an opportunity economy.

This plan will bring down the cost of everyday goods, invest in America's small businesses, and extend the Child Tax Credit.",8.6K,4.9K,19K,1.2M,[],[],[],tweet_id:1829334166749491420
Kamala Harris,@KamalaHarris,2024-08-30T01:28:19.000Z,True,"The American people are ready for a new way forward.

Our former president has pushed an agenda that diminishes the character and strength of who we are as Americans, and divides our nation.

People are ready to turn the page.",10K,8.1K,34K,1.5M,[],[],[],tweet_id:1829330275823702247
Kamala Harris,@KamalaHarris,2024-08-30T00:10:33.000Z,True,"If given the chance, Donald Trump has made it clear he intends to end the Affordable Care Act—taking our country backwards.

We’re not going back. We are going forward.",4.2K,5.3K,18K,702K,[],[],[],tweet_id:1829310704932856176
Kamala Harris,@KamalaHarris,2024-08-29T23:40:22.000Z,True,Had to get a sweet treat at Dottie’s Market in Savannah.,3.9K,8.4K,74K,9.3M,[],[],[],tweet_id:1829303107429212229
Kamala Harris,@KamalaHarris,2024-08-29T22:07:38.000Z,True,"If Donald Trump wins, he will not only sign an abortion ban—he also intends to create a national anti-abortion coordinator, forcing states to report on women’s miscarriages and abortions.",14K,7.5K,25K,2.3M,[],[],[],tweet_id:1829279771978842194
Kamala Harris,@KamalaHarris,2024-08-29T21:06:00.000Z,True,"Our campaign is focused on the future of our nation—we are not going back. 

Tune in as I rally voters in Savannah.",3.5K,3.6K,14K,589K,[],[],[],tweet_id:1829264261719437386
Kamala Harris,@KamalaHarris,2024-08-29T19:28:05.000Z,True,"Our campaign is one for all Americans, from red states to blue states, from the heartland to the coasts. 

And when elected, we will govern on behalf of ALL Americans.",5.1K,5.1K,21K,845K,[],[],[],tweet_id:1829239620187349438
Kamala Harris,@KamalaHarris,2024-08-29T16:41:00.000Z,True,"Donald Trump’s Project 2025 plan would give him unchecked, unprecedented power to implement his extreme agenda—including monitoring pregnancies and prosecuting women if they have an abortion.

The stakes this November could not be higher.",11K,4.8K,15K,4M,[],[],[],tweet_id:1829197573124444182
Kamala Harris,@KamalaHarris,2024-08-29T13:59:21.000Z,True,"900 pages that would hand Donald Trump unprecedented power to:

Ban abortion nationwide.
Rip away affordable health care.
Cancel student loan relief.
And much more.

We will defeat his dangerous Project 2025 agenda at the ballot box in November.",10K,10K,28K,1.5M,[],[],[],tweet_id:1829156891513045380
Kamala Harris,@KamalaHarris,2024-08-29T00:39:20.000Z,True,"Thank you, Savannah. 

I look forward to day two of our Georgia bus tour tomorrow.",3.5K,5.3K,31K,950K,[],[],[],tweet_id:1828955561250980056
Kamala Harris,@KamalaHarris,2024-08-28T21:12:01.000Z,True,"Our campaign is not just about us versus Donald Trump. It is about two different visions for our nation: One focused on the future, the other on the past. 

We fight for the future.",17K,9.2K,44K,14M,[],[],[],tweet_id:1828903386663506087
Kamala Harris,@KamalaHarris,2024-08-28T19:30:08.000Z,True,"Emmett Till was murdered in 1955. He was only 14 years old. 

As a U.S. senator, I led the effort to make lynching a federal hate crime. 

As Vice President, I proudly stood beside  as he signed the Emmett Till Antilynching Act into law.

As President, I will continue",8.1K,13K,68K,4.2M,[],['@JoeBiden'],[],tweet_id:1828877747650691247
Kamala Harris,@KamalaHarris,2024-08-28T16:00:29.000Z,True,"The March on Washington was a call to action for our nation. 

Inspired by the passion and purpose of that day, Americans secured the passage of the Civil Rights Act of 1964, the Voting Rights Act of 1965, and more.

Today, we recommit ourselves to the fight for equality,",3.1K,2.9K,11K,588K,[],[],[],tweet_id:1828824985571377211
Kamala Harris,@KamalaHarris,2024-08-28T12:08:58.000Z,True,"Project 2025 is the blueprint for Trump to make himself the most powerful president ever. 

We can’t let him win.

Watch our new ad:",12K,13K,33K,3.5M,[],[],[],tweet_id:1828766724012867803
Kamala Harris,@KamalaHarris,2024-08-27T21:11:05.000Z,True,Join our fight: http://kamalaharris.link/ChipIn,6.1K,4.3K,17K,682K,[],[],[],tweet_id:1828540765204549958
Kamala Harris,@KamalaHarris,2024-08-27T19:31:00.000Z,True,"Even if aspiring homeowners save for years, it is often still not enough. 

My administration will provide first-time homebuyers with $25,000 to help with the down payment on a new home.",21K,8.9K,44K,35M,[],[],[],tweet_id:1828515578165723267
Kamala Harris,@KamalaHarris,2024-08-27T18:30:06.000Z,True,"As Attorney General of California, I took on one of our country’s largest for-profit colleges that scammed students. Donald Trump ran a for-profit college that scammed students. 

And as Attorney General, I held Wall Street banks accountable for fraud. Donald Trump was found",6K,6.9K,27K,1.3M,[],[],[],tweet_id:1828500252195786949
Kamala Harris,@KamalaHarris,2024-08-27T13:30:05.000Z,True,"70 days until Election Day.

Let’s get this done.",12K,14K,109K,4.5M,[],[],[],tweet_id:1828424751242522687
Kamala Harris,@KamalaHarris,2024-08-27T11:02:24.000Z,True,"My mother saved for years to buy a home. I was a teenager when that day finally came—I remember how excited she was.

Right now, home ownership is out of reach for too many Americans.

When I am President, we will end the housing shortage by building 3 million homes and rentals.",13K,8.2K,34K,2.3M,[],[],[],tweet_id:1828387584101237162
Kamala Harris,@KamalaHarris,2024-08-26T22:33:00.000Z,True,"We must protect the freedom that unlocks all other freedoms: our sacred right to vote. 

Americans have the opportunity to get the John Lewis Voting Rights Act and the Freedom to Vote Act passed—and as President, I will proudly sign it into law.",6.5K,5.3K,21K,1.2M,[],[],[],tweet_id:1828198992838029561
Kamala Harris,@KamalaHarris,2024-08-26T20:25:06.000Z,True,"I see a nation ready to move forward. 

Join us for the next step in the incredible journey that is America:",4.5K,3.1K,11K,652K,[],[],[],tweet_id:1828166804096565683
Kamala Harris,@KamalaHarris,2024-08-26T18:30:11.000Z,True,"From the courthouse to the White House, fighting for the American people has been my life's work.",11K,9.6K,57K,1.5M,[],[],[],tweet_id:1828137883984605421
Kamala Harris,@KamalaHarris,2024-08-26T16:54:48.000Z,True,"Women’s Equality Day marks a monumental step forward in expanding voting rights.

The best way to honor the generations of women who paved the way is to vote and protect our reproductive freedoms at the ballot box.

Make sure you’re registered at http://IWillVote.com.",3.6K,3.6K,11K,654K,[],[],[],tweet_id:1828113879391707348
Kamala Harris,@KamalaHarris,2024-08-26T12:08:06.000Z,True,I want every little girl across our country to know this: You can do anything—even if it has never been done before.,8.7K,11K,68K,3.3M,[],[],[],tweet_id:1828041729670299955
Kamala Harris,@KamalaHarris,2024-08-26T01:07:00.000Z,True,"As President, I will never waver in defense of America's security and ideals, because in the enduring struggle between democracy and tyranny, I know where I stand—and I know where the United States belongs.",12K,7.1K,35K,8.3M,[],[],[],tweet_id:1827875358772695514
Kamala Harris,@KamalaHarris,2024-08-25T19:32:26.000Z,True,"It is our turn to do what generations before us have done—to fight for this country we love, and the ideals we cherish.

So, let’s get out there and fight for it.

And, together, let us write the next great chapter in the most extraordinary story ever told.",6.5K,8.7K,34K,1M,[],[],[],tweet_id:1827791160955285972
Kamala Harris,@KamalaHarris,2024-08-24T21:34:00.000Z,True,"Trump hand-picked three members of the Supreme Court because he intended for them to overturn Roe v Wade—as he intended, they did.

If he is re-elected, we know he will sign a national abortion ban.

As President, I will restore reproductive freedom.",15K,16K,81K,2.6M,[],[],[],tweet_id:1827459367920185795
Kamala Harris,@KamalaHarris,2024-08-24T18:15:26.000Z,True,"Under my economic plan, more than 100 million Americans will get a tax cut.

We will do this by restoring and expanding the Earned Income Tax Credit and the Child Tax Credit.",12K,8K,32K,1.8M,[],[],[],tweet_id:1827409398307738007
Kamala Harris,@KamalaHarris,2024-08-23T20:17:30.000Z,True,I accept your nomination to be the President of the United States of America.,43K,14K,96K,7.3M,[],[],[],tweet_id:1827077726173384855
Kamala Harris,@KamalaHarris,2024-08-23T16:00:52.000Z,True,"Together, let us write the next great chapter in the most extraordinary story ever told.",6.5K,7.1K,40K,1M,[],[],[],tweet_id:1827013143433826634
Kamala Harris,@KamalaHarris,2024-08-23T05:26:43.000Z,True,"That's a wrap on . Next stop: Election Day. 

Help us win: https://go.kamalaharris.com",7.1K,13K,112K,2.3M,[],['@demconvention'],[],tweet_id:1826853556441215202
Kamala Harris,@KamalaHarris,2024-08-23T05:18:20.000Z,True,"Donald Trump and his allies would limit access to birth control, ban medication abortion, and enact a nationwide abortion ban.

Simply put, they are out of their minds.",9.3K,10K,44K,1.5M,[],[],[],tweet_id:1826851447071178896
Kamala Harris,@KamalaHarris,2024-08-23T05:12:36.000Z,True,"We know what a second Trump term would look like. It's all laid out in Project 2025, written by his closest advisors. 

And its sum total is to pull our country back to the past. 

But America: We are not going back.",9K,6.5K,29K,1.1M,[],[],[],tweet_id:1826850000556490876
Kamala Harris,@KamalaHarris,2024-08-23T04:04:08.000Z,True,"With this election, our nation has a precious, fleeting opportunity to move past the bitterness, cynicism, and divisive battles of the past.

A chance to chart a new way forward.",3.7K,5.4K,29K,936K,[],[],[],tweet_id:1826832772507340801
Kamala Harris,@KamalaHarris,2024-08-23T04:02:05.000Z,True,"It is now our turn to do what generations before us have done.
 
Guided by optimism and faith, to fight for this country we love. 
 
So let’s get out there, and let’s fight for it. 
 
Let’s get out there, and let’s vote for it.",4.2K,10K,57K,1.1M,[],[],[],tweet_id:1826832256582746218
Kamala Harris,@KamalaHarris,2024-08-23T03:24:18.000Z,True,"This election is not only the most important of our lives, it is one of the most important in the life of our nation.

In many ways, Donald Trump is an unserious man—but the consequences of putting him back in the White House are extremely serious.

And we’re not going back.",10K,10K,59K,12M,[],[],[],tweet_id:1826822746640154989
Kamala Harris,@KamalaHarris,2024-08-23T03:15:21.000Z,True,"I believe America cannot be prosperous unless Americans are fully able to make decisions about their own lives, especially on matters of heart and home.

When Congress passes the bill to restore reproductive freedoms, as President, I will proudly sign it into law.",2.9K,4.2K,24K,757K,[],[],[],tweet_id:1826820494869270630
Kamala Harris,@KamalaHarris,2024-08-23T03:11:40.000Z,True,"As President, I will grow our economy.
 
And I’ll lower the cost of everyday needs like healthcare, housing, and groceries.",26K,8.2K,46K,20M,[],[],[],tweet_id:1826819568293064954
Kamala Harris,@KamalaHarris,2024-08-23T03:10:52.000Z,True,"The middle class is where I come from. My mother taught us that opportunity is not available to everyone.

That's why we will create what I call an opportunity economy, where everyone has the chance to compete and succeed.",4.8K,3.1K,17K,875K,[],[],[],tweet_id:1826819365532037418
Kamala Harris,@KamalaHarris,2024-08-23T02:59:41.000Z,True,"On behalf of everyone whose story could only be written in the greatest nation on Earth, I accept your nomination to be the President of the United States of America.",10K,19K,152K,5.4M,[],[],[],tweet_id:1826816550931702207
Kamala Harris,@KamalaHarris,2024-08-23T01:00:53.000Z,True,"This election is a fight for our country, our future, and our fundamental freedoms and rights.

Tune in as I take the stage tonight as the Democratic nominee for President of the United States.",2.7K,3.9K,17K,1.5M,[],[],[],tweet_id:1826786655631708434
Kamala Harris,@KamalaHarris,2024-08-22T18:53:44.000Z,True,"To the best partner I could ask for: Happy anniversary, Dougie.",4.5K,5.4K,66K,1.9M,[],[],[],tweet_id:1826694258184913025
Kamala Harris,@KamalaHarris,2024-08-22T04:15:18.000Z,True,"Soon, the nation will know Coach Walz by another title: Vice President of the United States of America.

Pitch in to our grassroots campaign:",3.5K,2.3K,12K,550K,[],[],[],tweet_id:1826473195223806032
Tim Walz,@Tim_Walz,2024-08-22T03:44:42.000Z,True,"Growing up in a small town like Butte, Nebraska – you learn to take care of each other.

The family down the road may not think, pray, or love like you – but they are your neighbors and you look out for them.",2.9K,4.2K,22K,891K,[],[],[],tweet_id:1826465492950712388
Tim Walz,@Tim_Walz,2024-08-22T03:33:17.000Z,True,"We’re all here tonight for one beautiful, simple reason:

We love this country!",3.2K,5.4K,54K,1.2M,[],[],[],tweet_id:1826462622348202071
Gwen Walz,@GwenWalz,2024-08-22T03:19:14.000Z,True,"I’ve loved Tim since we were teachers at the same high school.

Whether it’s on a farm, fishing boat, or football field, his commitment to service comes from the values we grew up with.

I’m so happy the world now gets to know him.",1.3K,10K,73K,1.4M,[],[],[],tweet_id:1826459084347867293
Kamala Harris,@KamalaHarris,2024-08-22T03:28:28.000Z,True,"The stage is yours, . Enjoy the moment.",3.7K,4.7K,36K,1M,[],['@Tim_Walz'],[],tweet_id:1826461408705319284
Kamala Harris,@KamalaHarris,2024-08-22T01:33:26.000Z,True,"Tim Walz: America’s coach—and the next Vice President of the United States. 

Proud to be in this together.",3.6K,4.8K,27K,829K,[],[],[],tweet_id:1826432458117509213
Kamala Harris,@KamalaHarris,2024-08-22T01:04:34.000Z,True,"Governor, congressman, dad, husband, coach. 

Soon, our nation will know Governor  as Vice President of the United States of America. 

Tune in now for day three of the Democratic National Convention.",1.9K,1.9K,9.7K,383K,[],['@Tim_Walz'],[],tweet_id:1826425196607049765
Kamala Harris,@KamalaHarris,2024-08-21T22:20:18.000Z,True,"Wisconsin: with your help this November, we will win.",2.7K,3.2K,18K,501K,[],[],[],tweet_id:1826383857672687636
Kamala Harris,@KamalaHarris,2024-08-21T15:01:04.000Z,True,"Thank you, Milwaukee.",4K,7.2K,56K,1M,[],[],[],tweet_id:1826273321178022030
Kamala Harris,@KamalaHarris,2024-08-21T13:01:01.000Z,True,"Milwaukee: we came together because we all deeply love and believe in our country. 

That’s the promise of America.",3K,3.4K,21K,536K,[],[],[],tweet_id:1826243106171211875
Kamala Harris,@KamalaHarris,2024-08-21T05:39:41.000Z,True,"I am honored to be the nominee for President of the United States. 

 Now, let’s get to work.",10K,17K,146K,3.1M,[],[],[],tweet_id:1826132042863538529
Kamala Harris,@KamalaHarris,2024-08-21T03:29:45.000Z,True,"Love you, Dougie.",3.8K,10K,142K,7.7M,[],[],[],tweet_id:1826099344610652178
Kamala Harris,@KamalaHarris,2024-08-21T02:52:20.000Z,True,"We’re fighting for a future where we love thy neighbor and, in the face of a stranger, we see a neighbor.",3.1K,3.4K,17K,554K,[],[],[],tweet_id:1826089929299886464
Kamala Harris,@KamalaHarris,2024-08-21T01:08:35.000Z,True,"True patriotism means fighting to make our nation better for each generation.

Tune in now for day two of the Democratic National Convention.",2.3K,2.2K,10K,445K,[],[],[],tweet_id:1826063818461687938
Kamala Harris,@KamalaHarris,2024-08-21T00:48:05.000Z,True,"Our campaign is working to ensure every voice is heard this November.

We are proud to launch our Latinos con Harris-Walz WhatApp Channel—where voters can connect with our grassroots movement.

Join now: https://kamalaharris.link/JoinWhatsApp",526,784,3.2K,327K,[],[],[],tweet_id:1826058659375333463
Kamala Harris,@KamalaHarris,2024-08-20T21:15:22.000Z,True,"This November, we will come together and declare with one voice, as one people: we are moving forward.",4.3K,4.5K,26K,721K,[],[],[],tweet_id:1826005128836464643
Kamala Harris,@KamalaHarris,2024-08-20T19:19:21.000Z,True,"Now is the time to chart a new way forward—to build an America where everyone's work is rewarded and talents are valued, where we work with labor and business to strengthen the American economy, and where everyone has the opportunity to thrive.",2.4K,2K,10K,463K,[],[],[],tweet_id:1825975928964448349
Kamala Harris,@KamalaHarris,2024-08-20T15:10:18.000Z,True,I am grateful to have the support of my friend Jerome Bettis. You might know him by his nickname…The Bus.,2.9K,3.7K,24K,1M,[],[],[],tweet_id:1825913257082646582
Kamala Harris,@KamalaHarris,2024-08-20T14:10:28.000Z,True,"Let us fight for the ideals we hold dear. 

And let us always remember—when we fight, we win.",4.4K,3.8K,18K,549K,[],[],[],tweet_id:1825898196624658702
Kamala Harris,@KamalaHarris,2024-08-20T04:33:34.000Z,True,"We love you, Joe.",4.6K,10K,76K,1.8M,[],[],[],tweet_id:1825753015497662642
Kamala Harris,@KamalaHarris,2024-08-20T02:40:21.000Z,True,"Thank you, , for your historic leadership and for all you continue to do. 

We are forever grateful.",4.8K,7.4K,43K,904K,[],['@JoeBiden'],[],tweet_id:1825724522844062193
Kamala Harris,@KamalaHarris,2024-08-20T01:55:39.000Z,True,It is so great to be back in Chicago.,3.5K,8.9K,91K,2.3M,[],[],[],tweet_id:1825713275369304258
Kamala Harris,@KamalaHarris,2024-08-19T22:13:09.000Z,True,"Together, we will fight for the promise of America’s future. Tune in now to watch the first night of the Democratic National Convention.",3.3K,3.5K,13K,580K,[],[],[],tweet_id:1825657281674920210
Kamala Harris,@KamalaHarris,2024-08-19T19:16:21.000Z,True,"We had a great time on our bus tour through Western Pennsylvania yesterday. 

Next stop: the Democratic National Convention.",2.1K,2.7K,18K,679K,[],[],[],tweet_id:1825612786832945451
Kamala Harris,@KamalaHarris,2024-08-19T02:35:20.000Z,True,"Today, we met with high school students, first responders, and volunteers across Pennsylvania. 

It couldn’t have been a better day.",2.9K,4K,25K,1.2M,[],[],[],tweet_id:1825360874522947804
Kamala Harris,@KamalaHarris,2024-08-19T00:57:52.000Z,True,Teamwork.,9.9K,6.9K,80K,3.6M,[],[],[],tweet_id:1825336346933633176
Kamala Harris,@KamalaHarris,2024-08-18T19:38:20.000Z,True,Our Harris-Walz bus tour is on the road in Pennsylvania.,3.2K,5.4K,34K,3.1M,[],[],[],tweet_id:1825255934144217381
Tim Walz,@Tim_Walz,2024-08-18T18:02:43.000Z,True,Road trip.,2.8K,7.6K,66K,1.3M,[],[],[],tweet_id:1825231868104524126
Kamala Harris,@KamalaHarris,2024-08-18T15:00:23.000Z,True,"My administration will provide first-time homebuyers with $25,000 to help with the down payment on a new home.",13K,4.6K,15K,2.3M,[],[],[],tweet_id:1825185984272577018
Doug Emhoff,@DouglasEmhoff,2024-08-17T23:14:46.000Z,True,". and I are celebrating our 10-year anniversary next week.

Not much has changed since our wedding day—well, except that she’s running for president now.",1.6K,5K,37K,855K,[],['@KamalaHarris'],[],tweet_id:1824948010675007539
Kamala Harris,@KamalaHarris,2024-08-17T22:42:00.000Z,True,"Our Harris-Walz Administration will move this country forward.

Trump and Vance’s extreme Project 2025 agenda will roll back Americans’ rights and freedoms—including reproductive rights, hurt the middle class, and threaten our democracy.",6K,4.3K,18K,911K,[],[],[],tweet_id:1824939765193376232
Tim Walz,@Tim_Walz,2024-08-17T19:52:34.000Z,True,"It feels pretty darn good to be home, Nebraska.

With just 80 days to go, we’re here to fire up voters. Watch live.",1.9K,4K,21K,710K,[],[],[],tweet_id:1824897127668982003
Kamala Harris,@KamalaHarris,2024-08-17T18:09:16.000Z,True,"Donald Trump fights for billionaires and large corporations.

I will fight to give money back to working and middle-class Americans.",7.9K,6.7K,28K,992K,[],[],[],tweet_id:1824871128071876802
Kamala Harris,@KamalaHarris,2024-08-17T16:38:00.000Z,True,"Building up the middle class will be a defining goal of my presidency. 

Because when the middle class is strong, America is strong.",9.1K,6.1K,31K,1.5M,[],[],[],tweet_id:1824848162030244004
Kamala Harris,@KamalaHarris,2024-08-17T15:30:38.000Z,True,"I grew up in a middle-class household. For most of my childhood, we were renters.

My mother saved for well over a decade to buy a home. I was a teenager when the day finally came—and I can still remember how excited she was.

In college, I worked at McDonald’s to earn spending",14K,25K,151K,6.4M,[],[],[],tweet_id:1824831207839818148
Kamala Harris,@KamalaHarris,2024-08-16T21:08:06.000Z,True,"At this moment when everyday prices are too high, Donald Trump will make them even higher.",13K,3.8K,10K,1.3M,[],[],[],tweet_id:1824553748187771113
Kamala Harris,@KamalaHarris,2024-08-16T19:21:12.000Z,True,"If you want to know who a politician cares about, look at who they fight for.

Donald Trump fights for billionaires and large corporations.

I will fight to give money back to working and middle-class Americans.",9.3K,10K,46K,1.5M,[],[],[],tweet_id:1824526846295261202
Kamala Harris,@KamalaHarris,2024-08-16T18:59:25.000Z,True,We will make sure these new homes actually go to working and middle-class Americans—not just investors.,4.7K,4.6K,22K,827K,[],[],[],tweet_id:1824521362616078615
